_type,author,body,created,id,parentId,subreddit,url,link,selftext,title
snscrape.modules.reddit.Comment,All-Hail-The-Ale,love know thoughts bud tried,2022-04-24T09:36:01+00:00,t1_i5zdu10,t1_i5z36ce,alcoholfreebeer,https://old.reddit.com/r/alcoholfreebeer/comments/u9k5al/northern_monk_holy_faith_af_for_alcohol_free_april/i5zdu10/,,,
snscrape.modules.reddit.Comment,brawlidol,oh yes fridge waiting,2022-04-24T07:09:49+00:00,t1_i5z36ce,t3_u9k5al,alcoholfreebeer,https://old.reddit.com/r/alcoholfreebeer/comments/u9k5al/northern_monk_holy_faith_af_for_alcohol_free_april/i5z36ce/,,,
snscrape.modules.reddit.Comment,brawlidol,really good na beers us ones actually try,2022-04-21T13:21:40+00:00,t1_i5m3fac,t3_u81nd6,alcoholfreebeer,https://old.reddit.com/r/alcoholfreebeer/comments/u81nd6/probably_the_best_na_beer_in_the_world/i5m3fac/,,,
snscrape.modules.reddit.Comment,Mash__Gang,years experimentation hard make home especially highest quality need thousand bucks worth kit also like trying worlds best sourdough baker without baking experience like things start fundamentals first learn rules break good news took months get homebrewing kit production brewer take pinch salt days week months,2022-04-20T17:19:58+00:00,t1_i5i7h5q,t3_u4rewj,alcoholfreebeer,https://old.reddit.com/r/alcoholfreebeer/comments/u4rewj/whats_a_good_recipe_for_high_quality_nonalcoholic/i5i7h5q/,,,
snscrape.modules.reddit.Comment,FlyingKev,ssh actually tiny kölsch glass,2022-04-19T11:49:55+00:00,t1_i5bxa6s,t1_i5bqos7,alcoholfreebeer,https://old.reddit.com/r/alcoholfreebeer/comments/u5hscd/theodor_schiøtz_brewing_company_anarkist_snehvede/i5bxa6s/,,,
snscrape.modules.reddit.Comment,FreeBeer_UK,bottle,2022-04-19T10:39:09+00:00,t1_i5bqos7,t3_u5hscd,alcoholfreebeer,https://old.reddit.com/r/alcoholfreebeer/comments/u5hscd/theodor_schiøtz_brewing_company_anarkist_snehvede/i5bqos7/,,,
snscrape.modules.reddit.Comment,FlyingKev,regular beer hard brew needs lot prep even two blokes shed home brewing setup takes day work despite largely automated follow recipe difficult expensive tried af brewing yet believe yeasts limitedly available cut around abv,2022-04-17T07:31:48+00:00,t1_i522efl,t3_u4rewj,alcoholfreebeer,https://old.reddit.com/r/alcoholfreebeer/comments/u4rewj/whats_a_good_recipe_for_high_quality_nonalcoholic/i522efl/,,,
snscrape.modules.reddit.Comment,jonpacker,na beer hard make well going going need good making regular beer first,2022-04-16T17:15:05+00:00,t1_i4z957b,t1_i4xswuv,alcoholfreebeer,https://old.reddit.com/r/alcoholfreebeer/comments/u4rewj/whats_a_good_recipe_for_high_quality_nonalcoholic/i4z957b/,,,
snscrape.modules.reddit.Comment,LivingOrganics420,think,2022-04-16T09:49:03+00:00,t1_i4xv88k,t1_i4xt7y5,alcoholfreebeer,https://old.reddit.com/r/alcoholfreebeer/comments/u4rewj/whats_a_good_recipe_for_high_quality_nonalcoholic/i4xv88k/,,,
snscrape.modules.reddit.Comment,minnis93,unlikely brutally honest far harder normal beer exactly easy begin,2022-04-16T09:19:32+00:00,t1_i4xt7y5,t1_i4xt1u7,alcoholfreebeer,https://old.reddit.com/r/alcoholfreebeer/comments/u4rewj/whats_a_good_recipe_for_high_quality_nonalcoholic/i4xt7y5/,,,
snscrape.modules.reddit.Comment,LivingOrganics420,still possible make high quality na beer home,2022-04-16T09:17:09+00:00,t1_i4xt1u7,t1_i4xikcb,alcoholfreebeer,https://old.reddit.com/r/alcoholfreebeer/comments/u4rewj/whats_a_good_recipe_for_high_quality_nonalcoholic/i4xt1u7/,,,
snscrape.modules.reddit.Comment,LivingOrganics420,never made life,2022-04-16T09:15:07+00:00,t1_i4xswuv,t1_i4xikcb,alcoholfreebeer,https://old.reddit.com/r/alcoholfreebeer/comments/u4rewj/whats_a_good_recipe_for_high_quality_nonalcoholic/i4xswuv/,,,
snscrape.modules.reddit.Comment,minnis93,would assume seen enough reddit know whilst likely guarantee hence asked,2022-04-16T07:47:54+00:00,t1_i4xmw02,t1_i4xlv5l,alcoholfreebeer,https://old.reddit.com/r/alcoholfreebeer/comments/u4rewj/whats_a_good_recipe_for_high_quality_nonalcoholic/i4xmw02/,,,
snscrape.modules.reddit.Comment,jonpacker,made forget old school tips like heating beer evaporate think best bet homebrewer brew low og beer aiming thing makes lot beers taste thin watery residual sweetness acidity normally get bigger mash going want add lactose fg bit acid give numbers still working one thing reaaaally careful hops easy make something undrinkably bitter tastes like hop tea minuscule amount hops apart start experimenting,2022-04-16T07:39:10+00:00,t1_i4xm9ns,t3_u4rewj,alcoholfreebeer,https://old.reddit.com/r/alcoholfreebeer/comments/u4rewj/whats_a_good_recipe_for_high_quality_nonalcoholic/i4xm9ns/,,,
snscrape.modules.reddit.Comment,jonpacker,would assume op homebrewer asking never made beer,2022-04-16T07:33:37+00:00,t1_i4xlv5l,t1_i4xikcb,alcoholfreebeer,https://old.reddit.com/r/alcoholfreebeer/comments/u4rewj/whats_a_good_recipe_for_high_quality_nonalcoholic/i4xlv5l/,,,
snscrape.modules.reddit.Comment,minnis93,experience brewing regular beer lot af beer brewers nowadays brewery instead hire collaboration local brewery sort thing whip afternoon like batch cookies,2022-04-16T06:49:02+00:00,t1_i4xikcb,t3_u4rewj,alcoholfreebeer,https://old.reddit.com/r/alcoholfreebeer/comments/u4rewj/whats_a_good_recipe_for_high_quality_nonalcoholic/i4xikcb/,,,
snscrape.modules.reddit.Comment,nuovaforma,bad still hitting flavour profile,2022-04-15T23:40:24+00:00,t1_i4w8eea,t1_hzosmwn,alcoholfreebeer,https://old.reddit.com/r/alcoholfreebeer/comments/t1hqo3/looking_for_an_esb/i4w8eea/,,,
snscrape.modules.reddit.Comment,FreeBeer_UK,right one,2022-04-11T17:24:59+00:00,t1_i4bhbs0,t1_i0337mb,alcoholfreebeer,https://old.reddit.com/r/alcoholfreebeer/comments/tab11k/happy_af_alcohol_free_black_forest_gateaux_stout/i4bhbs0/,,,
snscrape.modules.reddit.Comment,brawlidol,overly moderate honey sweetness quite floral,2022-04-07T18:29:15+00:00,t1_i3slzml,t1_i3r4d94,alcoholfreebeer,https://old.reddit.com/r/alcoholfreebeer/comments/txno1v/not_a_beer_but_a_low_alcohol_05_hopped_mead/i3slzml/,,,
snscrape.modules.reddit.Comment,FreeBeer_UK,never actually tried mead sweet,2022-04-07T12:12:28+00:00,t1_i3r4d94,t3_txno1v,alcoholfreebeer,https://old.reddit.com/r/alcoholfreebeer/comments/txno1v/not_a_beer_but_a_low_alcohol_05_hopped_mead/i3r4d94/,,,
snscrape.modules.reddit.Comment,brawlidol,drop brewers message see ship overseas try stockists see delivery covers sending food across pond vice versa seem full redtape though unless actually made food home,2022-04-07T05:26:31+00:00,t1_i3q7gl6,t1_i3p103r,alcoholfreebeer,https://old.reddit.com/r/alcoholfreebeer/comments/txno1v/not_a_beer_but_a_low_alcohol_05_hopped_mead/i3q7gl6/,,,
snscrape.modules.reddit.Comment,stretchman_88,way miss mead thought low mead would never exist jealous bountiful offerings across us yanks,2022-04-06T23:31:53+00:00,t1_i3p103r,t3_txno1v,alcoholfreebeer,https://old.reddit.com/r/alcoholfreebeer/comments/txno1v/not_a_beer_but_a_low_alcohol_05_hopped_mead/i3p103r/,,,
snscrape.modules.reddit.Comment,Mash__Gang,gonna small restock next week gen,2022-03-26T13:01:48+00:00,t1_i26rqtm,t3_tmdlvg,alcoholfreebeer,https://old.reddit.com/r/alcoholfreebeer/comments/tmdlvg/suns_out_brewskis_out_lovely_and_crisp_peppery/i26rqtm/,,,
snscrape.modules.reddit.Comment,phrogpilot73,happen well mainly suspect combination unfermentable sugars case af beers removed vice af start along trace amounts leading slight dehydration four yesterday enough water bed woke slight headache fingers slightly swollen indicators dehydration couple glasses water fine,2022-03-23T15:54:25+00:00,t1_i1t4tp8,t3_s4ebbi,alcoholfreebeer,https://old.reddit.com/r/alcoholfreebeer/comments/s4ebbi/af_beer_hangovers/i1t4tp8/,,,
snscrape.modules.reddit.Comment,phrogpilot73,super excited heard every pub ireland coming us still seen sale wandered publix north carolina business trip grabbed four pack plastic pint glass see like reminds every bit guinness tastes like takes back trips ireland might stock couple four packs head home,2022-03-23T15:29:51+00:00,t1_i1t0yfg,t1_i18ee63,alcoholfreebeer,https://old.reddit.com/r/alcoholfreebeer/comments/tf0som/guinness_00_now_available_in_usa/i1t0yfg/,,,
snscrape.modules.reddit.Comment,brawlidol,yes jever fun becks,2022-03-23T15:16:26+00:00,t1_i1sytzf,t1_i1oe7s0,alcoholfreebeer,https://old.reddit.com/r/alcoholfreebeer/comments/tk59hb/i_dont_like_most_of_the_af_beers_but_jever_fun_is/i1sytzf/,,,
snscrape.modules.reddit.Comment,Hybbybyyuu,clean glass slightest hints grease soap kill foam right pouring technique usually hold bottle glass angle glass half full slowly tilt glass upright,2022-03-23T07:01:34+00:00,t1_i1rlx0m,t1_i1q9ddy,alcoholfreebeer,https://old.reddit.com/r/alcoholfreebeer/comments/tk59hb/i_dont_like_most_of_the_af_beers_but_jever_fun_is/i1rlx0m/,,,
snscrape.modules.reddit.Comment,stretchman_88,really trying learn different pours specific ales beers also get appropriate thickness head love pour pointers resources,2022-03-22T23:38:40+00:00,t1_i1q9ddy,t3_tk59hb,alcoholfreebeer,https://old.reddit.com/r/alcoholfreebeer/comments/tk59hb/i_dont_like_most_of_the_af_beers_but_jever_fun_is/i1q9ddy/,,,
snscrape.modules.reddit.Comment,FreeBeer_UK,probably one worst named beers ever great little pilsner crisp clean,2022-03-22T20:48:28+00:00,t1_i1pkid1,t3_tk59hb,alcoholfreebeer,https://old.reddit.com/r/alcoholfreebeer/comments/tk59hb/i_dont_like_most_of_the_af_beers_but_jever_fun_is/i1pkid1/,,,
snscrape.modules.reddit.Comment,Hybbybyyuu,yup really enjoy jever beck want pils two think,2022-03-22T16:16:48+00:00,t1_i1oe7s0,t1_i1odsxb,alcoholfreebeer,https://old.reddit.com/r/alcoholfreebeer/comments/tk59hb/i_dont_like_most_of_the_af_beers_but_jever_fun_is/i1oe7s0/,,,
snscrape.modules.reddit.Comment,FlyingKev,good example drier north german pilsener style,2022-03-22T16:14:11+00:00,t1_i1odsxb,t3_tk59hb,alcoholfreebeer,https://old.reddit.com/r/alcoholfreebeer/comments/tk59hb/i_dont_like_most_of_the_af_beers_but_jever_fun_is/i1odsxb/,,,
snscrape.modules.reddit.Comment,stretchman_88,another great review,2022-03-22T02:27:13+00:00,t1_i1m3gyt,t3_thcpso,alcoholfreebeer,https://old.reddit.com/r/alcoholfreebeer/comments/thcpso/big_drop_tailwind_ipa_af_review/i1m3gyt/,,,
snscrape.modules.reddit.Comment,Puzzleheaded_Log_398,guess confused changed label europe us heineken beer labeled us companies well guinness claims beer change label true beer labeled less companies label fact guinness changed makes question claim,2022-03-21T14:48:03+00:00,t1_i1jati9,t1_i1ih9a0,alcoholfreebeer,https://old.reddit.com/r/alcoholfreebeer/comments/tf0som/guinness_00_now_available_in_usa/i1jati9/,,,
snscrape.modules.reddit.Comment,Puzzleheaded_Log_398,anyone know labeled instead label says less guinness claims labeled differently us,2022-03-20T13:04:39+00:00,t1_i1edg6x,t3_tf0som,alcoholfreebeer,https://old.reddit.com/r/alcoholfreebeer/comments/tf0som/guinness_00_now_available_in_usa/i1edg6x/,,,
snscrape.modules.reddit.Comment,FreeBeer_UK,actually big drop beer many breweries churning quality afs hoppy big drop recommend poolside ddh pine trail,2022-03-19T15:56:16+00:00,t1_i1ajw7d,t3_thcpso,alcoholfreebeer,https://old.reddit.com/r/alcoholfreebeer/comments/thcpso/big_drop_tailwind_ipa_af_review/i1ajw7d/,,,
snscrape.modules.reddit.Comment,FreeBeer_UK,yeah think got taste spot heard others think far away original please everyone think might bit heavy summer beer,2022-03-19T11:35:34+00:00,t1_i19q1pd,t1_i18ee63,alcoholfreebeer,https://old.reddit.com/r/alcoholfreebeer/comments/tf0som/guinness_00_now_available_in_usa/i19q1pd/,,,
snscrape.modules.reddit.Comment,Food_Library333,waiting since announced tastes pretty much like remember guinness tasting enjoying far athletic brewing companies stout going go beers summer,2022-03-19T02:02:54+00:00,t1_i18ee63,t3_tf0som,alcoholfreebeer,https://old.reddit.com/r/alcoholfreebeer/comments/tf0som/guinness_00_now_available_in_usa/i18ee63/,,,
snscrape.modules.reddit.Comment,tuctrohs,yes phone camera oversaturating colors,2022-03-17T15:57:15+00:00,t1_i116eb1,t1_i113peb,alcoholfreebeer,https://old.reddit.com/r/alcoholfreebeer/comments/tf0som/guinness_00_now_available_in_usa/i116eb1/,,,
snscrape.modules.reddit.Comment,angmoelah,might lighting colour head picture looks like youre guinness black yes enjoy,2022-03-17T15:39:55+00:00,t1_i113peb,t3_tf0som,alcoholfreebeer,https://old.reddit.com/r/alcoholfreebeer/comments/tf0som/guinness_00_now_available_in_usa/i113peb/,,,
snscrape.modules.reddit.Comment,stretchman_88,well darks solid bravus peanut butter stout might best around athletic darks okay surprised ipas top line,2022-03-17T04:53:20+00:00,t1_i0zdeo3,t1_i0x7zfd,alcoholfreebeer,https://old.reddit.com/r/alcoholfreebeer/comments/tf0som/guinness_00_now_available_in_usa/i0zdeo3/,,,
snscrape.modules.reddit.Comment,brawlidol,hey feel us af beers sober carpenter wellbeing bravus athletic pilot program beers look good grasp needs freedom beer movement,2022-03-16T19:25:23+00:00,t1_i0x7zfd,t1_i0vsqs0,alcoholfreebeer,https://old.reddit.com/r/alcoholfreebeer/comments/tf0som/guinness_00_now_available_in_usa/i0x7zfd/,,,
snscrape.modules.reddit.Comment,stretchman_88,uk fucking variety delicious looking af brews,2022-03-16T13:37:27+00:00,t1_i0vsqs0,t1_i0vahwm,alcoholfreebeer,https://old.reddit.com/r/alcoholfreebeer/comments/tf0som/guinness_00_now_available_in_usa/i0vsqs0/,,,
snscrape.modules.reddit.Comment,FreeBeer_UK,interesting marketed guinness instead mentions instead compared uk probably local laws customs hope get enjoy run supply problems seem,2022-03-16T11:53:29+00:00,t1_i0vgu7y,t3_tf0som,alcoholfreebeer,https://old.reddit.com/r/alcoholfreebeer/comments/tf0som/guinness_00_now_available_in_usa/i0vgu7y/,,,
snscrape.modules.reddit.Comment,tuctrohs,far ones actually get north america big drop great also like partake called stout closer schwarzbier grüvi weird taste grew previous post,2022-03-16T10:46:03+00:00,t1_i0vavqp,t1_i0ujmyr,alcoholfreebeer,https://old.reddit.com/r/alcoholfreebeer/comments/tf0som/guinness_00_now_available_in_usa/i0vavqp/,,,
snscrape.modules.reddit.Comment,brawlidol,think new favourite one posted big drop galactic stout still ticks boxes readily available guinness weird considering big diageo,2022-03-16T10:41:14+00:00,t1_i0vahwm,t1_i0ujmyr,alcoholfreebeer,https://old.reddit.com/r/alcoholfreebeer/comments/tf0som/guinness_00_now_available_in_usa/i0vahwm/,,,
snscrape.modules.reddit.Comment,stretchman_88,also enjoyed favorite na stouts,2022-03-16T04:51:05+00:00,t1_i0ujmyr,t3_tf0som,alcoholfreebeer,https://old.reddit.com/r/alcoholfreebeer/comments/tf0som/guinness_00_now_available_in_usa/i0ujmyr/,,,
snscrape.modules.reddit.Comment,tuctrohs,like might best af stout ordered online,2022-03-15T21:28:41+00:00,t1_i0swt8p,t3_tf0som,alcoholfreebeer,https://old.reddit.com/r/alcoholfreebeer/comments/tf0som/guinness_00_now_available_in_usa/i0swt8p/,,,
snscrape.modules.reddit.Comment,Royal-Assumption8931,already exists called root co check,2022-03-10T14:00:50+00:00,t1_i03uzqh,t1_i00ijhr,alcoholfreebeer,https://old.reddit.com/r/alcoholfreebeer/comments/taa614/targeting_uk_audience_please_help_me_out_in_this/i03uzqh/,,,
snscrape.modules.reddit.Comment,Royal-Assumption8931,omg thanks pointing,2022-03-10T13:59:29+00:00,t1_i03utit,t1_hzzidje,alcoholfreebeer,https://old.reddit.com/r/alcoholfreebeer/comments/taa614/targeting_uk_audience_please_help_me_out_in_this/i03utit/,,,
snscrape.modules.reddit.Comment,brawlidol,citrus floral bloody lovely stout heavy sugar cherries either great stout hints black forest gateaux black forest gateaux glass,2022-03-10T08:42:52+00:00,t1_i0337mb,t1_i00hx52,alcoholfreebeer,https://old.reddit.com/r/alcoholfreebeer/comments/tab11k/happy_af_alcohol_free_black_forest_gateaux_stout/i0337mb/,,,
snscrape.modules.reddit.Comment,Mash__Gang,ahhh got like hours,2022-03-09T21:06:02+00:00,t1_i00sego,t1_i00irp4,alcoholfreebeer,https://old.reddit.com/r/alcoholfreebeer/comments/t1do37/mash_gang_x_alpha_delta_high_definition_af_review/i00sego/,,,
snscrape.modules.reddit.Comment,FreeBeer_UK,guys fault company bought using hermes delivery,2022-03-09T20:04:10+00:00,t1_i00irp4,t1_i00e051,alcoholfreebeer,https://old.reddit.com/r/alcoholfreebeer/comments/t1do37/mash_gang_x_alpha_delta_high_definition_af_review/i00irp4/,,,
snscrape.modules.reddit.Comment,FreeBeer_UK,filled feel free let us know start starts,2022-03-09T20:02:41+00:00,t1_i00ijhr,t3_taa614,alcoholfreebeer,https://old.reddit.com/r/alcoholfreebeer/comments/taa614/targeting_uk_audience_please_help_me_out_in_this/i00ijhr/,,,
snscrape.modules.reddit.Comment,FreeBeer_UK,seen either stout hopped challenger usually citrus floral ipa fare let us know,2022-03-09T19:58:37+00:00,t1_i00hx52,t3_tab11k,alcoholfreebeer,https://old.reddit.com/r/alcoholfreebeer/comments/tab11k/happy_af_alcohol_free_black_forest_gateaux_stout/i00hx52/,,,
snscrape.modules.reddit.Comment,Mash__Gang,talked gotta say come across completely wide mark hop oils terpenes already available ages,2022-03-09T19:34:02+00:00,t1_i00e65y,t1_hy81stu,alcoholfreebeer,https://old.reddit.com/r/alcoholfreebeer/comments/szu4xk/scientists_make_nonalcoholic_beer_taste_like/i00e65y/,,,
snscrape.modules.reddit.Comment,Mash__Gang,growing pains logistics also bit sickness going round warehouse coupled couriers really struggling central london right,2022-03-09T19:32:57+00:00,t1_i00e051,t1_hzpban4,alcoholfreebeer,https://old.reddit.com/r/alcoholfreebeer/comments/t1do37/mash_gang_x_alpha_delta_high_definition_af_review/i00e051/,,,
snscrape.modules.reddit.Comment,Mash__Gang,og abv one tequila flavoured rather tequila always swerved idea tequila anything,2022-03-09T19:31:13+00:00,t1_i00dqo0,t3_t532nh,alcoholfreebeer,https://old.reddit.com/r/alcoholfreebeer/comments/t532nh/desperados_virgin_00_fancied_an_af_lager_this/i00dqo0/,,,
snscrape.modules.reddit.Comment,FlyingKev,brilliant big cans vegan boot happily note keep eye offerings,2022-03-09T19:20:43+00:00,t1_i00c3mv,t3_tab11k,alcoholfreebeer,https://old.reddit.com/r/alcoholfreebeer/comments/tab11k/happy_af_alcohol_free_black_forest_gateaux_stout/i00c3mv/,,,
snscrape.modules.reddit.Comment,brawlidol,done btw square root listed twice brands question,2022-03-09T16:07:19+00:00,t1_hzzidje,t3_taa614,alcoholfreebeer,https://old.reddit.com/r/alcoholfreebeer/comments/taa614/targeting_uk_audience_please_help_me_out_in_this/hzzidje/,,,
snscrape.modules.reddit.Comment,All-Hail-The-Ale,ignore neipa bit got banging pale ale bud,2022-03-07T16:39:29+00:00,t1_hzpygr2,t1_hzplmz2,alcoholfreebeer,https://old.reddit.com/r/alcoholfreebeer/comments/t6pwk0/lowtide_brewing_co_neipa_the_cosmic_turtle_af/hzpygr2/,,,
snscrape.modules.reddit.Comment,FreeBeer_UK,named beers looking forward trying one,2022-03-07T15:11:31+00:00,t1_hzplmz2,t3_t6pwk0,alcoholfreebeer,https://old.reddit.com/r/alcoholfreebeer/comments/t6pwk0/lowtide_brewing_co_neipa_the_cosmic_turtle_af/hzplmz2/,,,
snscrape.modules.reddit.Comment,FreeBeer_UK,finally arrived along chug brewski bit later expecting least fridge,2022-03-07T13:51:11+00:00,t1_hzpban4,t1_hz7p88u,alcoholfreebeer,https://old.reddit.com/r/alcoholfreebeer/comments/t1do37/mash_gang_x_alpha_delta_high_definition_af_review/hzpban4/,,,
snscrape.modules.reddit.Comment,angmoelah,try one,2022-03-07T10:25:43+00:00,t1_hzosmwn,t3_t1hqo3,alcoholfreebeer,https://old.reddit.com/r/alcoholfreebeer/comments/t1hqo3/looking_for_an_esb/hzosmwn/,,,
snscrape.modules.reddit.Comment,All-Hail-The-Ale,cheers bud much appreciated,2022-03-06T18:08:27+00:00,t1_hzloshm,t1_hzlj9bm,alcoholfreebeer,https://old.reddit.com/r/alcoholfreebeer/comments/t6pwk0/lowtide_brewing_co_neipa_the_cosmic_turtle_af/hzloshm/,,,
snscrape.modules.reddit.Comment,stretchman_88,really great review system dialogue narrating brew fantastic say yet find na hazy truly looks feels like hazy suggestion relabeling pale ale seems spot,2022-03-06T17:31:04+00:00,t1_hzlj9bm,t3_t6pwk0,alcoholfreebeer,https://old.reddit.com/r/alcoholfreebeer/comments/t6pwk0/lowtide_brewing_co_neipa_the_cosmic_turtle_af/hzlj9bm/,,,
snscrape.modules.reddit.Comment,FreeBeer_UK,see anything class esb aus nolo retailer sites could find showing content accessing uk know lot uk af beers exported aus nowadays could look ridgeside littler bitter infinite best st without st without gold sorry linking site ship aus good luck search let us know find anything good,2022-03-04T10:58:12+00:00,t1_hzawu0u,t1_hz3xhus,alcoholfreebeer,https://old.reddit.com/r/alcoholfreebeer/comments/t1hqo3/looking_for_an_esb/hzawu0u/,,,
snscrape.modules.reddit.Comment,All-Hail-The-Ale,hope enjoy bud got fridge tomorrow night,2022-03-03T18:24:03+00:00,t1_hz7p88u,t1_hz7es3e,alcoholfreebeer,https://old.reddit.com/r/alcoholfreebeer/comments/t1do37/mash_gang_x_alpha_delta_high_definition_af_review/hz7p88u/,,,
snscrape.modules.reddit.Comment,FreeBeer_UK,whoop got hopefully arriving tomorrow,2022-03-03T17:18:05+00:00,t1_hz7es3e,t3_t1do37,alcoholfreebeer,https://old.reddit.com/r/alcoholfreebeer/comments/t1do37/mash_gang_x_alpha_delta_high_definition_af_review/hz7es3e/,,,
snscrape.modules.reddit.Comment,brawlidol,lol shandy bass blast past,2022-03-03T16:53:39+00:00,t1_hz7axs5,t1_hz6pnrl,alcoholfreebeer,https://old.reddit.com/r/alcoholfreebeer/comments/t532nh/desperados_virgin_00_fancied_an_af_lager_this/hz7axs5/,,,
snscrape.modules.reddit.Comment,FlyingKev,abv iirc tequila flavour na reckon bit sweet side still palatable,2022-03-03T14:35:35+00:00,t1_hz6q8vr,t1_hz6ppw0,alcoholfreebeer,https://old.reddit.com/r/alcoholfreebeer/comments/t532nh/desperados_virgin_00_fancied_an_af_lager_this/hz6q8vr/,,,
snscrape.modules.reddit.Comment,FreeBeer_UK,alcoholic version sweet,2022-03-03T14:31:47+00:00,t1_hz6ppw0,t1_hz5xuf8,alcoholfreebeer,https://old.reddit.com/r/alcoholfreebeer/comments/t532nh/desperados_virgin_00_fancied_an_af_lager_this/hz6ppw0/,,,
snscrape.modules.reddit.Comment,FreeBeer_UK,like thought going citrus lemon zest shandy sweet syrupy mouthfeel body fine shandy sort actually reminds shandy bass,2022-03-03T14:31:22+00:00,t1_hz6pnrl,t3_t532nh,alcoholfreebeer,https://old.reddit.com/r/alcoholfreebeer/comments/t532nh/desperados_virgin_00_fancied_an_af_lager_this/hz6pnrl/,,,
snscrape.modules.reddit.Comment,FlyingKev,know alcoholic version favourite perfectly ok change pace say beers would pass definitely try af saw sale,2022-03-03T09:46:05+00:00,t1_hz5xuf8,t3_t532nh,alcoholfreebeer,https://old.reddit.com/r/alcoholfreebeer/comments/t532nh/desperados_virgin_00_fancied_an_af_lager_this/hz5xuf8/,,,
snscrape.modules.reddit.Comment,brawlidol,used see full fat version everywhere france stores empty bottles street seemed pretty popular maybe younger crowd never tried af though,2022-03-03T08:13:29+00:00,t1_hz5qvp6,t3_t532nh,alcoholfreebeer,https://old.reddit.com/r/alcoholfreebeer/comments/t532nh/desperados_virgin_00_fancied_an_af_lager_this/hz5qvp6/,,,
snscrape.modules.reddit.Comment,nuovaforma,australia,2022-03-02T22:32:00+00:00,t1_hz3xhus,t1_hz290nd,alcoholfreebeer,https://old.reddit.com/r/alcoholfreebeer/comments/t1hqo3/looking_for_an_esb/hz3xhus/,,,
snscrape.modules.reddit.Comment,FreeBeer_UK,would thought gs citra pale,2022-03-02T15:58:09+00:00,t1_hz293l9,t1_hys2e1a,alcoholfreebeer,https://old.reddit.com/r/alcoholfreebeer/comments/t1hqo3/looking_for_an_esb/hz293l9/,,,
snscrape.modules.reddit.Comment,FreeBeer_UK,ashamed look esb acronym never heard term whereabouts located could snoop around continent would good start,2022-03-02T15:57:36+00:00,t1_hz290nd,t3_t1hqo3,alcoholfreebeer,https://old.reddit.com/r/alcoholfreebeer/comments/t1hqo3/looking_for_an_esb/hz290nd/,,,
snscrape.modules.reddit.Comment,FreeBeer_UK,sounds like chocolate milk stout tried back great one happy go several months another one,2022-03-02T15:55:24+00:00,t1_hz28ohm,t3_t27jii,alcoholfreebeer,https://old.reddit.com/r/alcoholfreebeer/comments/t27jii/untitled_art_smores_dark_brew/hz28ohm/,,,
snscrape.modules.reddit.Comment,FreeBeer_UK,brulo coast beers great suffering oversweetness imo say mash gang upping ante af world much brulo,2022-03-02T15:53:52+00:00,t1_hz28g5l,t1_hz23zbo,alcoholfreebeer,https://old.reddit.com/r/alcoholfreebeer/comments/t1do37/mash_gang_x_alpha_delta_high_definition_af_review/hz28g5l/,,,
snscrape.modules.reddit.Comment,All-Hail-The-Ale,tried bud rename got couple new ones try thanks kind words always appreciated,2022-03-02T15:25:19+00:00,t1_hz244ku,t1_hz23zbo,alcoholfreebeer,https://old.reddit.com/r/alcoholfreebeer/comments/t1do37/mash_gang_x_alpha_delta_high_definition_af_review/hz244ku/,,,
snscrape.modules.reddit.Comment,angmoelah,videos enjoyable eye opening try af beers brulo youre fan hops,2022-03-02T15:24:20+00:00,t1_hz23zbo,t1_hyvv1q9,alcoholfreebeer,https://old.reddit.com/r/alcoholfreebeer/comments/t1do37/mash_gang_x_alpha_delta_high_definition_af_review/hz23zbo/,,,
snscrape.modules.reddit.Comment,All-Hail-The-Ale,awesome mate pioneers af craft beer,2022-03-01T07:02:32+00:00,t1_hyvv1q9,t1_hys3h7u,alcoholfreebeer,https://old.reddit.com/r/alcoholfreebeer/comments/t1do37/mash_gang_x_alpha_delta_high_definition_af_review/hyvv1q9/,,,
snscrape.modules.reddit.Comment,brawlidol,one af option stoop option restaurant bar know place,2022-02-28T15:11:32+00:00,t1_hysa9sm,t1_hys7jqd,alcoholfreebeer,https://old.reddit.com/r/alcoholfreebeer/comments/t24j9p/neumarkter_lammsbräu_glutenfrei/hysa9sm/,,,
snscrape.modules.reddit.Comment,FlyingKev,lol setting bar really low,2022-02-28T14:51:44+00:00,t1_hys7jqd,t1_hys2u3f,alcoholfreebeer,https://old.reddit.com/r/alcoholfreebeer/comments/t24j9p/neumarkter_lammsbräu_glutenfrei/hys7jqd/,,,
snscrape.modules.reddit.Comment,angmoelah,mash gang beers teaching different styles beer havent heard,2022-02-28T14:20:56+00:00,t1_hys3h7u,t3_t1do37,alcoholfreebeer,https://old.reddit.com/r/alcoholfreebeer/comments/t1do37/mash_gang_x_alpha_delta_high_definition_af_review/hys3h7u/,,,
