_type,author,body,created,id,parentId,subreddit,url,link,selftext,title
snscrape.modules.reddit.Comment,brawlidol,ginger galangal juices reckon pretty pleasant,2022-01-20T17:07:32+00:00,t1_hthb09i,t1_hth5cpa,alcoholfreebeer,https://old.reddit.com/r/alcoholfreebeer/comments/s8hp3z/not_a_beer_but_i_was_gifted_this_at_christmas_and/hthb09i/,,,
snscrape.modules.reddit.Comment,brawlidol,yeah looking prices website quite high hurdle get starter pack smaller bottles still fair wedge,2022-01-20T17:06:49+00:00,t1_hthaw2r,t1_hth0c8o,alcoholfreebeer,https://old.reddit.com/r/alcoholfreebeer/comments/s8hp3z/not_a_beer_but_i_was_gifted_this_at_christmas_and/hthaw2r/,,,
snscrape.modules.reddit.Comment,angmoelah,burn chili,2022-01-20T16:33:09+00:00,t1_hth5cpa,t3_s8hp3z,alcoholfreebeer,https://old.reddit.com/r/alcoholfreebeer/comments/s8hp3z/not_a_beer_but_i_was_gifted_this_at_christmas_and/hth5cpa/,,,
snscrape.modules.reddit.Comment,Megustatits,oooh looks interesting wish smaller cheaper bottle since hate taking chances new drinks,2022-01-20T16:01:54+00:00,t1_hth0c8o,t3_s8hp3z,alcoholfreebeer,https://old.reddit.com/r/alcoholfreebeer/comments/s8hp3z/not_a_beer_but_i_was_gifted_this_at_christmas_and/hth0c8o/,,,
snscrape.modules.reddit.Comment,brawlidol,three spirit nightcap,2022-01-20T12:19:25+00:00,t1_htg77ph,t3_s8hp3z,alcoholfreebeer,https://old.reddit.com/r/alcoholfreebeer/comments/s8hp3z/not_a_beer_but_i_was_gifted_this_at_christmas_and/htg77ph/,,,
snscrape.modules.reddit.Comment,brawlidol,optout,2022-01-18T16:40:42+00:00,t1_ht7163t,t1_ht6m6gp,alcoholfreebeer,https://old.reddit.com/r/alcoholfreebeer/comments/s6ujt4/ratsherrn_organic_ale_af/ht7163t/,,,
snscrape.modules.reddit.Comment,FlyingKev,go thither procreate thee shitebot,2022-01-18T15:38:33+00:00,t1_ht6re60,t1_ht6m6gp,alcoholfreebeer,https://old.reddit.com/r/alcoholfreebeer/comments/s6ujt4/ratsherrn_organic_ale_af/ht6re60/,,,
snscrape.modules.reddit.Comment,FlyingKev,yep hamburg unfiltered little cloudier,2022-01-18T15:33:06+00:00,t1_ht6qjuh,t1_ht6m510,alcoholfreebeer,https://old.reddit.com/r/alcoholfreebeer/comments/s6ujt4/ratsherrn_organic_ale_af/ht6qjuh/,,,
snscrape.modules.reddit.Comment,Shakespeare-Bot,german get interesting cloudiness going thither bot thy words shakespeare words commands shakespeareinsult fordo optout,2022-01-18T15:03:53+00:00,t1_ht6m6gp,t1_ht6m510,alcoholfreebeer,https://old.reddit.com/r/alcoholfreebeer/comments/s6ujt4/ratsherrn_organic_ale_af/ht6m6gp/,,,
snscrape.modules.reddit.Comment,brawlidol,german got interesting cloudiness going,2022-01-18T15:03:37+00:00,t1_ht6m510,t3_s6ujt4,alcoholfreebeer,https://old.reddit.com/r/alcoholfreebeer/comments/s6ujt4/ratsherrn_organic_ale_af/ht6m510/,,,
snscrape.modules.reddit.Comment,FlyingKev,certainly often mild hangovers long nights never headaches though rarely gave either could esters chemical compounds af beers maybe especially comment ipa weizen could worth trying mild af lager test unrelated occasionally get wee buzz af beer fast one wont occasion lasts minutes,2022-01-18T14:30:42+00:00,t1_ht6hh1d,t3_s4ebbi,alcoholfreebeer,https://old.reddit.com/r/alcoholfreebeer/comments/s4ebbi/af_beer_hangovers/ht6hh1d/,,,
snscrape.modules.reddit.Comment,All-Hail-The-Ale,genuinely amazing wish could get hand,2022-01-17T22:28:57+00:00,t1_ht3imta,t1_ht1pwsx,alcoholfreebeer,https://old.reddit.com/r/alcoholfreebeer/comments/s3ybhr/mash_gang_yeah_nah_yeah_west_coast_pale_review/ht3imta/,,,
snscrape.modules.reddit.Comment,playhouse1564,nah since real month unless trace amounts fake beers awakening part brain,2022-01-16T16:58:58+00:00,t1_hsx3ugr,t1_hswjf6j,alcoholfreebeer,https://old.reddit.com/r/alcoholfreebeer/comments/s4ebbi/af_beer_hangovers/hsx3ugr/,,,
snscrape.modules.reddit.Comment,brawlidol,could actually suggesting alkie anything,2022-01-16T14:34:27+00:00,t1_hswjf6j,t3_s4ebbi,alcoholfreebeer,https://old.reddit.com/r/alcoholfreebeer/comments/s4ebbi/af_beer_hangovers/hswjf6j/,,,
snscrape.modules.reddit.Comment,tomsawyer222,actually mostly german hefeweisse nas also ipas,2022-01-15T12:23:55+00:00,t1_hsraflg,t3_s4ebbi,alcoholfreebeer,https://old.reddit.com/r/alcoholfreebeer/comments/s4ebbi/af_beer_hangovers/hsraflg/,,,
snscrape.modules.reddit.Comment,Mash__Gang,check preservative get sodium metabisulphate responsible wine headaches people likely anything used process aid preservative af beers low sugar reasonable carb water abv almost insignificant amount hooch practical way could dehydrate knowledge,2022-01-15T06:57:57+00:00,t1_hsqjwy7,t3_s4ebbi,alcoholfreebeer,https://old.reddit.com/r/alcoholfreebeer/comments/s4ebbi/af_beer_hangovers/hsqjwy7/,,,
snscrape.modules.reddit.Comment,FreeBeer_UK,oof removal via cooking boiling usually done vacuum environments boiling point much lower less effect taste beer others saying need afterwards probably taste good comes someone used microwave mugs pepsi winter nice hot,2022-01-14T16:16:25+00:00,t1_hsn7anv,t3_s3f4kl,alcoholfreebeer,https://old.reddit.com/r/alcoholfreebeer/comments/s3f4kl/can_i_cook_the_alcohol_out_of_a_beer_i_like_and/hsn7anv/,,,
snscrape.modules.reddit.Comment,FlyingKev,carbon dioxide stay dissolved hot beer lose lot aromas also imagine tricky gauge final abv finished product almost certainly still drinkable doubt would particularly pleasant cool experiment though,2022-01-14T12:09:39+00:00,t1_hsmanwh,t3_s3f4kl,alcoholfreebeer,https://old.reddit.com/r/alcoholfreebeer/comments/s3f4kl/can_i_cook_the_alcohol_out_of_a_beer_i_like_and/hsmanwh/,,,
snscrape.modules.reddit.Comment,FlyingKev,yeah face lot ipas say liked better second try,2022-01-14T11:14:34+00:00,t1_hsm5sfr,t1_hsm4tfu,alcoholfreebeer,https://old.reddit.com/r/alcoholfreebeer/comments/s36b1w/true_brew_brewing_co_into_the_wild/hsm5sfr/,,,
snscrape.modules.reddit.Comment,angmoelah,found refreshing fragrant hope bring,2022-01-14T11:02:46+00:00,t1_hsm4tfu,t3_s36b1w,alcoholfreebeer,https://old.reddit.com/r/alcoholfreebeer/comments/s36b1w/true_brew_brewing_co_into_the_wild/hsm4tfu/,,,
snscrape.modules.reddit.Comment,minnis93,two main methods brewing af beer one change taste guaranteed whether like different question answer,2022-01-14T09:21:50+00:00,t1_hslx1jb,t3_s3f4kl,alcoholfreebeer,https://old.reddit.com/r/alcoholfreebeer/comments/s3f4kl/can_i_cook_the_alcohol_out_of_a_beer_i_like_and/hslx1jb/,,,
snscrape.modules.reddit.Comment,brawlidol,sure result taste particularly nice probably flat lots big brewery beers af version nowadays might better look see available like similar likes,2022-01-14T08:56:15+00:00,t1_hslv1m3,t3_s3f4kl,alcoholfreebeer,https://old.reddit.com/r/alcoholfreebeer/comments/s3f4kl/can_i_cook_the_alcohol_out_of_a_beer_i_like_and/hslv1m3/,,,
snscrape.modules.reddit.Comment,guinness247,would alter flavor completely doable matter fact na beer made article found might help evaporates water evaporates would kitchen thermometer least impact flavor,2022-01-14T02:29:03+00:00,t1_hskpsrt,t3_s3f4kl,alcoholfreebeer,https://old.reddit.com/r/alcoholfreebeer/comments/s3f4kl/can_i_cook_the_alcohol_out_of_a_beer_i_like_and/hskpsrt/,,,
snscrape.modules.reddit.Comment,FlyingKev,lively maybe better description raisiny side say best german afs kehrwieder ü nn roadrunner stout coconut grove coconut grove particular incredible neipa taste coconut,2022-01-13T12:57:25+00:00,t1_hshbvnv,t1_hsgpgvw,alcoholfreebeer,https://old.reddit.com/r/alcoholfreebeer/comments/s2e6ux/uwe_summer_ale/hshbvnv/,,,
snscrape.modules.reddit.Comment,brawlidol,zingy citrus sounds like uwe beers added huge list af try,2022-01-13T08:19:29+00:00,t1_hsgpgvw,t3_s2e6ux,alcoholfreebeer,https://old.reddit.com/r/alcoholfreebeer/comments/s2e6ux/uwe_summer_ale/hsgpgvw/,,,
snscrape.modules.reddit.Comment,All-Hail-The-Ale,seems tesco exclusive moment mucka fingers crossed one near,2022-01-10T18:27:55+00:00,t1_hs3fvu5,t1_hs3friz,alcoholfreebeer,https://old.reddit.com/r/alcoholfreebeer/comments/ryepy4/corona_cero_alcohol_free_lager_review/hs3fvu5/,,,
snscrape.modules.reddit.Comment,FreeBeer_UK,controversial yet see wild described interesting one try,2022-01-10T18:27:11+00:00,t1_hs3friz,t3_ryepy4,alcoholfreebeer,https://old.reddit.com/r/alcoholfreebeer/comments/ryepy4/corona_cero_alcohol_free_lager_review/hs3friz/,,,
snscrape.modules.reddit.Comment,FreeBeer_UK,good hear tried pils yet,2022-01-10T18:25:34+00:00,t1_hs3fhu7,t1_hs1qle0,alcoholfreebeer,https://old.reddit.com/r/alcoholfreebeer/comments/rz7kmn/uwe_ipa/hs3fhu7/,,,
snscrape.modules.reddit.Comment,All-Hail-The-Ale,cheers matey honest say four pack bought two tasted like one review one bit lighter fourth tonight seems little inconsistent shame,2022-01-10T14:22:47+00:00,t1_hs2cyrr,t1_hs1p3et,alcoholfreebeer,https://old.reddit.com/r/alcoholfreebeer/comments/ryepy4/corona_cero_alcohol_free_lager_review/hs2cyrr/,,,
snscrape.modules.reddit.Comment,FlyingKev,quick rundown date tanker uiltje excellent back uwe stereo pils best af pilseners uwe ipa ipa imho drinkable unexciting brewdog nanny state thinnish brown bitter nutty taste ok would go way resupply brewdog lost af cans high pressure tastewise pretty much nothing going possibly duff batch brewdog punk af contains lactose thing passing pal true brew wild sadly underwhelming vandestreek speelkasteel top stuff tart refreshing øl implosion complex sophisticated bit head tbh great brew still try uwe alster ale alster taste union tuesday wheat beer see measures gold standard schneider tap,2022-01-10T11:26:53+00:00,t1_hs1tj3b,t3_rxes7b,alcoholfreebeer,https://old.reddit.com/r/alcoholfreebeer/comments/rxes7b/tried_any_of_these/hs1tj3b/,,,
snscrape.modules.reddit.Comment,FlyingKev,like bolder pale ales normally maybe palate evolve time question top brew right øl know stuff,2022-01-10T11:01:54+00:00,t1_hs1rg3p,t1_hs1oemi,alcoholfreebeer,https://old.reddit.com/r/alcoholfreebeer/comments/ryjxrf/to_øl_implosion/hs1rg3p/,,,
snscrape.modules.reddit.Comment,FlyingKev,true best af ipas pretty much indistinguishable session ales high hopes one stereo pils good brewing good pilsener far harder ipa even recognised ipa generic old beer taste,2022-01-10T10:51:23+00:00,t1_hs1qle0,t1_hs1ogxp,alcoholfreebeer,https://old.reddit.com/r/alcoholfreebeer/comments/rz7kmn/uwe_ipa/hs1qle0/,,,
snscrape.modules.reddit.Comment,brawlidol,honesty review makes beer sound pretty appealing something thought would say corona beer thanks review,2022-01-10T10:32:50+00:00,t1_hs1p3et,t1_hs1onb3,alcoholfreebeer,https://old.reddit.com/r/alcoholfreebeer/comments/ryepy4/corona_cero_alcohol_free_lager_review/hs1p3et/,,,
snscrape.modules.reddit.Comment,All-Hail-The-Ale,touché indeed matey always explore new af options supermarkets,2022-01-10T10:27:06+00:00,t1_hs1onb3,t1_hs1oi80,alcoholfreebeer,https://old.reddit.com/r/alcoholfreebeer/comments/ryepy4/corona_cero_alcohol_free_lager_review/hs1onb3/,,,
snscrape.modules.reddit.Comment,brawlidol,last years taught stay away corona,2022-01-10T10:25:19+00:00,t1_hs1oi80,t3_ryepy4,alcoholfreebeer,https://old.reddit.com/r/alcoholfreebeer/comments/ryepy4/corona_cero_alcohol_free_lager_review/hs1oi80/,,,
snscrape.modules.reddit.Comment,brawlidol,theres many af beer world standards get higher higher,2022-01-10T10:24:53+00:00,t1_hs1ogxp,t3_rz7kmn,alcoholfreebeer,https://old.reddit.com/r/alcoholfreebeer/comments/rz7kmn/uwe_ipa/hs1ogxp/,,,
snscrape.modules.reddit.Comment,brawlidol,yup earthy citrus tropical nice flavours,2022-01-10T10:24:05+00:00,t1_hs1oemi,t3_ryjxrf,alcoholfreebeer,https://old.reddit.com/r/alcoholfreebeer/comments/ryjxrf/to_øl_implosion/hs1oemi/,,,
snscrape.modules.reddit.Comment,tomsawyer222,one yesterday actually really nice bit substance,2022-01-09T22:29:13+00:00,t1_hrz6cno,t3_ry2xoz,alcoholfreebeer,https://old.reddit.com/r/alcoholfreebeer/comments/ry2xoz/uiltje_superbowl/hrz6cno/,,,
snscrape.modules.reddit.Comment,FreeBeer_UK,looks like full abv version available uk moment,2022-01-07T16:32:05+00:00,t1_hrnkodx,t3_ry10d2,alcoholfreebeer,https://old.reddit.com/r/alcoholfreebeer/comments/ry10d2/tanker_sauna_session_zero_alcohol_birch_ale/hrnkodx/,,,
snscrape.modules.reddit.Comment,brawlidol,doh obvious,2022-01-07T11:45:54+00:00,t1_hrmipqf,t1_hrmiadj,alcoholfreebeer,https://old.reddit.com/r/alcoholfreebeer/comments/ry2xoz/uiltje_superbowl/hrmipqf/,,,
snscrape.modules.reddit.Comment,FlyingKev,almost ashamed say took days name clicked,2022-01-07T11:41:00+00:00,t1_hrmiadj,t1_hrmgu5c,alcoholfreebeer,https://old.reddit.com/r/alcoholfreebeer/comments/ry2xoz/uiltje_superbowl/hrmiadj/,,,
snscrape.modules.reddit.Comment,brawlidol,sounds street wonder name comes though,2022-01-07T11:23:54+00:00,t1_hrmgu5c,t3_ry2xoz,alcoholfreebeer,https://old.reddit.com/r/alcoholfreebeer/comments/ry2xoz/uiltje_superbowl/hrmgu5c/,,,
snscrape.modules.reddit.Comment,brawlidol,ever seen bottles,2022-01-07T11:21:43+00:00,t1_hrmgnig,t1_hrkacww,alcoholfreebeer,https://old.reddit.com/r/alcoholfreebeer/comments/rxes7b/tried_any_of_these/hrmgnig/,,,
snscrape.modules.reddit.Comment,minnis93,vandestreek great never seen though,2022-01-06T23:44:21+00:00,t1_hrkacww,t3_rxes7b,alcoholfreebeer,https://old.reddit.com/r/alcoholfreebeer/comments/rxes7b/tried_any_of_these/hrkacww/,,,
snscrape.modules.reddit.Comment,All-Hail-The-Ale,need try chance yet,2022-01-06T22:06:06+00:00,t1_hrjust6,t3_rxas7j,alcoholfreebeer,https://old.reddit.com/r/alcoholfreebeer/comments/rxas7j/this_version_is_even_better/hrjust6/,,,
snscrape.modules.reddit.Comment,Mash__Gang,expect restock next week,2022-01-06T19:21:19+00:00,t1_hrj3tpr,t1_hriqdk6,alcoholfreebeer,https://old.reddit.com/r/alcoholfreebeer/comments/rxas7j/this_version_is_even_better/hrj3tpr/,,,
snscrape.modules.reddit.Comment,FlyingKev,good hear like uwe beers af think insel beers swimmers saison personal favourite af beers excellent,2022-01-06T18:44:47+00:00,t1_hrixvge,t1_hriqrul,alcoholfreebeer,https://old.reddit.com/r/alcoholfreebeer/comments/rxes7b/tried_any_of_these/hrixvge/,,,
snscrape.modules.reddit.Comment,FreeBeer_UK,uwe beers wonderful enjoy ipa insel far lovely mango orange marmalade going great kick salt tip tongue lovely stuff,2022-01-06T18:01:43+00:00,t1_hriqrul,t3_rxes7b,alcoholfreebeer,https://old.reddit.com/r/alcoholfreebeer/comments/rxes7b/tried_any_of_these/hriqrul/,,,
snscrape.modules.reddit.Comment,FreeBeer_UK,oh man sold already website,2022-01-06T17:59:18+00:00,t1_hriqdk6,t3_rxas7j,alcoholfreebeer,https://old.reddit.com/r/alcoholfreebeer/comments/rxas7j/this_version_is_even_better/hriqdk6/,,,
snscrape.modules.reddit.Comment,FlyingKev,birch ale seems flagship brew tanker estonia alcoholic version pretty sure like ordered cans let know goes,2022-01-06T15:24:52+00:00,t1_hri1f2w,t1_hrhy3md,alcoholfreebeer,https://old.reddit.com/r/alcoholfreebeer/comments/rxes7b/tried_any_of_these/hri1f2w/,,,
snscrape.modules.reddit.Comment,Mash__Gang,totally agree full slam dunk think gose works well long like white beers,2022-01-06T15:21:33+00:00,t1_hri0x39,t1_hrhnv5z,alcoholfreebeer,https://old.reddit.com/r/alcoholfreebeer/comments/rxas7j/this_version_is_even_better/hri0x39/,,,
snscrape.modules.reddit.Comment,brawlidol,another one add neverending af beer shopping list,2022-01-06T15:05:38+00:00,t1_hrhyimm,t3_rxas7j,alcoholfreebeer,https://old.reddit.com/r/alcoholfreebeer/comments/rxas7j/this_version_is_even_better/hrhyimm/,,,
snscrape.modules.reddit.Comment,brawlidol,woah apart brewdog new birch ale sounds interesting,2022-01-06T15:02:49+00:00,t1_hrhy3md,t3_rxes7b,alcoholfreebeer,https://old.reddit.com/r/alcoholfreebeer/comments/rxes7b/tried_any_of_these/hrhy3md/,,,
snscrape.modules.reddit.Comment,FlyingKev,neipa style works excellently abv beers,2022-01-06T13:49:53+00:00,t1_hrhnv5z,t3_rxas7j,alcoholfreebeer,https://old.reddit.com/r/alcoholfreebeer/comments/rxas7j/this_version_is_even_better/hrhnv5z/,,,
snscrape.modules.reddit.Comment,angmoelah,asda asda online happy new year,2021-12-31T16:51:02+00:00,t1_hqp6pov,t3_rli2pg,alcoholfreebeer,https://old.reddit.com/r/alcoholfreebeer/comments/rli2pg/guinness_00_sold_out/hqp6pov/,,,
snscrape.modules.reddit.Comment,FreeBeer_UK,word inoffensive af beer form,2021-12-21T17:58:23+00:00,t1_hpg8iw1,t3_rio4yd,alcoholfreebeer,https://old.reddit.com/r/alcoholfreebeer/comments/rio4yd/budvar_nealko_review/hpg8iw1/,,,
snscrape.modules.reddit.Comment,FreeBeer_UK,might want buy investment going usual price amazon etc,2021-12-21T17:37:33+00:00,t1_hpg5a40,t1_hpfwskj,alcoholfreebeer,https://old.reddit.com/r/alcoholfreebeer/comments/rli2pg/guinness_00_sold_out/hpg5a40/,,,
snscrape.modules.reddit.Comment,FreeBeer_UK,yeah low stock problems everywhere probably result many situations moment,2021-12-21T17:36:53+00:00,t1_hpg56co,t3_rli2pg,alcoholfreebeer,https://old.reddit.com/r/alcoholfreebeer/comments/rli2pg/guinness_00_sold_out/hpg56co/,,,
snscrape.modules.reddit.Comment,brawlidol,lol emergency edinburgh trip might cards,2021-12-21T16:58:18+00:00,t1_hpfzb3z,t1_hpfwskj,alcoholfreebeer,https://old.reddit.com/r/alcoholfreebeer/comments/rli2pg/guinness_00_sold_out/hpfzb3z/,,,
snscrape.modules.reddit.Comment,turncol,local tesco edinburgh stock monday maybe uptake beers slightly slower scotland keen stouts tried yet maybe give go new year,2021-12-21T16:41:31+00:00,t1_hpfwskj,t3_rli2pg,alcoholfreebeer,https://old.reddit.com/r/alcoholfreebeer/comments/rli2pg/guinness_00_sold_out/hpfwskj/,,,
snscrape.modules.reddit.Comment,All-Hail-The-Ale,sure mate delicious interesting flavours always get attention,2021-12-13T20:10:29+00:00,t1_hof5tuw,t1_hodv19i,alcoholfreebeer,https://old.reddit.com/r/alcoholfreebeer/comments/rdfcsi/arbor_x_mash_gang_day_tripper_ipa_review/hof5tuw/,,,
snscrape.modules.reddit.Comment,FreeBeer_UK,going get laughed court,2021-12-13T14:57:06+00:00,t1_hodv622,t3_rd6ykm,alcoholfreebeer,https://old.reddit.com/r/alcoholfreebeer/comments/rd6ykm/some_idiot_is_sueing_heineken_for_there_being_003/hodv622/,,,
snscrape.modules.reddit.Comment,FreeBeer_UK,looks like needed reality check quite time,2021-12-13T14:56:41+00:00,t1_hodv42g,t1_ho3k4y4,alcoholfreebeer,https://old.reddit.com/r/alcoholfreebeer/comments/rd6ykm/some_idiot_is_sueing_heineken_for_there_being_003/hodv42g/,,,
snscrape.modules.reddit.Comment,FreeBeer_UK,thing rare beauty,2021-12-13T14:56:06+00:00,t1_hodv19i,t3_rdfcsi,alcoholfreebeer,https://old.reddit.com/r/alcoholfreebeer/comments/rdfcsi/arbor_x_mash_gang_day_tripper_ipa_review/hodv19i/,,,
snscrape.modules.reddit.Comment,All-Hail-The-Ale,need decent af pubs temptation real,2021-12-11T15:53:43+00:00,t1_ho4rpaf,t1_ho4rkwa,alcoholfreebeer,https://old.reddit.com/r/alcoholfreebeer/comments/rdfcsi/arbor_x_mash_gang_day_tripper_ipa_review/ho4rpaf/,,,
snscrape.modules.reddit.Comment,brawlidol,imagine buying pint pub,2021-12-11T15:52:49+00:00,t1_ho4rkwa,t3_rdfcsi,alcoholfreebeer,https://old.reddit.com/r/alcoholfreebeer/comments/rdfcsi/arbor_x_mash_gang_day_tripper_ipa_review/ho4rkwa/,,,
snscrape.modules.reddit.Comment,All-Hail-The-Ale,pretty damned tasty mucka different nice many beers nowadays similar many others,2021-12-11T08:30:41+00:00,t1_ho3l3s1,t1_ho1j5sm,alcoholfreebeer,https://old.reddit.com/r/alcoholfreebeer/comments/rdfcsi/arbor_x_mash_gang_day_tripper_ipa_review/ho3l3s1/,,,
snscrape.modules.reddit.Comment,Mash__Gang,tried find case,2021-12-11T08:18:28+00:00,t1_ho3k4y4,t3_rd6ykm,alcoholfreebeer,https://old.reddit.com/r/alcoholfreebeer/comments/rd6ykm/some_idiot_is_sueing_heineken_for_there_being_003/ho3k4y4/,,,
snscrape.modules.reddit.Comment,angmoelah,yes thats one mentioned looks glorious,2021-12-10T22:03:59+00:00,t1_ho1j5sm,t3_rdfcsi,alcoholfreebeer,https://old.reddit.com/r/alcoholfreebeer/comments/rdfcsi/arbor_x_mash_gang_day_tripper_ipa_review/ho1j5sm/,,,
snscrape.modules.reddit.Comment,brawlidol,wonder woman make sue also sue tropicana er know brands bread us,2021-12-10T13:55:52+00:00,t1_hnzj9uj,t3_rd6ykm,alcoholfreebeer,https://old.reddit.com/r/alcoholfreebeer/comments/rd6ykm/some_idiot_is_sueing_heineken_for_there_being_003/hnzj9uj/,,,
snscrape.modules.reddit.Comment,Mash__Gang,yeah chug haha brief hazy wanna chug,2021-12-05T19:58:28+00:00,t1_hnd4dr6,t1_hnd3v2v,alcoholfreebeer,https://old.reddit.com/r/alcoholfreebeer/comments/r8y6ni/new_beer_day_05_hazy_as_you_like/hnd4dr6/,,,
snscrape.modules.reddit.Comment,FreeBeer_UK,chug right certainly looks chuggable,2021-12-05T19:55:29+00:00,t1_hnd3v2v,t3_r8y6ni,alcoholfreebeer,https://old.reddit.com/r/alcoholfreebeer/comments/r8y6ni/new_beer_day_05_hazy_as_you_like/hnd3v2v/,,,
snscrape.modules.reddit.Comment,Mash__Gang,untappd review bit thin expected,2021-12-05T10:00:01+00:00,t1_hnb4a1x,t1_hn8lwde,alcoholfreebeer,https://old.reddit.com/r/alcoholfreebeer/comments/r8y6ni/new_beer_day_05_hazy_as_you_like/hnb4a1x/,,,
snscrape.modules.reddit.Comment,brawlidol,woah looks chewy,2021-12-04T20:53:28+00:00,t1_hn8lwde,t3_r8y6ni,alcoholfreebeer,https://old.reddit.com/r/alcoholfreebeer/comments/r8y6ni/new_beer_day_05_hazy_as_you_like/hn8lwde/,,,
snscrape.modules.reddit.Comment,Mash__Gang,gotta arbor collab hahaha,2021-12-04T20:21:58+00:00,t1_hn8hidp,t1_hkp4pqo,alcoholfreebeer,https://old.reddit.com/r/alcoholfreebeer/comments/qsi4us/mash_gang_stoop_american_pilsner_review/hn8hidp/,,,
snscrape.modules.reddit.Comment,FredMertz007,right want hear hey thanks info much appreciated double cheers,2021-12-04T00:34:16+00:00,t1_hn4x1do,t1_hn41p5y,alcoholfreebeer,https://old.reddit.com/r/alcoholfreebeer/comments/qxmsnj/athletic_brewing_co_run_wild_ipa_review/hn4x1do/,,,
snscrape.modules.reddit.Comment,brawlidol,tried ipas helles lager fab,2021-12-03T20:34:49+00:00,t1_hn41p5y,t1_hn363e7,alcoholfreebeer,https://old.reddit.com/r/alcoholfreebeer/comments/qxmsnj/athletic_brewing_co_run_wild_ipa_review/hn41p5y/,,,
snscrape.modules.reddit.Comment,FreeBeer_UK,coast called brulo weird branding forward slashes reason,2021-12-03T18:29:33+00:00,t1_hn3j417,t1_hn2m9zv,alcoholfreebeer,https://old.reddit.com/r/alcoholfreebeer/comments/qxmsnj/athletic_brewing_co_run_wild_ipa_review/hn3j417/,,,
snscrape.modules.reddit.Comment,FreeBeer_UK,two roots,2021-12-03T18:28:46+00:00,t1_hn3izvr,t1_hn2xupz,alcoholfreebeer,https://old.reddit.com/r/alcoholfreebeer/comments/qxmsnj/athletic_brewing_co_run_wild_ipa_review/hn3izvr/,,,
snscrape.modules.reddit.Comment,FredMertz007,oh yeah ive heard tried yet particular ones try,2021-12-03T17:04:35+00:00,t1_hn363e7,t1_hn2xupz,alcoholfreebeer,https://old.reddit.com/r/alcoholfreebeer/comments/qxmsnj/athletic_brewing_co_run_wild_ipa_review/hn363e7/,,,
snscrape.modules.reddit.Comment,brawlidol,sure market like socal na ipas two roots think cali based definitely tasty brews,2021-12-03T16:10:18+00:00,t1_hn2xupz,t1_hn2uwu0,alcoholfreebeer,https://old.reddit.com/r/alcoholfreebeer/comments/qxmsnj/athletic_brewing_co_run_wild_ipa_review/hn2xupz/,,,
snscrape.modules.reddit.Comment,FredMertz007,rock sounds pretty promising definitely try got na beer recently trying cut back lot tasty brews socal finding something closer mark would awesome thanks heads cheers,2021-12-03T15:50:31+00:00,t1_hn2uwu0,t1_hn2m9zv,alcoholfreebeer,https://old.reddit.com/r/alcoholfreebeer/comments/qxmsnj/athletic_brewing_co_run_wild_ipa_review/hn2uwu0/,,,
snscrape.modules.reddit.Comment,brawlidol,pretty good na beers like ones coast whatever calling blow water terms flavour general mouth feel imo even brewdog punk af ups ante run wild course everyones palates different etc,2021-12-03T14:50:03+00:00,t1_hn2m9zv,t1_hn15auw,alcoholfreebeer,https://old.reddit.com/r/alcoholfreebeer/comments/qxmsnj/athletic_brewing_co_run_wild_ipa_review/hn2m9zv/,,,
snscrape.modules.reddit.Comment,FredMertz007,like curious thought run wild pretty good na beer,2021-12-03T04:59:00+00:00,t1_hn15auw,t1_hlngy7w,alcoholfreebeer,https://old.reddit.com/r/alcoholfreebeer/comments/qxmsnj/athletic_brewing_co_run_wild_ipa_review/hn15auw/,,,
snscrape.modules.reddit.Comment,FreeBeer_UK,opposite many af beers tried time weak nose boom taste,2021-12-02T10:35:26+00:00,t1_hmx0qtj,t3_r2u3uh,alcoholfreebeer,https://old.reddit.com/r/alcoholfreebeer/comments/r2u3uh/lowtide_brewing_co_are_wheat_there_yet/hmx0qtj/,,,
snscrape.modules.reddit.Comment,brawlidol,nice enough quite hoppy maybe bit carbonated like ghost ship come think think bottles might shelf lol,2021-11-28T09:04:53+00:00,t1_hmdr8ko,t1_hmadvq7,alcoholfreebeer,https://old.reddit.com/r/alcoholfreebeer/comments/r3df2m/new_af_pale_from_ms_havent_seen_this_one_before/hmdr8ko/,,,
snscrape.modules.reddit.Comment,brawlidol,might well got adnams looks bit higher calories carbs nice ghost ship though,2021-11-28T09:03:15+00:00,t1_hmdr433,t1_hmazpw6,alcoholfreebeer,https://old.reddit.com/r/alcoholfreebeer/comments/r3df2m/new_af_pale_from_ms_havent_seen_this_one_before/hmdr433/,,,
snscrape.modules.reddit.Comment,FreeBeer_UK,rebranded southwold pale ale perhaps,2021-11-27T19:02:06+00:00,t1_hmazpw6,t3_r3df2m,alcoholfreebeer,https://old.reddit.com/r/alcoholfreebeer/comments/r3df2m/new_af_pale_from_ms_havent_seen_this_one_before/hmazpw6/,,,
snscrape.modules.reddit.Comment,roygbiv1000,think new design used come bottle fan personally used quite like broadside gave much like ghost ship either may similar,2021-11-27T16:27:19+00:00,t1_hmadvq7,t3_r3df2m,alcoholfreebeer,https://old.reddit.com/r/alcoholfreebeer/comments/r3df2m/new_af_pale_from_ms_havent_seen_this_one_before/hmadvq7/,,,
snscrape.modules.reddit.Comment,Mash__Gang,get rid shitty old brew bucket,2021-11-26T14:39:51+00:00,t1_hm5pf2i,t1_hm1hu4p,alcoholfreebeer,https://old.reddit.com/r/alcoholfreebeer/comments/r1ague/open_nolo_project/hm5pf2i/,,,
snscrape.modules.reddit.Comment,FreeBeer_UK,great idea everyone loves good citra ipa think old bucket used use years ago uni unfortunately,2021-11-25T15:13:48+00:00,t1_hm1hu4p,t3_r1ague,alcoholfreebeer,https://old.reddit.com/r/alcoholfreebeer/comments/r1ague/open_nolo_project/hm1hu4p/,,,
snscrape.modules.reddit.Comment,Mash__Gang,good scot,2021-11-24T17:25:42+00:00,t1_hlx9fy9,t3_r0ira5,alcoholfreebeer,https://old.reddit.com/r/alcoholfreebeer/comments/r0ira5/new_af_stout_on_the_way_from_jump_ship_brewing/hlx9fy9/,,,
