_type,author,body,created,id,parentId,subreddit,url,link,selftext,title
snscrape.modules.reddit.Comment,Mash__Gang,love consultant committee,2021-11-24T17:25:17+00:00,t1_hlx9dld,t1_hlm9jry,alcoholfreebeer,https://old.reddit.com/r/alcoholfreebeer/comments/qyrjs8/unthinkable_a_few_years_ago_this_is_just_the/hlx9dld/,,,
snscrape.modules.reddit.Comment,brawlidol,bottle,2021-11-24T11:06:11+00:00,t1_hlvz66l,t3_r0ira5,alcoholfreebeer,https://old.reddit.com/r/alcoholfreebeer/comments/r0ira5/new_af_stout_on_the_way_from_jump_ship_brewing/hlvz66l/,,,
snscrape.modules.reddit.Comment,FreeBeer_UK,feeling lucky big beers readily available uk athletic presence hopefully releasing stouts untitled chocolate milk stout arriving soon heard good things though hoping going sweet two roots also released milk stout though name dark cookies immediately makes think something sweet loved beers though give try get hands,2021-11-24T08:40:41+00:00,t1_hlvonfm,t3_r0ogpm,alcoholfreebeer,https://old.reddit.com/r/alcoholfreebeer/comments/r0ogpm/dark_af_beer_update_big_drop_and_partake_continue/hlvonfm/,,,
snscrape.modules.reddit.Comment,sklxbnz,love big offerings buy get free code cheers,2021-11-23T22:36:25+00:00,t1_hltsccu,t3_r0ogpm,alcoholfreebeer,https://old.reddit.com/r/alcoholfreebeer/comments/r0ogpm/dark_af_beer_update_big_drop_and_partake_continue/hltsccu/,,,
snscrape.modules.reddit.Comment,FreeBeer_UK,image shamelessly culled newsletter,2021-11-23T17:46:25+00:00,t1_hlsk7z3,t3_r0ira5,alcoholfreebeer,https://old.reddit.com/r/alcoholfreebeer/comments/r0ira5/new_af_stout_on_the_way_from_jump_ship_brewing/hlsk7z3/,,,
snscrape.modules.reddit.Comment,brawlidol,found athletic beers underwhelming especially many local uk af beers available better flavour body,2021-11-22T16:06:42+00:00,t1_hlngy7w,t3_qxmsnj,alcoholfreebeer,https://old.reddit.com/r/alcoholfreebeer/comments/qxmsnj/athletic_brewing_co_run_wild_ipa_review/hlngy7w/,,,
snscrape.modules.reddit.Comment,brawlidol,think need buy,2021-11-22T15:56:03+00:00,t1_hlnfe3d,t1_hkpvecb,alcoholfreebeer,https://old.reddit.com/r/alcoholfreebeer/comments/quex8i/this_shouldnt_work_but_really_does/hlnfe3d/,,,
snscrape.modules.reddit.Comment,angmoelah,much better golden ale,2021-11-22T11:47:41+00:00,t1_hlmn6yl,t3_qxmsnj,alcoholfreebeer,https://old.reddit.com/r/alcoholfreebeer/comments/qxmsnj/athletic_brewing_co_run_wild_ipa_review/hlmn6yl/,,,
snscrape.modules.reddit.Comment,FreeBeer_UK,secret keep beer stored degrees cooler normal wonder much money heineken spent researching nice healthy sales forecast article though,2021-11-22T08:32:28+00:00,t1_hlm9jry,t3_qyrjs8,alcoholfreebeer,https://old.reddit.com/r/alcoholfreebeer/comments/qyrjs8/unthinkable_a_few_years_ago_this_is_just_the/hlm9jry/,,,
snscrape.modules.reddit.Comment,Mash__Gang,guys amazing,2021-11-21T09:35:15+00:00,t1_hlhqa0s,t1_hkpljz4,alcoholfreebeer,https://old.reddit.com/r/alcoholfreebeer/comments/quex8i/this_shouldnt_work_but_really_does/hlhqa0s/,,,
snscrape.modules.reddit.Comment,logan-hen,bwab started advocate widespread acceptance celebration availability na beer wanted help people proud ashamed part buzz club grab shirt make official thanks much support check em,2021-11-18T16:05:20+00:00,t1_hl4ugic,t3_qwsyxn,alcoholfreebeer,https://old.reddit.com/r/alcoholfreebeer/comments/qwsyxn/cool_na_beer_tee/hl4ugic/,,,
snscrape.modules.reddit.Comment,StephBets,try free time really love,2021-11-15T23:52:54+00:00,t1_hksc56b,t1_hkg0ry6,alcoholfreebeer,https://old.reddit.com/r/alcoholfreebeer/comments/qfwovh/parc_pils_heaps_normal_xpa_free_time_australia/hksc56b/,,,
snscrape.modules.reddit.Comment,All-Hail-The-Ale,one way find,2021-11-15T18:07:05+00:00,t1_hkqwgso,t1_hkq82ay,alcoholfreebeer,https://old.reddit.com/r/alcoholfreebeer/comments/qsi4us/mash_gang_stoop_american_pilsner_review/hkqwgso/,,,
snscrape.modules.reddit.Comment,angmoelah,one look instagram picture milkyness,2021-11-15T15:24:58+00:00,t1_hkq8eax,t1_hkp9sw8,alcoholfreebeer,https://old.reddit.com/r/alcoholfreebeer/comments/qsi4us/mash_gang_stoop_american_pilsner_review/hkq8eax/,,,
snscrape.modules.reddit.Comment,Mash__Gang,feeling going split opinion almost certainly going one people feel drifted far original,2021-11-15T15:22:34+00:00,t1_hkq82ay,t1_hkp9v3r,alcoholfreebeer,https://old.reddit.com/r/alcoholfreebeer/comments/qsi4us/mash_gang_stoop_american_pilsner_review/hkq82ay/,,,
snscrape.modules.reddit.Comment,Mash__Gang,new intro needed duly noted next episode cuckoo brewing jokingly called cuckold brewing much everyone disgust tech bit dry try add anecdotes tangents appreciate also think bit long working isolation probably good talk,2021-11-15T15:21:41+00:00,t1_hkq7xu2,t1_hkpyoe6,alcoholfreebeer,https://old.reddit.com/r/alcoholfreebeer/comments/qsysqv/hey_i_started_doing_a_podcast/hkq7xu2/,,,
snscrape.modules.reddit.Comment,FreeBeer_UK,entertaining almost brewing love story info af lager production interesting asides many processes products expected second punky thrash intro tune though,2021-11-15T14:10:31+00:00,t1_hkpyoe6,t3_qsysqv,alcoholfreebeer,https://old.reddit.com/r/alcoholfreebeer/comments/qsysqv/hey_i_started_doing_a_podcast/hkpyoe6/,,,
snscrape.modules.reddit.Comment,FreeBeer_UK,another one add shopping cart,2021-11-15T13:42:49+00:00,t1_hkpvecb,t3_quex8i,alcoholfreebeer,https://old.reddit.com/r/alcoholfreebeer/comments/quex8i/this_shouldnt_work_but_really_does/hkpvecb/,,,
snscrape.modules.reddit.Comment,brawlidol,coffee point browar funky fluid poland fruity nice restrained dash coffee,2021-11-15T12:05:48+00:00,t1_hkpljz4,t3_quex8i,alcoholfreebeer,https://old.reddit.com/r/alcoholfreebeer/comments/quex8i/this_shouldnt_work_but_really_does/hkpljz4/,,,
snscrape.modules.reddit.Comment,All-Hail-The-Ale,going order see spot difference,2021-11-15T09:26:57+00:00,t1_hkp9v3r,t1_hkfzz5b,alcoholfreebeer,https://old.reddit.com/r/alcoholfreebeer/comments/qsi4us/mash_gang_stoop_american_pilsner_review/hkp9v3r/,,,
snscrape.modules.reddit.Comment,All-Hail-The-Ale,one know going look one,2021-11-15T09:26:02+00:00,t1_hkp9sw8,t1_hkp4pqo,alcoholfreebeer,https://old.reddit.com/r/alcoholfreebeer/comments/qsi4us/mash_gang_stoop_american_pilsner_review/hkp9sw8/,,,
snscrape.modules.reddit.Comment,angmoelah,guinness actually available anywhere outside uk ireland,2021-11-15T08:15:01+00:00,t1_hkp4sob,t1_hk23gc3,alcoholfreebeer,https://old.reddit.com/r/alcoholfreebeer/comments/qorvc8/dark_af_beers_athletic_partake_gruvi_and_big_drop/hkp4sob/,,,
snscrape.modules.reddit.Comment,angmoelah,one beers looks almost like milk gonna try,2021-11-15T08:13:58+00:00,t1_hkp4pqo,t3_qsi4us,alcoholfreebeer,https://old.reddit.com/r/alcoholfreebeer/comments/qsi4us/mash_gang_stoop_american_pilsner_review/hkp4pqo/,,,
snscrape.modules.reddit.Comment,FreeBeer_UK,great add list,2021-11-14T16:39:41+00:00,t1_hklrnas,t3_qsysqv,alcoholfreebeer,https://old.reddit.com/r/alcoholfreebeer/comments/qsysqv/hey_i_started_doing_a_podcast/hklrnas/,,,
snscrape.modules.reddit.Comment,Mash__Gang,guys want cover anything episode ask away best,2021-11-13T12:08:50+00:00,t1_hkg6og7,t3_qsysqv,alcoholfreebeer,https://old.reddit.com/r/alcoholfreebeer/comments/qsysqv/hey_i_started_doing_a_podcast/hkg6og7/,,,
snscrape.modules.reddit.Comment,Mash__Gang,heaps normal xpa one fave beers,2021-11-13T10:47:34+00:00,t1_hkg0ry6,t3_qfwovh,alcoholfreebeer,https://old.reddit.com/r/alcoholfreebeer/comments/qfwovh/parc_pils_heaps_normal_xpa_free_time_australia/hkg0ry6/,,,
snscrape.modules.reddit.Comment,Mash__Gang,still brew lot home time best manage galaxy lager recently pretty pretty ok,2021-11-13T10:39:43+00:00,t1_hkg090r,t3_q20qt9,alcoholfreebeer,https://old.reddit.com/r/alcoholfreebeer/comments/q20qt9/anyone_brew_their_own_na_beer/hkg090r/,,,
snscrape.modules.reddit.Comment,Mash__Gang,fairly sure low lager staroparmon sic,2021-11-13T10:38:50+00:00,t1_hkg06wd,t3_qcyuj6,alcoholfreebeer,https://old.reddit.com/r/alcoholfreebeer/comments/qcyuj6/revisiting_sainsburys_own_brand_alcohol_free/hkg06wd/,,,
snscrape.modules.reddit.Comment,Mash__Gang,new batch uncommon raises little happening chilli level think dropping conditioning longer condition improves things like stoop less kick barely last tank sample uncommon run add double dose carbonation going add conditioning canning,2021-11-13T10:35:37+00:00,t1_hkfzz5b,t1_hkfzbg9,alcoholfreebeer,https://old.reddit.com/r/alcoholfreebeer/comments/qsi4us/mash_gang_stoop_american_pilsner_review/hkfzz5b/,,,
snscrape.modules.reddit.Comment,FreeBeer_UK,u wrong opinion though able get chilli beers since first batch cali uncommon,2021-11-13T10:25:50+00:00,t1_hkfzbg9,t3_qsi4us,alcoholfreebeer,https://old.reddit.com/r/alcoholfreebeer/comments/qsi4us/mash_gang_stoop_american_pilsner_review/hkfzbg9/,,,
snscrape.modules.reddit.Comment,AnglinAntonio,big drop goto stout,2021-11-10T18:21:30+00:00,t1_hk3jnus,t3_qorvc8,alcoholfreebeer,https://old.reddit.com/r/alcoholfreebeer/comments/qorvc8/dark_af_beers_athletic_partake_gruvi_and_big_drop/hk3jnus/,,,
snscrape.modules.reddit.Comment,tuctrohs,regular guinness pretty popular hopeful appear soon,2021-11-10T12:06:07+00:00,t1_hk2495o,t1_hk23gc3,alcoholfreebeer,https://old.reddit.com/r/alcoholfreebeer/comments/qorvc8/dark_af_beers_athletic_partake_gruvi_and_big_drop/hk2495o/,,,
snscrape.modules.reddit.Comment,FreeBeer_UK,managed try us af stouts yet though apparently untitled chocolate milk available many glasses guinness attest fantastic flying shelves get states sure mad sell huge market,2021-11-10T11:57:15+00:00,t1_hk23gc3,t3_qorvc8,alcoholfreebeer,https://old.reddit.com/r/alcoholfreebeer/comments/qorvc8/dark_af_beers_athletic_partake_gruvi_and_big_drop/hk23gc3/,,,
snscrape.modules.reddit.Comment,tuctrohs,great hear definitely try,2021-11-10T11:56:25+00:00,t1_hk23doh,t1_hjv2dr1,alcoholfreebeer,https://old.reddit.com/r/alcoholfreebeer/comments/qorvc8/dark_af_beers_athletic_partake_gruvi_and_big_drop/hk23doh/,,,
snscrape.modules.reddit.Comment,sklxbnz,ok tried wellbeing coffee cream stout man new winner rich smooth without sweet would highly recommend check na beer list care,2021-11-08T22:41:36+00:00,t1_hjv2dr1,t1_hjpgt7k,alcoholfreebeer,https://old.reddit.com/r/alcoholfreebeer/comments/qorvc8/dark_af_beers_athletic_partake_gruvi_and_big_drop/hjv2dr1/,,,
snscrape.modules.reddit.Comment,FreeBeer_UK,really well lager good would nice see try styles,2021-11-08T15:09:26+00:00,t1_hjt781n,t3_qngl9a,alcoholfreebeer,https://old.reddit.com/r/alcoholfreebeer/comments/qngl9a/unltd_ipa_review/hjt781n/,,,
snscrape.modules.reddit.Comment,tuctrohs,thanks notes sure whether going order gourdy athletic given buy varieties including locally since say good think,2021-11-07T18:54:45+00:00,t1_hjpgt7k,t1_hjpdxzc,alcoholfreebeer,https://old.reddit.com/r/alcoholfreebeer/comments/qorvc8/dark_af_beers_athletic_partake_gruvi_and_big_drop/hjpgt7k/,,,
snscrape.modules.reddit.Comment,sklxbnz,thanks nice write athletic also dark gourdy quite good prefer big stouts skinny mouth feel wellbeing coffee cream stout arriving next couple days high hopes awesome oh yeah untitled chocolate milk simply amazing implied name sweet one cheers,2021-11-07T18:36:13+00:00,t1_hjpdxzc,t3_qorvc8,alcoholfreebeer,https://old.reddit.com/r/alcoholfreebeer/comments/qorvc8/dark_af_beers_athletic_partake_gruvi_and_big_drop/hjpdxzc/,,,
snscrape.modules.reddit.Comment,AnglinAntonio,probably right would mind em,2021-11-07T15:09:58+00:00,t1_hjoiutu,t1_hjj9m0d,alcoholfreebeer,https://old.reddit.com/r/alcoholfreebeer/comments/qnftk4/black_friday_sale_already_at_wisebartender/hjoiutu/,,,
snscrape.modules.reddit.Comment,All-Hail-The-Ale,calorie count insanely low,2021-11-06T17:33:54+00:00,t1_hjkoewz,t1_hjj9tva,alcoholfreebeer,https://old.reddit.com/r/alcoholfreebeer/comments/qngl9a/unltd_ipa_review/hjkoewz/,,,
snscrape.modules.reddit.Comment,brawlidol,thought light good flavours low calorie,2021-11-06T10:37:03+00:00,t1_hjj9tva,t3_qngl9a,alcoholfreebeer,https://old.reddit.com/r/alcoholfreebeer/comments/qngl9a/unltd_ipa_review/hjj9tva/,,,
snscrape.modules.reddit.Comment,brawlidol,looking sales page pretty much know beers gonna give bin end pack,2021-11-06T10:34:24+00:00,t1_hjj9m0d,t3_qnftk4,alcoholfreebeer,https://old.reddit.com/r/alcoholfreebeer/comments/qnftk4/black_friday_sale_already_at_wisebartender/hjj9m0d/,,,
snscrape.modules.reddit.Comment,All-Hail-The-Ale,thanks bud much appreciated,2021-11-01T19:48:41+00:00,t1_hix7lan,t1_hiwcvki,alcoholfreebeer,https://old.reddit.com/r/alcoholfreebeer/comments/qiihl9/cobra_zero_review/hix7lan/,,,
snscrape.modules.reddit.Comment,FreeBeer_UK,kind magnanimous reviewer mr u,2021-11-01T16:17:14+00:00,t1_hiwcvki,t3_qiihl9,alcoholfreebeer,https://old.reddit.com/r/alcoholfreebeer/comments/qiihl9/cobra_zero_review/hiwcvki/,,,
snscrape.modules.reddit.Comment,brawlidol,great review always beer sounds awful though,2021-10-31T08:50:16+00:00,t1_hiqt6fb,t1_hioifke,alcoholfreebeer,https://old.reddit.com/r/alcoholfreebeer/comments/qiihl9/cobra_zero_review/hiqt6fb/,,,
snscrape.modules.reddit.Comment,All-Hail-The-Ale,fair play bud win,2021-10-30T19:43:41+00:00,t1_hioifke,t1_hinyhgg,alcoholfreebeer,https://old.reddit.com/r/alcoholfreebeer/comments/qiihl9/cobra_zero_review/hioifke/,,,
snscrape.modules.reddit.Comment,brawlidol,ordered back review,2021-10-30T17:23:39+00:00,t1_hinyhgg,t3_qiihl9,alcoholfreebeer,https://old.reddit.com/r/alcoholfreebeer/comments/qiihl9/cobra_zero_review/hinyhgg/,,,
snscrape.modules.reddit.Comment,StephBets,ordered sobah pepper berry got different pale ale glad dodged bullet lol,2021-10-29T22:25:12+00:00,t1_hikliyq,t1_hii2bii,alcoholfreebeer,https://old.reddit.com/r/alcoholfreebeer/comments/qfwovh/parc_pils_heaps_normal_xpa_free_time_australia/hikliyq/,,,
snscrape.modules.reddit.Comment,Mammoth-Variation223,nort varieties lot big bottle shops quite nice also tinnies pale ale like anyone tried sobah tried couple terrible,2021-10-29T11:53:31+00:00,t1_hii2bii,t3_qfwovh,alcoholfreebeer,https://old.reddit.com/r/alcoholfreebeer/comments/qfwovh/parc_pils_heaps_normal_xpa_free_time_australia/hii2bii/,,,
snscrape.modules.reddit.Comment,StephBets,ooh check mash gang thanks rec seen af vb yet surprised working james squire af beer tried yet carlton zero everyone wants piece pie,2021-10-27T00:35:26+00:00,t1_hi6qo9m,t1_hi41d3o,alcoholfreebeer,https://old.reddit.com/r/alcoholfreebeer/comments/qfwovh/parc_pils_heaps_normal_xpa_free_time_australia/hi6qo9m/,,,
snscrape.modules.reddit.Comment,brawlidol,ordered sobersauce back review,2021-10-26T13:40:08+00:00,t1_hi42sxp,t3_qdmg4h,alcoholfreebeer,https://old.reddit.com/r/alcoholfreebeer/comments/qdmg4h/kloster_andechs_weissbier_af_review/hi42sxp/,,,
snscrape.modules.reddit.Comment,FreeBeer_UK,yeah looks like af market aus really taking seen shops yet think heaps normal might available stockists know big drop uk aus wing opened us athletic brewing either process opening already presence heard mash gang pushing wonderful also weird af beers looks like set vb available yet,2021-10-26T13:29:03+00:00,t1_hi41d3o,t3_qfwovh,alcoholfreebeer,https://old.reddit.com/r/alcoholfreebeer/comments/qfwovh/parc_pils_heaps_normal_xpa_free_time_australia/hi41d3o/,,,
snscrape.modules.reddit.Comment,tuctrohs,awesome thank,2021-10-26T13:21:11+00:00,t1_hi40d90,t1_hi409w5,alcoholfreebeer,https://old.reddit.com/r/alcoholfreebeer/comments/qe3ins/meta_flair_for_countryregion/hi40d90/,,,
snscrape.modules.reddit.Comment,FreeBeer_UK,post flair available added uk usa eu aus far let know want others adding,2021-10-26T13:20:26+00:00,t1_hi409w5,t3_qe3ins,alcoholfreebeer,https://old.reddit.com/r/alcoholfreebeer/comments/qe3ins/meta_flair_for_countryregion/hi409w5/,,,
snscrape.modules.reddit.Comment,FreeBeer_UK,sure look get flairs working,2021-10-24T21:29:08+00:00,t1_hhwty1n,t3_qe3ins,alcoholfreebeer,https://old.reddit.com/r/alcoholfreebeer/comments/qe3ins/meta_flair_for_countryregion/hhwty1n/,,,
snscrape.modules.reddit.Comment,AnglinAntonio,tried like big bottles,2021-10-22T16:05:10+00:00,t1_hhmvid6,t3_qcyuj6,alcoholfreebeer,https://old.reddit.com/r/alcoholfreebeer/comments/qcyuj6/revisiting_sainsburys_own_brand_alcohol_free/hhmvid6/,,,
snscrape.modules.reddit.Comment,brawlidol,pour sink mate,2021-10-22T07:46:20+00:00,t1_hhlf022,t3_qcyuj6,alcoholfreebeer,https://old.reddit.com/r/alcoholfreebeer/comments/qcyuj6/revisiting_sainsburys_own_brand_alcohol_free/hhlf022/,,,
snscrape.modules.reddit.Comment,FreeBeer_UK,opinions,2021-10-21T19:01:35+00:00,t1_hhixb1w,t3_qcyuj6,alcoholfreebeer,https://old.reddit.com/r/alcoholfreebeer/comments/qcyuj6/revisiting_sainsburys_own_brand_alcohol_free/hhixb1w/,,,
snscrape.modules.reddit.Comment,FreeBeer_UK,nah stick ghost ship af,2021-10-19T16:02:45+00:00,t1_hh8vzaz,t3_q8tzt1,alcoholfreebeer,https://old.reddit.com/r/alcoholfreebeer/comments/q8tzt1/adnams_sole_star_pale_amber_ale_review/hh8vzaz/,,,
snscrape.modules.reddit.Comment,AnglinAntonio,nice stout pretty good tried,2021-10-15T14:56:50+00:00,t1_hgquin0,t3_q8o24i,alcoholfreebeer,https://old.reddit.com/r/alcoholfreebeer/comments/q8o24i/calling_all_af_porter_and_stout_fans_nirvana/hgquin0/,,,
snscrape.modules.reddit.Comment,FreeBeer_UK,time autumn winter nirvana brewery releasing new london porter satisfy us love decent dark af beer blurb nothing says settle fire cold season like decent dark beer bonus one comes without hangover dark roasted malts take centre stage bringing rich notes caramel coffee light touch classic british hop fuggles enhancing notes spice oak recommend enjoying beer alongside hearty british grub get hands winter warmer stocks last looks like available early birds,2021-10-15T13:08:13+00:00,t1_hgqg5cd,t3_q8o24i,alcoholfreebeer,https://old.reddit.com/r/alcoholfreebeer/comments/q8o24i/calling_all_af_porter_and_stout_fans_nirvana/hgqg5cd/,,,
snscrape.modules.reddit.Comment,FreeBeer_UK,really go wrong af coffee porter stout except maybe mikkeller beer geek flat white got slight bit orange nose according tasting notes write review properly,2021-10-12T09:51:42+00:00,t1_hgc4g7i,t3_q42u2f,alcoholfreebeer,https://old.reddit.com/r/alcoholfreebeer/comments/q42u2f/nittenauer_lola_coffee_porter_review/hgc4g7i/,,,
snscrape.modules.reddit.Comment,brawlidol,tried homebrewing back day think wife would allow smell,2021-10-10T09:47:24+00:00,t1_hg34uy7,t3_q20qt9,alcoholfreebeer,https://old.reddit.com/r/alcoholfreebeer/comments/q20qt9/anyone_brew_their_own_na_beer/hg34uy7/,,,
snscrape.modules.reddit.Comment,AnglinAntonio,looks good lots free gins shelves might try one,2021-09-30T12:56:12+00:00,t1_heufd8y,t3_pwcnpe,alcoholfreebeer,https://old.reddit.com/r/alcoholfreebeer/comments/pwcnpe/we_try_persons_london_dry_gt_botanicals/heufd8y/,,,
snscrape.modules.reddit.Comment,brawlidol,seem lot smashed pale get rid,2021-09-30T08:03:13+00:00,t1_hets2o1,t1_heq366u,alcoholfreebeer,https://old.reddit.com/r/alcoholfreebeer/comments/pxw64k/this_weeks_binend_order_from_wise_bartender_a_bit/hets2o1/,,,
snscrape.modules.reddit.Comment,AnglinAntonio,x smashed pale ale x furstenberg pilsener x nittenauer wit ive heard good things brand x lervig worries lemon looks like explode x ambar tostada x sambrook stand easy x adnams wild wave cide x caleno light zesty cocktail,2021-09-29T14:11:28+00:00,t1_heq366u,t3_pxw64k,alcoholfreebeer,https://old.reddit.com/r/alcoholfreebeer/comments/pxw64k/this_weeks_binend_order_from_wise_bartender_a_bit/heq366u/,,,
snscrape.modules.reddit.Comment,AnglinAntonio,local store run already,2021-09-23T14:08:39+00:00,t1_hdyry1r,t3_prg4uh,alcoholfreebeer,https://old.reddit.com/r/alcoholfreebeer/comments/prg4uh/i_know_its_been_posted_before_but_they_really_got/hdyry1r/,,,
snscrape.modules.reddit.Comment,All-Hail-The-Ale,oh dear got one try,2021-09-21T19:20:25+00:00,t1_hdr60pz,t1_hcybkps,alcoholfreebeer,https://old.reddit.com/r/alcoholfreebeer/comments/pnnh5h/anyone_tried_ghostship_05_looks_good/hdr60pz/,,,
snscrape.modules.reddit.Comment,All-Hail-The-Ale,one best eaily available pale ale options low sector,2021-09-21T19:19:59+00:00,t1_hdr5yhs,t3_pnnh5h,alcoholfreebeer,https://old.reddit.com/r/alcoholfreebeer/comments/pnnh5h/anyone_tried_ghostship_05_looks_good/hdr5yhs/,,,
snscrape.modules.reddit.Comment,guitarrope,one quite good af beer,2021-09-20T22:27:34+00:00,t1_hdnbox0,t3_pmlkac,alcoholfreebeer,https://old.reddit.com/r/alcoholfreebeer/comments/pmlkac/heineken_00_zero_taste_test_review_and_score/hdnbox0/,,,
snscrape.modules.reddit.Comment,FreeBeer_UK,yep started passed brewing duties local companies australia us canada etc quite prolific hopefully get stuff get poolside ddh wonderful,2021-09-20T18:25:11+00:00,t1_hdmd62m,t1_hdku2em,alcoholfreebeer,https://old.reddit.com/r/alcoholfreebeer/comments/prqlov/uptown_craft_lager_from_melbourne_australia/hdmd62m/,,,
snscrape.modules.reddit.Comment,brawlidol,completely agree need go buy,2021-09-20T14:43:38+00:00,t1_hdlgtmu,t1_hdkzo32,alcoholfreebeer,https://old.reddit.com/r/alcoholfreebeer/comments/prg4uh/i_know_its_been_posted_before_but_they_really_got/hdlgtmu/,,,
snscrape.modules.reddit.Comment,chipsdub,slightly lighter maybe bit sweeter regardless similar perhaps even nicer original,2021-09-20T12:25:57+00:00,t1_hdkzo32,t1_hdke7tm,alcoholfreebeer,https://old.reddit.com/r/alcoholfreebeer/comments/prg4uh/i_know_its_been_posted_before_but_they_really_got/hdkzo32/,,,
snscrape.modules.reddit.Comment,Peteosophy,interesting uk reference come research although looking either,2021-09-20T11:27:26+00:00,t1_hdku2em,t1_hdkrfg6,alcoholfreebeer,https://old.reddit.com/r/alcoholfreebeer/comments/prqlov/uptown_craft_lager_from_melbourne_australia/hdku2em/,,,
snscrape.modules.reddit.Comment,FreeBeer_UK,big drop actually uk company though good see products getting aus unfortunately bland watery really runt big drop litter core range beers really excellent comparison galactic milk stout pine trail especially,2021-09-20T10:55:55+00:00,t1_hdkrfg6,t3_prqlov,alcoholfreebeer,https://old.reddit.com/r/alcoholfreebeer/comments/prqlov/uptown_craft_lager_from_melbourne_australia/hdkrfg6/,,,
snscrape.modules.reddit.Comment,brawlidol,yeah think lot us shock well guinness,2021-09-20T07:39:24+00:00,t1_hdke7tm,t3_prg4uh,alcoholfreebeer,https://old.reddit.com/r/alcoholfreebeer/comments/prg4uh/i_know_its_been_posted_before_but_they_really_got/hdke7tm/,,,
snscrape.modules.reddit.Comment,brawlidol,personally think though feels bit thinner sweeter much pour head experience far concerned dont sond like alchie alchie wouldnt able remember anything like yesterday,2021-09-18T10:11:44+00:00,t1_hdbd7eo,t1_hd9a2z2,alcoholfreebeer,https://old.reddit.com/r/alcoholfreebeer/comments/pejzf6/guinness_00_is_now_mine/hdbd7eo/,,,
snscrape.modules.reddit.Comment,iamavoyager,different alcoholic version back drank liked guiness remember like yesterday gosh sound like alchie say,2021-09-17T21:33:45+00:00,t1_hd9a2z2,t3_pejzf6,alcoholfreebeer,https://old.reddit.com/r/alcoholfreebeer/comments/pejzf6/guinness_00_is_now_mine/hd9a2z2/,,,
snscrape.modules.reddit.Comment,brawlidol,like two said good choice stay away free beer sole star pretty much brown soda water,2021-09-15T14:20:17+00:00,t1_hcybkps,t3_pnnh5h,alcoholfreebeer,https://old.reddit.com/r/alcoholfreebeer/comments/pnnh5h/anyone_tried_ghostship_05_looks_good/hcybkps/,,,
snscrape.modules.reddit.Comment,FreeBeer_UK,yeah one easily available ales actually quite drinkable reminds one much guinness,2021-09-14T08:59:21+00:00,t1_hcss0qg,t3_pnnh5h,alcoholfreebeer,https://old.reddit.com/r/alcoholfreebeer/comments/pnnh5h/anyone_tried_ghostship_05_looks_good/hcss0qg/,,,
snscrape.modules.reddit.Comment,AnglinAntonio,good lots citrus might sweeter full one remember good choice widely available,2021-09-13T21:07:42+00:00,t1_hcqmnmq,t3_pnnh5h,alcoholfreebeer,https://old.reddit.com/r/alcoholfreebeer/comments/pnnh5h/anyone_tried_ghostship_05_looks_good/hcqmnmq/,,,
snscrape.modules.reddit.Comment,FreeBeer_UK,quite pour heineken certainly inoffensive hope eventually muscles blue default af option slot restaurants,2021-09-13T09:01:22+00:00,t1_hco537l,t3_pmlkac,alcoholfreebeer,https://old.reddit.com/r/alcoholfreebeer/comments/pmlkac/heineken_00_zero_taste_test_review_and_score/hco537l/,,,
snscrape.modules.reddit.Comment,FreeBeer_UK,like real thing fastest review ever cobbled together,2021-09-01T17:53:12+00:00,t1_hb7q27u,t3_pejzf6,alcoholfreebeer,https://old.reddit.com/r/alcoholfreebeer/comments/pejzf6/guinness_00_is_now_mine/hb7q27u/,,,
snscrape.modules.reddit.Comment,devilhorn777,awesome thanks man america get loved guinness back drank exciting,2021-08-31T12:35:05+00:00,t1_hb1szlx,t1_hb14riy,alcoholfreebeer,https://old.reddit.com/r/alcoholfreebeer/comments/pejzf6/guinness_00_is_now_mine/hb1szlx/,,,
snscrape.modules.reddit.Comment,FreeBeer_UK,sure would fools make available worldwide still waiting first taste,2021-08-31T10:10:59+00:00,t1_hb1frs6,t1_hb1e8az,alcoholfreebeer,https://old.reddit.com/r/alcoholfreebeer/comments/pejzf6/guinness_00_is_now_mine/hb1frs6/,,,
snscrape.modules.reddit.Comment,Leif-Erik,hope bring finland great taste,2021-08-31T09:49:42+00:00,t1_hb1e8az,t3_pejzf6,alcoholfreebeer,https://old.reddit.com/r/alcoholfreebeer/comments/pejzf6/guinness_00_is_now_mine/hb1e8az/,,,
snscrape.modules.reddit.Comment,FreeBeer_UK,great news mate shipment comes tomorrow sounding like worth wait,2021-08-31T09:09:10+00:00,t1_hb1bgte,t1_hb14riy,alcoholfreebeer,https://old.reddit.com/r/alcoholfreebeer/comments/pejzf6/guinness_00_is_now_mine/hb1bgte/,,,
snscrape.modules.reddit.Comment,brawlidol,south london similar regular abv guinness bit thinner maybe theres also bit sweetness guinness sure,2021-08-31T07:28:45+00:00,t1_hb14riy,t1_hazw4lv,alcoholfreebeer,https://old.reddit.com/r/alcoholfreebeer/comments/pejzf6/guinness_00_is_now_mine/hb14riy/,,,
snscrape.modules.reddit.Comment,devilhorn777,,2021-08-31T00:21:06+00:00,t1_hazw4lv,t3_pejzf6,alcoholfreebeer,https://old.reddit.com/r/alcoholfreebeer/comments/pejzf6/guinness_00_is_now_mine/hazw4lv/,,,
