_type,author,body,created,id,parentId,subreddit,url,link,selftext,title
snscrape.modules.reddit.Comment,brawlidol,worth stroll big tescos packs left none,2021-08-30T15:10:59+00:00,t1_haxqum3,t3_pejzf6,alcoholfreebeer,https://old.reddit.com/r/alcoholfreebeer/comments/pejzf6/guinness_00_is_now_mine/haxqum3/,,,
snscrape.modules.reddit.Comment,AnglinAntonio,yeah man going free guiness beer really missing gotta keep eye,2021-08-24T08:48:13+00:00,t1_ha51qes,t3_pa4mkt,alcoholfreebeer,https://old.reddit.com/r/alcoholfreebeer/comments/pa4mkt/its_almost_heeeeerrrrrreeeeeee/ha51qes/,,,
snscrape.modules.reddit.Comment,FreeBeer_UK,check morrisons stores daily folks,2021-08-23T17:31:25+00:00,t1_ha21cvf,t3_pa4mkt,alcoholfreebeer,https://old.reddit.com/r/alcoholfreebeer/comments/pa4mkt/its_almost_heeeeerrrrrreeeeeee/ha21cvf/,,,
snscrape.modules.reddit.Comment,twitterInfo_bot,guess back back every bit guinness taste minus let settle posted photos tweet photo github new,2021-08-23T17:31:10+00:00,t1_ha21bl1,t3_pa4mkt,alcoholfreebeer,https://old.reddit.com/r/alcoholfreebeer/comments/pa4mkt/its_almost_heeeeerrrrrreeeeeee/ha21bl1/,,,
snscrape.modules.reddit.Comment,Stargazett,thanks reviewing new beers every week depending thirsty,2021-08-21T14:13:14+00:00,t1_h9sh7bn,t3_p7642k,alcoholfreebeer,https://old.reddit.com/r/alcoholfreebeer/comments/p7642k/nearlybeer_real_reviews_no_alcohol_excellent_beers/h9sh7bn/,,,
snscrape.modules.reddit.Comment,brawlidol,stuff,2021-08-19T15:06:26+00:00,t1_h9jh8nf,t3_p7642k,alcoholfreebeer,https://old.reddit.com/r/alcoholfreebeer/comments/p7642k/nearlybeer_real_reviews_no_alcohol_excellent_beers/h9jh8nf/,,,
snscrape.modules.reddit.Comment,AnglinAntonio,yeah new wrinkle label guess binend really lovely lager though,2021-08-13T07:13:46+00:00,t1_h8r9vz7,t1_h8k0kcw,alcoholfreebeer,https://old.reddit.com/r/alcoholfreebeer/comments/p2d6xz/this_months_binend_from_wise_bartender/h8r9vz7/,,,
snscrape.modules.reddit.Comment,FreeBeer_UK,think stoop pretty new look like good collection enjoy,2021-08-11T17:13:05+00:00,t1_h8k0kcw,t1_h8j6yv1,alcoholfreebeer,https://old.reddit.com/r/alcoholfreebeer/comments/p2d6xz/this_months_binend_from_wise_bartender/h8k0kcw/,,,
snscrape.modules.reddit.Comment,AnglinAntonio,x smashed pale ale x ambar tostada x brune dmc x chillio watermelon x kombucha lemon lavendar x roksoba lucky x one road proceed caution x stoop lager happy one dont think tried,2021-08-11T13:40:12+00:00,t1_h8j6yv1,t3_p2d6xz,alcoholfreebeer,https://old.reddit.com/r/alcoholfreebeer/comments/p2d6xz/this_months_binend_from_wise_bartender/h8j6yv1/,,,
snscrape.modules.reddit.Comment,FreeBeer_UK,needs happen,2021-08-07T18:52:15+00:00,t1_h832csp,t1_h81t7ii,alcoholfreebeer,https://old.reddit.com/r/alcoholfreebeer/comments/oeq9bn/more_guinness_00_hype/h832csp/,,,
snscrape.modules.reddit.Comment,IrishStud84,get belly year dying try,2021-08-07T12:40:34+00:00,t1_h81t7ii,t3_oeq9bn,alcoholfreebeer,https://old.reddit.com/r/alcoholfreebeer/comments/oeq9bn/more_guinness_00_hype/h81t7ii/,,,
snscrape.modules.reddit.Comment,Explore_Everything78,bit bit like fruit juice bit acidity sourness overall pretty nice,2021-08-07T00:34:46+00:00,t1_h802e70,t1_h7xe17x,alcoholfreebeer,https://old.reddit.com/r/alcoholfreebeer/comments/oz2nxx/not_beer_but_a_nice_red/h802e70/,,,
snscrape.modules.reddit.Comment,chinabeerguy,sure available uk currently asahi dry zero favorite af beer best,2021-08-06T13:50:54+00:00,t1_h7xo39o,t3_mj7upd,alcoholfreebeer,https://old.reddit.com/r/alcoholfreebeer/comments/mj7upd/genuine_completely_alcohol_free_beer/h7xo39o/,,,
snscrape.modules.reddit.Comment,AnglinAntonio,mcguigan good ones bottle eisberg red years ago like expired grape juice suppose way,2021-08-06T12:57:27+00:00,t1_h7xhjzn,t3_oz2nxx,alcoholfreebeer,https://old.reddit.com/r/alcoholfreebeer/comments/oz2nxx/not_beer_but_a_nice_red/h7xhjzn/,,,
snscrape.modules.reddit.Comment,Rosie_The_Redditor09,sweet,2021-08-06T12:25:04+00:00,t1_h7xe17x,t3_oz2nxx,alcoholfreebeer,https://old.reddit.com/r/alcoholfreebeer/comments/oz2nxx/not_beer_but_a_nice_red/h7xe17x/,,,
snscrape.modules.reddit.Comment,FreeBeer_UK,say gotten af wine anywhere near much af beer wines tried good great aromas taste anything similar full abv version certainly seem choice around nowadays,2021-08-06T10:56:57+00:00,t1_h7x6b9i,t3_oz2nxx,alcoholfreebeer,https://old.reddit.com/r/alcoholfreebeer/comments/oz2nxx/not_beer_but_a_nice_red/h7x6b9i/,,,
snscrape.modules.reddit.Comment,FreeBeer_UK,missed mail holiday better get,2021-08-05T19:06:35+00:00,t1_h7uctpr,t1_h7tdb5u,alcoholfreebeer,https://old.reddit.com/r/alcoholfreebeer/comments/oyfvcl/brand_new_goosewing_ipa_from_my_local_af_brewery/h7uctpr/,,,
snscrape.modules.reddit.Comment,turncol,released week goes general sale tomorrow early access mailing list subscribers delivered today currently chilling fringe sampling work let know think,2021-08-05T15:03:32+00:00,t1_h7tdb5u,t1_h7t5ys6,alcoholfreebeer,https://old.reddit.com/r/alcoholfreebeer/comments/oyfvcl/brand_new_goosewing_ipa_from_my_local_af_brewery/h7tdb5u/,,,
snscrape.modules.reddit.Comment,FreeBeer_UK,low tide new version works taken instagram seem twitter hard work developing new recipe dipa hopefully releasing near future meantime got super limited test run trialling brand new hop profile bru motueka mosaic amongst couple secret ideas bru particular favourite hop lowtide camp bursting tropical notes nose fantastic mango pineapple taste beautiful say got limited amount website hop grab gone gone wait till main brew released,2021-08-05T14:34:10+00:00,t1_h7t8r4p,t1_h7pai24,alcoholfreebeer,https://old.reddit.com/r/alcoholfreebeer/comments/oxxvco/lovely_alcohol_free_dipa/h7t8r4p/,,,
snscrape.modules.reddit.Comment,brawlidol,ooh love lager looks new standard af beers,2021-08-05T14:20:34+00:00,t1_h7t5ys6,t3_oyfvcl,alcoholfreebeer,https://old.reddit.com/r/alcoholfreebeer/comments/oyfvcl/brand_new_goosewing_ipa_from_my_local_af_brewery/h7t5ys6/,,,
snscrape.modules.reddit.Comment,AnglinAntonio,would love dip toe,2021-08-05T10:27:08+00:00,t1_h7sf7l7,t3_oxxvco,alcoholfreebeer,https://old.reddit.com/r/alcoholfreebeer/comments/oxxvco/lovely_alcohol_free_dipa/h7sf7l7/,,,
snscrape.modules.reddit.Comment,brawlidol,fruity quite high bitterness rounds nicely low tide fellas know thing two brewing good nolo beer,2021-08-04T17:37:22+00:00,t1_h7pai24,t3_oxxvco,alcoholfreebeer,https://old.reddit.com/r/alcoholfreebeer/comments/oxxvco/lovely_alcohol_free_dipa/h7pai24/,,,
snscrape.modules.reddit.Comment,VBee_Ulorin,happens best worst us,2021-07-28T12:08:32+00:00,t1_h6tkpnu,t3_oqyt33,alcoholfreebeer,https://old.reddit.com/r/alcoholfreebeer/comments/oqyt33/iced_heineken/h6tkpnu/,,,
snscrape.modules.reddit.Comment,brawlidol,beautiful tried eat spoon last heat,2021-07-25T06:40:55+00:00,t1_h6g748u,t3_oqyt33,alcoholfreebeer,https://old.reddit.com/r/alcoholfreebeer/comments/oqyt33/iced_heineken/h6g748u/,,,
snscrape.modules.reddit.Comment,AnglinAntonio,guess gotta order box,2021-07-22T16:34:30+00:00,t1_h656qrr,t3_op8qgv,alcoholfreebeer,https://old.reddit.com/r/alcoholfreebeer/comments/op8qgv/new_uk_brewery_specialising_in_low_and/h656qrr/,,,
snscrape.modules.reddit.Comment,FreeBeer_UK,two offerings moment lager weiss great looking cans,2021-07-22T07:06:32+00:00,t1_h63njvy,t3_op8qgv,alcoholfreebeer,https://old.reddit.com/r/alcoholfreebeer/comments/op8qgv/new_uk_brewery_specialising_in_low_and/h63njvy/,,,
snscrape.modules.reddit.Comment,stretchman_88,good haul dog,2021-07-21T06:00:06+00:00,t1_h5yym9b,t3_o5c9ir,alcoholfreebeer,https://old.reddit.com/r/alcoholfreebeer/comments/o5c9ir/90_zero_proof_haul_walked_in_looking_for_a_46/h5yym9b/,,,
snscrape.modules.reddit.Comment,brawlidol,life gives light bulbs instead onions er never good proverbs,2021-07-19T06:54:46+00:00,t1_h5q5kbq,t1_h5pznzz,alcoholfreebeer,https://old.reddit.com/r/alcoholfreebeer/comments/om5pi5/sainsburys_substituted_my_af_beer_order/h5q5kbq/,,,
snscrape.modules.reddit.Comment,Back2Basic5,kept light bulb price two loose onions,2021-07-19T05:36:58+00:00,t1_h5pznzz,t1_h5m9poz,alcoholfreebeer,https://old.reddit.com/r/alcoholfreebeer/comments/om5pi5/sainsburys_substituted_my_af_beer_order/h5pznzz/,,,
snscrape.modules.reddit.Comment,I_Am_Raddion,know would thank,2021-07-18T13:18:09+00:00,t1_h5mlhdn,t1_h5m9qu0,alcoholfreebeer,https://old.reddit.com/r/alcoholfreebeer/comments/om5pi5/sainsburys_substituted_my_af_beer_order/h5mlhdn/,,,
snscrape.modules.reddit.Comment,brawlidol,could send would,2021-07-18T11:03:49+00:00,t1_h5m9qu0,t1_h5kvk3t,alcoholfreebeer,https://old.reddit.com/r/alcoholfreebeer/comments/om5pi5/sainsburys_substituted_my_af_beer_order/h5m9qu0/,,,
snscrape.modules.reddit.Comment,brawlidol,oooh crunchy,2021-07-18T11:03:24+00:00,t1_h5m9poz,t1_h5lzyk7,alcoholfreebeer,https://old.reddit.com/r/alcoholfreebeer/comments/om5pi5/sainsburys_substituted_my_af_beer_order/h5m9poz/,,,
snscrape.modules.reddit.Comment,Back2Basic5,replaced loose onions light bulb,2021-07-18T08:46:44+00:00,t1_h5lzyk7,t3_om5pi5,alcoholfreebeer,https://old.reddit.com/r/alcoholfreebeer/comments/om5pi5/sainsburys_substituted_my_af_beer_order/h5lzyk7/,,,
snscrape.modules.reddit.Comment,I_Am_Raddion,love bud zero perfect tried heineken sam adams also klausthammer busch na bad bud zero go grateful,2021-07-18T01:34:16+00:00,t1_h5kvk3t,t3_om5pi5,alcoholfreebeer,https://old.reddit.com/r/alcoholfreebeer/comments/om5pi5/sainsburys_substituted_my_af_beer_order/h5kvk3t/,,,
snscrape.modules.reddit.Comment,brawlidol,tap water flavour least cold,2021-07-17T19:29:59+00:00,t1_h5jpohl,t3_om5pi5,alcoholfreebeer,https://old.reddit.com/r/alcoholfreebeer/comments/om5pi5/sainsburys_substituted_my_af_beer_order/h5jpohl/,,,
snscrape.modules.reddit.Comment,brawlidol,stella free nothing special disappointment,2021-07-17T18:20:28+00:00,t1_h5jhb6k,t1_h5j9gyp,alcoholfreebeer,https://old.reddit.com/r/alcoholfreebeer/comments/om5pi5/sainsburys_substituted_my_af_beer_order/h5jhb6k/,,,
snscrape.modules.reddit.Comment,FreeBeer_UK,disaster replacing,2021-07-17T17:17:27+00:00,t1_h5j9gyp,t3_om5pi5,alcoholfreebeer,https://old.reddit.com/r/alcoholfreebeer/comments/om5pi5/sainsburys_substituted_my_af_beer_order/h5j9gyp/,,,
snscrape.modules.reddit.Comment,brawlidol,ooof hope robots ok least something good yes substituted would another level shittiness,2021-07-17T15:22:13+00:00,t1_h5iuzak,t1_h5it3ux,alcoholfreebeer,https://old.reddit.com/r/alcoholfreebeer/comments/om5pi5/sainsburys_substituted_my_af_beer_order/h5iuzak/,,,
snscrape.modules.reddit.Comment,roygbiv1000,least substitute one guess morrisons subbed entire order vague apology goodwill voucher today fair two robots warehouse crashed caused fire,2021-07-17T15:06:28+00:00,t1_h5it3ux,t3_om5pi5,alcoholfreebeer,https://old.reddit.com/r/alcoholfreebeer/comments/om5pi5/sainsburys_substituted_my_af_beer_order/h5it3ux/,,,
snscrape.modules.reddit.Comment,paulwillsmith,agreed almost cheesy aftertaste thought,2021-07-15T17:02:12+00:00,t1_h5an1rf,t3_m13tbf,alcoholfreebeer,https://old.reddit.com/r/alcoholfreebeer/comments/m13tbf/avoid_this_one_from_sainsburys/h5an1rf/,,,
snscrape.modules.reddit.Comment,AnglinAntonio,yeah date think ghost ships bit dented solo cans bit sticky taste great far,2021-07-08T07:56:39+00:00,t1_h4g954z,t1_h4cp048,alcoholfreebeer,https://old.reddit.com/r/alcoholfreebeer/comments/off4f4/latest_binend_purchase_this_time_from_the_alcohol/h4g954z/,,,
snscrape.modules.reddit.Comment,AnglinAntonio,yeah dunno date time maybe noones buying,2021-07-08T07:55:06+00:00,t1_h4g91ls,t1_h4czv0g,alcoholfreebeer,https://old.reddit.com/r/alcoholfreebeer/comments/off4f4/latest_binend_purchase_this_time_from_the_alcohol/h4g91ls/,,,
snscrape.modules.reddit.Comment,FreeBeer_UK,flat whites,2021-07-07T13:38:25+00:00,t1_h4cp048,t1_h4c345j,alcoholfreebeer,https://old.reddit.com/r/alcoholfreebeer/comments/off4f4/latest_binend_purchase_this_time_from_the_alcohol/h4cp048/,,,
snscrape.modules.reddit.Comment,AnglinAntonio,x ridgeside nbtr x clausthaler original x mikeller beer geek flat white x pistonhead flat tyre x wbb solo peach pale x adnams ghost ship x mikeller sun,2021-07-07T09:01:52+00:00,t1_h4c345j,t3_off4f4,alcoholfreebeer,https://old.reddit.com/r/alcoholfreebeer/comments/off4f4/latest_binend_purchase_this_time_from_the_alcohol/h4c345j/,,,
snscrape.modules.reddit.Comment,brawlidol,give already,2021-07-06T17:02:20+00:00,t1_h498bus,t3_oeq9bn,alcoholfreebeer,https://old.reddit.com/r/alcoholfreebeer/comments/oeq9bn/more_guinness_00_hype/h498bus/,,,
snscrape.modules.reddit.Comment,FreeBeer_UK,still release date stuff still exists,2021-07-06T07:43:14+00:00,t1_h47rbzq,t3_oeq9bn,alcoholfreebeer,https://old.reddit.com/r/alcoholfreebeer/comments/oeq9bn/more_guinness_00_hype/h47rbzq/,,,
snscrape.modules.reddit.Comment,mysoultribe,thank burn throat spirits mean liver straight defo leaves burn back throat,2021-07-01T22:30:12+00:00,t1_h3qjgjg,t1_h3k0gvo,alcoholfreebeer,https://old.reddit.com/r/alcoholfreebeer/comments/oaey6o/hey_guys_ive_been_using_three_spirit_drinks_as_my/h3qjgjg/,,,
snscrape.modules.reddit.Comment,FreeBeer_UK,great reviews need try spirits sure would replicate burn,2021-06-30T13:00:51+00:00,t1_h3k0gvo,t3_oaey6o,alcoholfreebeer,https://old.reddit.com/r/alcoholfreebeer/comments/oaey6o/hey_guys_ive_been_using_three_spirit_drinks_as_my/h3k0gvo/,,,
snscrape.modules.reddit.Comment,Ek_enakhifo,personally never enjoyed stouts even liked select ipas lagers tried nearly every sour hard liquor guy,2021-06-23T17:48:27+00:00,t1_h2sj7ds,t1_h2r0wh1,alcoholfreebeer,https://old.reddit.com/r/alcoholfreebeer/comments/o5c9ir/90_zero_proof_haul_walked_in_looking_for_a_46/h2sj7ds/,,,
snscrape.modules.reddit.Comment,FreeBeer_UK,thanks prefer na stout breakfast beer personally,2021-06-23T09:27:32+00:00,t1_h2r0wh1,t1_h2oew41,alcoholfreebeer,https://old.reddit.com/r/alcoholfreebeer/comments/o5c9ir/90_zero_proof_haul_walked_in_looking_for_a_46/h2r0wh1/,,,
snscrape.modules.reddit.Comment,Ek_enakhifo,update drinkable sure really nothing special,2021-06-22T18:12:46+00:00,t1_h2oew41,t1_h2ncfum,alcoholfreebeer,https://old.reddit.com/r/alcoholfreebeer/comments/o5c9ir/90_zero_proof_haul_walked_in_looking_for_a_46/h2oew41/,,,
snscrape.modules.reddit.Comment,Ek_enakhifo,tried yet lemon quest last night think sober carpenter breakfast let know hours,2021-06-22T15:46:14+00:00,t1_h2nva3j,t1_h2ncfum,alcoholfreebeer,https://old.reddit.com/r/alcoholfreebeer/comments/o5c9ir/90_zero_proof_haul_walked_in_looking_for_a_46/h2nva3j/,,,
snscrape.modules.reddit.Comment,FreeBeer_UK,sober carpenters interested trying,2021-06-22T13:14:27+00:00,t1_h2ncfum,t3_o5c9ir,alcoholfreebeer,https://old.reddit.com/r/alcoholfreebeer/comments/o5c9ir/90_zero_proof_haul_walked_in_looking_for_a_46/h2ncfum/,,,
snscrape.modules.reddit.Comment,FreeBeer_UK,could find wise bartender sold nothing amazon coverage heineken getting euros maybe time carlsberg relaunched marketing,2021-06-16T09:37:42+00:00,t1_h1y899p,t1_h1f3zt5,alcoholfreebeer,https://old.reddit.com/r/alcoholfreebeer/comments/nx99di/best_alcohol_free_beer_for_me/h1y899p/,,,
snscrape.modules.reddit.Comment,AnglinAntonio,promo code apple page looks like spelled wrong,2021-06-16T08:46:27+00:00,t1_h1y5125,t3_nyhccy,alcoholfreebeer,https://old.reddit.com/r/alcoholfreebeer/comments/nyhccy/anyone_had_a_listen/h1y5125/,,,
snscrape.modules.reddit.Comment,AnglinAntonio,also search scuffed alcoholfreeco website,2021-06-16T08:44:35+00:00,t1_h1y4wu1,t1_h1y4o5v,alcoholfreebeer,https://old.reddit.com/r/alcoholfreebeer/comments/nzfr2n/i_like_to_buy_the_bin_end_boxes_from_some_of_the/h1y4wu1/,,,
snscrape.modules.reddit.Comment,AnglinAntonio,gem far amaro spritz really bittersweet might new thing,2021-06-16T08:42:24+00:00,t1_h1y4s0o,t1_h1pafji,alcoholfreebeer,https://old.reddit.com/r/alcoholfreebeer/comments/nzfr2n/i_like_to_buy_the_bin_end_boxes_from_some_of_the/h1y4s0o/,,,
snscrape.modules.reddit.Comment,AnglinAntonio,yes buy hahaha,2021-06-16T08:40:43+00:00,t1_h1y4o5v,t1_h1tzi6w,alcoholfreebeer,https://old.reddit.com/r/alcoholfreebeer/comments/nzfr2n/i_like_to_buy_the_bin_end_boxes_from_some_of_the/h1y4o5v/,,,
snscrape.modules.reddit.Comment,AnglinAntonio,bbe april sure really flat tyre months date tasted fine better usual actually think,2021-06-15T18:28:12+00:00,t1_h1vl6zl,t1_h1q3s2u,alcoholfreebeer,https://old.reddit.com/r/alcoholfreebeer/comments/nzfr2n/i_like_to_buy_the_bin_end_boxes_from_some_of_the/h1vl6zl/,,,
snscrape.modules.reddit.Comment,brawlidol,interesting see noughty bear thought pretty new,2021-06-14T12:44:45+00:00,t1_h1q3s2u,t3_nzfr2n,alcoholfreebeer,https://old.reddit.com/r/alcoholfreebeer/comments/nzfr2n/i_like_to_buy_the_bin_end_boxes_from_some_of_the/h1q3s2u/,,,
snscrape.modules.reddit.Comment,AnglinAntonio,x square root mandarin ginger shandy x shipyard low tide pale ale x noughty bear ipa x super bock free x stiegl freibier x pistonhead flat tyre x cloudwater soda green tea simcoe x amaro spritz,2021-06-14T05:43:46+00:00,t1_h1pafji,t3_nzfr2n,alcoholfreebeer,https://old.reddit.com/r/alcoholfreebeer/comments/nzfr2n/i_like_to_buy_the_bin_end_boxes_from_some_of_the/h1pafji/,,,
snscrape.modules.reddit.Comment,brawlidol,used able get tescos maybe one af beer online stores amazon,2021-06-11T16:30:53+00:00,t1_h1f3zt5,t1_h1emco7,alcoholfreebeer,https://old.reddit.com/r/alcoholfreebeer/comments/nx99di/best_alcohol_free_beer_for_me/h1f3zt5/,,,
snscrape.modules.reddit.Comment,FreeBeer_UK,nice despite carlsberg huge brand tried free version think even seen sale anywhere,2021-06-11T14:21:42+00:00,t1_h1emco7,t3_nx99di,alcoholfreebeer,https://old.reddit.com/r/alcoholfreebeer/comments/nx99di/best_alcohol_free_beer_for_me/h1emco7/,,,
snscrape.modules.reddit.Comment,FreeBeer_UK,latest news rounds wait,2021-06-05T17:53:08+00:00,t1_h0pj3az,t3_nt1bkt,alcoholfreebeer,https://old.reddit.com/r/alcoholfreebeer/comments/nt1bkt/guinness_00_relaunching_in_september_2021/h0pj3az/,,,
snscrape.modules.reddit.Comment,twitterInfo_bot,seen elsewhere guinness coming back september posted photos tweet photo github new,2021-06-05T17:53:04+00:00,t1_h0pj30u,t3_nt1bkt,alcoholfreebeer,https://old.reddit.com/r/alcoholfreebeer/comments/nt1bkt/guinness_00_relaunching_in_september_2021/h0pj30u/,,,
snscrape.modules.reddit.Comment,FreeBeer_UK,previously given us zed pale ale bit cracking crunch af peanut butter milk stout great see popular brewery branch options something sorely missing na beer lineup,2021-06-01T15:33:29+00:00,t1_h07bqlx,t3_npwpgo,alcoholfreebeer,https://old.reddit.com/r/alcoholfreebeer/comments/npwpgo/new_nonalcoholic_beer_from_hammerton_brewery/h07bqlx/,,,
snscrape.modules.reddit.Comment,twitterInfo_bot,today see release next addition af range first free beer cans untied delicious hazy citrus tropical juicy pale ale posted photos tweet photo github new,2021-06-01T15:32:15+00:00,t1_h07bkko,t3_npwpgo,alcoholfreebeer,https://old.reddit.com/r/alcoholfreebeer/comments/npwpgo/new_nonalcoholic_beer_from_hammerton_brewery/h07bkko/,,,
snscrape.modules.reddit.Comment,brawlidol,coast beer may sure runs,2021-05-26T09:12:59+00:00,t1_gzhsj4b,t3_nkoz74,alcoholfreebeer,https://old.reddit.com/r/alcoholfreebeer/comments/nkoz74/uk_may_bank_holiday_weekend_af_beer_deals/gzhsj4b/,,,
snscrape.modules.reddit.Comment,FreeBeer_UK,anyone fan tried,2021-05-24T13:27:32+00:00,t1_gz9qrcn,t3_njxya5,alcoholfreebeer,https://old.reddit.com/r/alcoholfreebeer/comments/njxya5/big_drops_poolside_ddh_ipa_is_now_part_of_their/gz9qrcn/,,,
snscrape.modules.reddit.Comment,FreeBeer_UK,beer big core range local,2021-05-14T16:23:51+00:00,t1_gy46kjt,t3_nbiml7,alcoholfreebeer,https://old.reddit.com/r/alcoholfreebeer/comments/nbiml7/big_drop_galactic_milk_stout_always_a_treat_nice/gy46kjt/,,,
snscrape.modules.reddit.Comment,FreeBeer_UK,oh wow right must new thing sure never noticed uk store,2021-05-13T09:06:02+00:00,t1_gxyi4dn,t1_gxw1fwg,alcoholfreebeer,https://old.reddit.com/r/alcoholfreebeer/comments/n9z20e/athletic_brewing_beers_now_available_in_the_uk/gxyi4dn/,,,
snscrape.modules.reddit.Comment,FreeBeer_UK,nice hope comes well af homebrew something would like try,2021-05-13T09:04:31+00:00,t1_gxyi0ts,t1_gxuszwv,alcoholfreebeer,https://old.reddit.com/r/alcoholfreebeer/comments/n9z20e/athletic_brewing_beers_now_available_in_the_uk/gxyi0ts/,,,
snscrape.modules.reddit.Comment,chaussettesrouges,also order direct ipa golden ale punk af tastiest af offerings,2021-05-12T19:18:58+00:00,t1_gxw1fwg,t3_n9z20e,alcoholfreebeer,https://old.reddit.com/r/alcoholfreebeer/comments/n9z20e/athletic_brewing_beers_now_available_in_the_uk/gxw1fwg/,,,
snscrape.modules.reddit.Comment,tuctrohs,try also experimenting making,2021-05-12T14:13:57+00:00,t1_gxuszwv,t1_gxuq7sr,alcoholfreebeer,https://old.reddit.com/r/alcoholfreebeer/comments/n9z20e/athletic_brewing_beers_now_available_in_the_uk/gxuszwv/,,,
snscrape.modules.reddit.Comment,FreeBeer_UK,dark beer front big galactic stout launched us recently highly recommend hope dark beer also makes way,2021-05-12T13:52:42+00:00,t1_gxuq7sr,t1_gxueual,alcoholfreebeer,https://old.reddit.com/r/alcoholfreebeer/comments/n9z20e/athletic_brewing_beers_now_available_in_the_uk/gxuq7sr/,,,
snscrape.modules.reddit.Comment,tuctrohs,us resident among favorite af beers partly made dark beer fan among offer dark af beer generally found europe easier get dark af beer us think better athletic offerings sure uk really long time case really appreciate offering variety interesting flavors tried good recommend checking,2021-05-12T12:14:38+00:00,t1_gxueual,t3_n9z20e,alcoholfreebeer,https://old.reddit.com/r/alcoholfreebeer/comments/n9z20e/athletic_brewing_beers_now_available_in_the_uk/gxueual/,,,
snscrape.modules.reddit.Comment,sarah_bear_crafts,love love love says aloha read like normal person wonder read way realize read clockwise bottom left,2021-05-11T20:29:44+00:00,t1_gxru9up,t3_mvk4d7,alcoholfreebeer,https://old.reddit.com/r/alcoholfreebeer/comments/mvk4d7/our_new_af_lager_with_lime_is_on_the_market/gxru9up/,,,
snscrape.modules.reddit.Comment,brawlidol,,2021-05-11T19:46:24+00:00,t1_gxrnznv,t3_n9z20e,alcoholfreebeer,https://old.reddit.com/r/alcoholfreebeer/comments/n9z20e/athletic_brewing_beers_now_available_in_the_uk/gxrnznv/,,,
snscrape.modules.reddit.Comment,minnis93,able add list available shops soon tried impressed,2021-05-11T18:19:25+00:00,t1_gxrb7tb,t3_n9z20e,alcoholfreebeer,https://old.reddit.com/r/alcoholfreebeer/comments/n9z20e/athletic_brewing_beers_now_available_in_the_uk/gxrb7tb/,,,
snscrape.modules.reddit.Comment,FreeBeer_UK,found looks interesting think seen many similar af lagers maybe drop yuzu pale drynks smashed citrus sounds like could summer hit untappd ratings seem ok far,2021-04-22T09:18:17+00:00,t1_gvfbxnv,t3_mvk4d7,alcoholfreebeer,https://old.reddit.com/r/alcoholfreebeer/comments/mvk4d7/our_new_af_lager_with_lime_is_on_the_market/gvfbxnv/,,,
snscrape.modules.reddit.Comment,roygbiv1000,yeah know mean really enjoy either latest batch collaboration beers big drop miss hit,2021-04-21T17:12:30+00:00,t1_gvcf0u9,t1_gvcdhsr,alcoholfreebeer,https://old.reddit.com/r/alcoholfreebeer/comments/msb5tv/big_drop_x_einstok_collab_coconut_stout/gvcf0u9/,,,
snscrape.modules.reddit.Comment,21secondstoroe,honest one felt like flavour really needed kick make palatable felt watery mouth,2021-04-21T17:01:46+00:00,t1_gvcdhsr,t3_msb5tv,alcoholfreebeer,https://old.reddit.com/r/alcoholfreebeer/comments/msb5tv/big_drop_x_einstok_collab_coconut_stout/gvcdhsr/,,,
snscrape.modules.reddit.Comment,FreeBeer_UK,right seem bit broken however interesting results,2021-04-21T08:39:27+00:00,t1_gvaxekd,t1_gv7cg6w,alcoholfreebeer,https://old.reddit.com/r/alcoholfreebeer/comments/muncmf/uk_pubs_serving_af_beers/gvaxekd/,,,
snscrape.modules.reddit.Comment,angmoelah,used club soda search club soda guide seems work click use location cant search town city,2021-04-20T14:15:54+00:00,t1_gv7cg6w,t3_muncmf,alcoholfreebeer,https://old.reddit.com/r/alcoholfreebeer/comments/muncmf/uk_pubs_serving_af_beers/gv7cg6w/,,,
snscrape.modules.reddit.Comment,brawlidol,af beers really beers,2021-04-19T14:57:08+00:00,t1_gv367qc,t1_gv2een3,alcoholfreebeer,https://old.reddit.com/r/alcoholfreebeer/comments/ms08z5/not_sure_this_was_a_beer/gv367qc/,,,
snscrape.modules.reddit.Comment,FreeBeer_UK,trying get head round flavour combinations may make big drop order soon,2021-04-19T10:31:08+00:00,t1_gv2ehzv,t1_gurh8cp,alcoholfreebeer,https://old.reddit.com/r/alcoholfreebeer/comments/msb5tv/big_drop_x_einstok_collab_coconut_stout/gv2ehzv/,,,
snscrape.modules.reddit.Comment,FreeBeer_UK,remember sweets managed try tiny rebel beers yet given nudge needed buy,2021-04-19T10:29:44+00:00,t1_gv2een3,t1_gupiiks,alcoholfreebeer,https://old.reddit.com/r/alcoholfreebeer/comments/ms08z5/not_sure_this_was_a_beer/gv2een3/,,,
snscrape.modules.reddit.Comment,roygbiv1000,tastes bit like somebody dropped shot supermarket coconut rum guinness,2021-04-16T20:00:57+00:00,t1_gurh8cp,t3_msb5tv,alcoholfreebeer,https://old.reddit.com/r/alcoholfreebeer/comments/msb5tv/big_drop_x_einstok_collab_coconut_stout/gurh8cp/,,,
snscrape.modules.reddit.Comment,brawlidol,still nothing could us hoppyaf,2021-04-16T10:23:23+00:00,t1_gupimox,t3_mflleh,alcoholfreebeer,https://old.reddit.com/r/alcoholfreebeer/comments/mflleh/guinness_00_available_again_soon/gupimox/,,,
snscrape.modules.reddit.Comment,brawlidol,really beer brought back great memories sweets flavour right strong sweet would great alternative soft scratch beer itch,2021-04-16T10:21:48+00:00,t1_gupiiks,t3_ms08z5,alcoholfreebeer,https://old.reddit.com/r/alcoholfreebeer/comments/ms08z5/not_sure_this_was_a_beer/gupiiks/,,,
