body,created
sell half packs newports weird shit like think loose cigarettes illegal could tampered come think none carts ever bought kind wrapping seals seen wrapping medical ones sure normal product people pinnacles got button lock legit company also california wonder someone muling charge farm store online weird make profit indian reservations even tax free makes popular dispensary read around applications close licensed maybe stick bud,2022-04-24T05:50:06+00:00
accounts must three days old must positive comment post karma allowed post comment r trees please ask moderators approve comment post exceptions rule learn karma reddit works visit bot action performed automatically please contact moderators subreddit message compose r trees questions concerns,2022-04-24T05:49:25+00:00
guy wires,2022-04-24T05:48:34+00:00
sandals socks need help,2022-04-24T05:46:53+00:00
accounts must three days old must positive comment post karma allowed post comment r trees please ask moderators approve comment post exceptions rule learn karma reddit works visit bot action performed automatically please contact moderators subreddit message compose r trees questions concerns,2022-04-24T05:46:00+00:00
one tools use never thought,2022-04-24T05:45:28+00:00
idk think fucked take hands dispose series small fires,2022-04-24T05:45:02+00:00
,2022-04-24T05:44:48+00:00
thank comfy bed,2022-04-24T05:44:29+00:00
brony sub,2022-04-24T05:43:44+00:00
accounts must three days old must positive comment post karma allowed post comment r trees please ask moderators approve comment post exceptions rule learn karma reddit works visit bot action performed automatically please contact moderators subreddit message compose r trees questions concerns,2022-04-24T05:43:30+00:00
slowly wind stressed tree may killed already long death survived incident immediately raise original position use bailing wire raise tree little day day week good source amateur tree planter blue spruce planted past years one experience young spruce years blown may overkilled careful love blue spruce trees,2022-04-24T05:43:27+00:00
give stroke beauty,2022-04-24T05:43:27+00:00
isnt well known fact daily occurence house,2022-04-24T05:43:17+00:00
completely unharmed thank,2022-04-24T05:42:43+00:00
honestly good minutes high heat maybe stir around couple times make sure doesnt boil well itll make kitchen smell though something concerned,2022-04-24T05:41:36+00:00
sometimes get high think fuck,2022-04-24T05:40:48+00:00
put weed,2022-04-24T05:40:03+00:00
people might though long good boy fine matters,2022-04-24T05:39:43+00:00
also dont think smoke anywhere inside least parks magic kingdom one,2022-04-24T05:38:14+00:00
ask care reddit moment,2022-04-24T05:38:10+00:00
smell,2022-04-24T05:36:51+00:00
yes know,2022-04-24T05:36:28+00:00
count em till fall asleep,2022-04-24T05:36:18+00:00
use wired headphones,2022-04-24T05:35:51+00:00
really really stink blooming good way gonna suggest fixing chainsaw,2022-04-24T05:35:50+00:00
feel bad holy crap dog cute,2022-04-24T05:35:39+00:00
say thc toxic dogs,2022-04-24T05:35:34+00:00
young teens anyone uniformed hell even buy shit vape juice prayin uk anywhere matter legalize finally stamp shit,2022-04-24T05:35:34+00:00
mom taught holy shit years ago gets easier practice get paper great learning decent youtube tutorial videos,2022-04-24T05:35:29+00:00
one thing happy come back android flagships headphone jack,2022-04-24T05:34:52+00:00
omg dope fuck eat good books lately,2022-04-24T05:34:20+00:00
way high done props chef,2022-04-24T05:33:03+00:00
much thanks,2022-04-24T05:32:54+00:00
thanks advice,2022-04-24T05:32:43+00:00
strain organnicraft subpar like said,2022-04-24T05:32:42+00:00
might wanna take edibles might less hassle unless prefer smoking went couple years ago stayed contemporary right bay lake park went outside blended cigarette smokers one seemed care,2022-04-24T05:32:29+00:00
yeah like extra gram half smoked already really strong weed,2022-04-24T05:32:20+00:00
nah got ripped wait,2022-04-24T05:30:13+00:00
pretty sure vaping less harmful body could wrong think ok long getting legitimate carts,2022-04-24T05:29:44+00:00
bud grinder someone took kief filter literally see small stem pieces,2022-04-24T05:29:43+00:00
glad found way avoid happening stop nothing helped panic attack high way worse sober,2022-04-24T05:29:27+00:00
ur right think main problem needed bud,2022-04-24T05:28:35+00:00
ventura county dispensaries open walk ever near ventura port hueneme let know,2022-04-24T05:28:29+00:00
friend dog ate significant part inside couch,2022-04-24T05:28:25+00:00
mean hey atleast baked,2022-04-24T05:27:55+00:00
always torn like fucking stupid able tell difference buy smoke,2022-04-24T05:27:54+00:00
carefull around drugs,2022-04-24T05:27:26+00:00
outright lie smoke reefers daily never ever played french horn butt know know wish nonsense know say things good true,2022-04-24T05:25:13+00:00
yeah agree think think little bit harsh tone thank nice night,2022-04-24T05:24:49+00:00
everything,2022-04-24T05:24:32+00:00
yup got habit rules though smoking lunch wake bake smoking work used work although remember getting torched time work afternoon midnight shift back way younger,2022-04-24T05:24:10+00:00
like assassin setting rifle old action movie lol,2022-04-24T05:23:33+00:00
worth cents,2022-04-24T05:23:19+00:00
say lol,2022-04-24T05:23:09+00:00
sounds like shit laced,2022-04-24T05:23:09+00:00
sry still kinda new kief something separates grind nugs smoke,2022-04-24T05:23:04+00:00
message waiting hear back lol,2022-04-24T05:18:42+00:00
accounts must three days old must positive comment post karma allowed post comment r trees please ask moderators approve comment post exceptions rule learn karma reddit works visit bot action performed automatically please contact moderators subreddit message compose r trees questions concerns,2022-04-24T05:18:20+00:00
try blowing direction,2022-04-24T05:18:13+00:00
thank answered questions perfectly also blowing fucking mind even,2022-04-24T05:17:24+00:00
guy gonna passed weeks,2022-04-24T05:17:07+00:00
super easy delicious,2022-04-24T05:15:29+00:00
idk would say finely ground bud impure kief pure kief white darker color plant material never seen green kief think impossible said shade green kief likely way many plant material gets high tho moot point,2022-04-24T05:14:02+00:00
plant miracles friend get pre rolls ten bucks,2022-04-24T05:13:42+00:00
psychosis real aware pre existing mental health issues hallucinations rarely happen cannabis auditory hallucinations distortions leave following day consider physical health important mental health get seen doctor could psychosis one could changed life yet one single psychosis alter forever panic organic stay safe informed,2022-04-24T05:12:09+00:00
would one even make brownie,2022-04-24T05:11:40+00:00
tried setting wind turbines direction create wind way prop back,2022-04-24T05:11:21+00:00
,2022-04-24T05:11:00+00:00
weird fall maybe pull upright vehicle chain use cables stakes hold reestablishes root base looks like could easily survive,2022-04-24T05:10:36+00:00
without doubt one best things vegas stoner get lit af beforehand enter best described psychedelic mindscape taken physical form surreal grocery store appetizer hours long trip dream come life food nearby restaurants also bomb af,2022-04-24T05:10:08+00:00
hey reddit took picture glass wine id asking rn basically also shit gotta fake bang energy logo,2022-04-24T05:10:03+00:00
reminds brother left pot brownies step brother rottweiler lab got night dog best time life brother cried saying killed step brothers dog dog fine still happy healthy years later,2022-04-24T05:08:58+00:00
freebasing would mean add something else make smokeable like adding baking soda cocaine smoked need add anything wax concentrate smoke,2022-04-24T05:08:25+00:00
gonna say seeing repeating patterns uncommon super high weed psychoactive nah bro sounds like smoking sent full blown psychosis weed may always caution schizoaffective people using make trip fuck,2022-04-24T05:06:06+00:00
false bottom,2022-04-24T05:06:04+00:00
mean works works right,2022-04-24T05:05:57+00:00
organicraft literally everything good platinum grapes find virtue cannabis natural history la kush cake broken coast vape anything fuego,2022-04-24T05:05:25+00:00
fucking funny exact book next,2022-04-24T05:04:47+00:00
find true well play beat saber high come realization theory rather relaxed react without thinking coming sort allowing instincts take allow brain take back seat,2022-04-24T05:04:44+00:00
might favorite post entire sub,2022-04-24T05:04:22+00:00
yes makes brain run lately using sleep zzz,2022-04-24T05:03:51+00:00
lungs course haha,2022-04-24T05:03:40+00:00
,2022-04-24T05:03:24+00:00
definitely good concentrates opaque,2022-04-24T05:03:08+00:00
everything room eatable even eatable called cannibalism dear children fact frowned upon societies yeah enjoy,2022-04-24T05:02:51+00:00
yeah people stick selling new thc high strains forget regular trusty strains,2022-04-24T05:02:36+00:00
smell carts doesnt really stick around,2022-04-24T05:01:54+00:00
say based keif falling alone,2022-04-24T05:01:47+00:00
doubt,2022-04-24T05:01:44+00:00
weed make high ever unique experience coffee,2022-04-24T05:01:22+00:00
yeah guess throat also super sore needed smoke used breathe easy tea cause think steam smoke would help,2022-04-24T05:01:13+00:00
effect eye dilation meaning light eyes perfectly normal,2022-04-24T05:00:37+00:00
stopped coffee weird results mixing weed caffeine,2022-04-24T05:00:23+00:00
prolly,2022-04-24T05:00:09+00:00
come everyone takes huge ass hits microhits,2022-04-24T04:59:53+00:00
uh oh ditch immediately popcorn lung waiting happen,2022-04-24T04:59:39+00:00
rolling kinda hard people try putting flower packing pencil creases also check vid rolling cones n,2022-04-24T04:59:19+00:00
never smoker use dry herb vape year think lung capacity diminished health still good per last physical however might get better answers r vaporents,2022-04-24T04:59:05+00:00
please lock edibles around pets kill dogs pretty easily higher concentrates far pleasant death seen bunch dogs die reddit,2022-04-24T04:58:51+00:00
came ask,2022-04-24T04:58:34+00:00
taste especially bong like putting cool aid bong cool first bowl two starts taste like pure booty hole,2022-04-24T04:58:18+00:00
wow naive,2022-04-24T04:57:53+00:00
considered getting high,2022-04-24T04:57:47+00:00
please lock edibles around pets kill dogs pretty easily far pleasant death seen bunch dogs die reddit,2022-04-24T04:57:40+00:00
guess idk really depends person,2022-04-24T04:56:48+00:00
thank much kind advice certainly take symptoms improve get worse within next weeks must say however quite comfortable making diagnoses years diagnosed every single medical problem ever fact gp got comfortable self diagnoses would usually nod say seems right proceed write prescription order confirming tests whenever went see problem also totally agree need careful quality weed weed product ingest usually smoke weed acquired medical sources grown using organic fertilizers natural sunlight added insecticides fungicides also make sure plants well flushed weeks harvest remove leftover fertilizers thanks words cautious wisdom much appreciate caring attitude best,2022-04-24T04:56:43+00:00
like taste tea nasty,2022-04-24T04:56:02+00:00
made want drop elbow wife thought much would cost many ways months pregnant wanna throw labor,2022-04-24T04:55:58+00:00
god damn love happens,2022-04-24T04:55:40+00:00
sounds pretty nasty like one bowl change,2022-04-24T04:55:27+00:00
omega mart think essentially art installation gift shop carries fake otherworldly anomalous stock,2022-04-24T04:54:13+00:00
never knew lore,2022-04-24T04:53:15+00:00
guy taken single upper division math course ask smoke weekends night control usage,2022-04-24T04:51:20+00:00
ya pretty easy find,2022-04-24T04:49:32+00:00
definitely get super spacey every time smoke like though haha experience,2022-04-24T04:48:53+00:00
stay frosty friend,2022-04-24T04:48:31+00:00
long federally illegal try keep hush hush,2022-04-24T04:48:10+00:00
witnessed attempted murder,2022-04-24T04:47:52+00:00
duct tape cough syrup fixes anything,2022-04-24T04:47:49+00:00
good luck tough challenge,2022-04-24T04:47:03+00:00
withering intuition missing opportunities must feed feel moment drawing way outside lines great shit op get cbd lozenges help bring quick also seeing doctor definitely something think live crippling anxiety,2022-04-24T04:46:54+00:00
high brow humor hope haha safe fun,2022-04-24T04:46:19+00:00
fair flushing really interesting topic appreciate recommendations,2022-04-24T04:46:18+00:00
ever get glass cold enough lips got stuck,2022-04-24T04:46:07+00:00
yup every reddit account always subbed,2022-04-24T04:45:56+00:00
chris jericho filming,2022-04-24T04:45:50+00:00
wanna believe real bummed found harold kumar stoners real life petty,2022-04-24T04:45:25+00:00
appreciate checking,2022-04-24T04:45:02+00:00
happens,2022-04-24T04:44:38+00:00
right tried cover details,2022-04-24T04:44:04+00:00
thought blooms logo different ceramic tips,2022-04-24T04:43:32+00:00
right haha kind opposite take people trapped inside rpg scene alone tho show well known haha maybe remake netflix seth rogan dude elf hrm,2022-04-24T04:43:25+00:00
really deal smallish dose guess depends dry market much want try one mean going loose sleep get high,2022-04-24T04:43:12+00:00
go take look r hempflowers vendors farmers talk growing methods harvest proudly,2022-04-24T04:42:56+00:00
awesome looking prob sub,2022-04-24T04:42:38+00:00
know mike tyson sure looks like gentle soul real could never hurt fly kinda guy,2022-04-24T04:42:30+00:00
good man better safe sorry,2022-04-24T04:42:15+00:00
highly recommend debacco university youtube informative actually professor browse hundreds videos sure find lookin,2022-04-24T04:41:46+00:00
need tiktok allow lol hours scrolling edits like slow motion vids smoking hauls setups,2022-04-24T04:41:34+00:00
sorry hear better inet issues weed issues haha good one,2022-04-24T04:40:55+00:00
l ratio bootlicker,2022-04-24T04:40:27+00:00
love many upvotes even internet nicer place stoned,2022-04-24T04:39:24+00:00
mine damn really get bitches formulate every possible calculation see possible pass tf,2022-04-24T04:39:04+00:00
u smoked every single day years,2022-04-24T04:38:36+00:00
ever smoke sheep around,2022-04-24T04:38:18+00:00
love happens,2022-04-24T04:37:57+00:00
lean tree fr,2022-04-24T04:37:51+00:00
accounts must three days old must positive comment post karma allowed post comment r trees please ask moderators approve comment post exceptions rule learn karma reddit works visit bot action performed automatically please contact moderators subreddit message compose r trees questions concerns,2022-04-24T04:37:36+00:00
interesting never heard cbg suppose surprised probably many cannabinoids still discovered time thank wonderful governments since ones suppressing research cannabis decades check thanks,2022-04-24T04:37:06+00:00
holy fuck new favorite thing,2022-04-24T04:36:38+00:00
guess used everyone knowing even think wild still gotta hush hush thing places,2022-04-24T04:36:01+00:00
technically think slightly acidic thca,2022-04-24T04:35:18+00:00
lol terrible,2022-04-24T04:34:27+00:00
looks pretty straight,2022-04-24T04:34:05+00:00
looks like customized vehicle would let op identity known community,2022-04-24T04:33:43+00:00
hi u ballsinmyyogurt please read entire message comment removed r trees following reason rule respectful fellow posters doxxing rudeness slurs vulgarities towards users trolling welcome please read rules r trees faq take look visual posting guide ensure posts violate r trees posting rules inquiries removal rules please send us modmail removed comment message writing ask comment removed please note although mods constantly working hard remove large volumes posts violate rules violating posts may sometimes make front page use report link bring violating material attention thank patience understanding,2022-04-24T04:32:52+00:00
yeah definitely,2022-04-24T04:32:49+00:00
im trying figure blacked lmao im lmao,2022-04-24T04:32:46+00:00
stake,2022-04-24T04:32:18+00:00
need start befriending people play wind instruments focused guitarists clearly untapped potential good time,2022-04-24T04:32:10+00:00
absolutely took vet,2022-04-24T04:32:03+00:00
holy shit melt shots,2022-04-24T04:31:58+00:00
also thank reply,2022-04-24T04:31:48+00:00
essentially edible tolerance different joint tolerance weed tolerance sorry make sense high fuck right,2022-04-24T04:31:25+00:00
look anything high cbg great ibd,2022-04-24T04:30:34+00:00
pretty bad looks could probably get lot straighter less crinkled put thought time rolling joints hard fuck times,2022-04-24T04:30:08+00:00
aw little resting,2022-04-24T04:30:04+00:00
high maintenance,2022-04-24T04:29:52+00:00
good question let know one expecting never know,2022-04-24T04:29:49+00:00
dog clearly better life guys feel sorry dog completely unharmed thanks though,2022-04-24T04:29:43+00:00
eyes red dick,2022-04-24T04:29:12+00:00
aw thanks advice,2022-04-24T04:28:41+00:00
live fully recreational state city dispensaries starbucks still find keeping weed pipes shit hidden like get legal trouble someone finds lol could go cop joint behind ear bag dispensary hand still like hmm better safe make sure weed house bought adult store view passing car anything,2022-04-24T04:28:38+00:00
thank advice however must say pretty comfortable self diagnosis years diagnosed every single medical problem ever confirmed gp got comfortable diagnoses whenever went see would ask problem however watch carefully make sure problem goes away within next month back drawing board point concerning careful smoke agree smoke weed grown natural sunlight using organic fertilizers insecticides fungicides seeds known strains plenty flushing harvest,2022-04-24T04:28:20+00:00
aw thanks advice,2022-04-24T04:28:19+00:00
u withdrawal symptoms,2022-04-24T04:28:03+00:00
really tbh slightly elevated resting heart rate though,2022-04-24T04:27:45+00:00
love good weed tends hit almost twice intense minutes last bowl maybe thats thing sounds like get stoned,2022-04-24T04:27:30+00:00
cbg little known gem amongst gi problem sufferers great way relieve potentially heal gi tract cbg bud thc may good way emulate normal routine still reducing tolerance probably best consume cannabinoids though case best luck,2022-04-24T04:27:20+00:00
better luck posting r vaporents cool dry herb vapers hang hear,2022-04-24T04:27:00+00:00
heavy daily smoker year cough without fail right bong rip boyfriend smokes cough actually like lungs get rid,2022-04-24T04:26:44+00:00
respectfully echo gentlepersons suggestion,2022-04-24T04:25:53+00:00
isopropyl plus kosher salt abrasive bottles black label bong cleaner,2022-04-24T04:25:35+00:00
first smoke weed need two tree stakes thick put side want pull tree towards imagine making triangle tree third point want make sure pull straight push tree position best cant using wire twine rope fasten tree stakes consider using cut hose ties connect tree order prevent damage sorry,2022-04-24T04:25:34+00:00
aced history final finished first class dabbing friends car class,2022-04-24T04:25:14+00:00
early harvest early morning sound crazy say smoke makes happy long weed,2022-04-24T04:25:03+00:00
tolerance gone body brain getting used feels like high need take higher dose first started try upping dose see helps,2022-04-24T04:25:03+00:00
say one sneaky little bitch glad wake tomorrow,2022-04-24T04:23:32+00:00
cringe,2022-04-24T04:22:56+00:00
may aswell get knees start sniffing,2022-04-24T04:22:46+00:00
funny jazz album cover,2022-04-24T04:22:04+00:00
trampster,2022-04-24T04:21:54+00:00
hope bin slang boof hood,2022-04-24T04:21:47+00:00
well free base technically means turning substance salt form base form allows higher bioavailability vaporization people know process turning cocaine crack cocaine freebase colloquially means vaporizing though right,2022-04-24T04:21:02+00:00
like way think,2022-04-24T04:20:55+00:00
grown much best least frosty bunch harvested early according grow subs favorite thing smoke morning,2022-04-24T04:20:22+00:00
struggling understand point already known believe using coconut oil results potent end product compared butter,2022-04-24T04:20:18+00:00
water bong sound effects endless loops auto tuned rap clearly baked bros talking flushing seem like credible sources cannabis husbandry looking unicorn describe time reputable video found cannabinoids green flower channel good content dr bruce bugbee sounds like pseudonym lectures informative,2022-04-24T04:20:16+00:00
order delivery service offers deals usually end different qualities use good stuff bong home roll stuff,2022-04-24T04:20:08+00:00
glad image edited black something seeing ethereal black caterpillar,2022-04-24T04:20:02+00:00
kied brown,2022-04-24T04:19:24+00:00
genuinely enjoy every single time happens subreddit makes smile wait read comments,2022-04-24T04:18:47+00:00
dude leaf,2022-04-24T04:18:06+00:00
someone else bipolar sometimes hears voices clattering getting baked take time weed isnt important worrying better baked imo,2022-04-24T04:17:50+00:00
oh great dangerous fead awhile,2022-04-24T04:16:36+00:00
hi u deepsea please read entire message comment removed r trees following reason rule respectful fellow posters doxxing rudeness slurs vulgarities towards users trolling welcome please read rules r trees faq take look visual posting guide ensure posts violate r trees posting rules inquiries removal rules please send us modmail removed comment message writing ask comment removed please note although mods constantly working hard remove large volumes posts violate rules violating posts may sometimes make front page use report link bring violating material attention thank patience understanding,2022-04-24T04:16:36+00:00
needs pan sauce,2022-04-24T04:14:43+00:00
smoke another bowl report back high,2022-04-24T04:14:39+00:00
wow looks delicious invest glass sherlock hash trumpet optimum taste,2022-04-24T04:14:31+00:00
respect done thing,2022-04-24T04:14:22+00:00
wait straight transcend,2022-04-24T04:13:39+00:00
one best answers far,2022-04-24T04:13:23+00:00
birds larger rotisserie ones rotisserie ones least dollar cheaper hot ready,2022-04-24T04:12:33+00:00
would ether think hahaha funny person run trap,2022-04-24T04:12:33+00:00
relate rips gets taking notes asking questions lol,2022-04-24T04:12:02+00:00
one way bone home,2022-04-24T04:11:13+00:00
ending starting mean,2022-04-24T04:10:32+00:00
exact news want hear,2022-04-24T04:10:00+00:00
accounts must three days old must positive comment post karma allowed post comment r trees please ask moderators approve comment post exceptions rule learn karma reddit works visit bot action performed automatically please contact moderators subreddit message compose r trees questions concerns,2022-04-24T04:09:49+00:00
venom og gonna gassy good luck dawg,2022-04-24T04:09:36+00:00
grow indoors answer imo,2022-04-24T04:09:28+00:00
sounds like solid day,2022-04-24T04:08:46+00:00
bro plastered ad em self,2022-04-24T04:08:43+00:00
would never honestly tell selling bootleg carts would lie say source california sure products fine fake carts never safe even filling fakes clean oil cart hardware used fakes cheap knock offs made china regulation things like lead poisoning metal fragments getting lungs become concerns,2022-04-24T04:08:41+00:00
get lsd like patterns wall smoke much also hear distorted sounds sometimes really think much weed also psychedelic opinion long know weed escalate good doctor,2022-04-24T04:08:26+00:00
jabroni cool word,2022-04-24T04:08:26+00:00
love weed stims still cant go stupid heavy n caffeine anymore,2022-04-24T04:07:28+00:00
cannot wait august party,2022-04-24T04:07:21+00:00
send happily test potency effects feelings creates heck grows,2022-04-24T04:06:23+00:00
thinking analyzing separates body mind,2022-04-24T04:05:45+00:00
one late dogs ate sock knew cause found cleaning yard another one really liked crayons would find pretty artistic poops none dogs since two ate anything food think personality thing something,2022-04-24T04:05:21+00:00
bro forget exhale,2022-04-24T04:04:59+00:00
maybe get second opinion case chance something else potentially serious could also something weed insinuate something bad something strain occasional strain makes prone passing super high get couch fast,2022-04-24T04:04:56+00:00
id remember correctly r superbowl owls superb days year allow football posts day superbowl,2022-04-24T04:04:52+00:00
check doctor regular anxiety best get control gets worse panic attacks fuckin suck,2022-04-24T04:04:40+00:00
forget try ice catcher,2022-04-24T04:04:14+00:00
know thread old af gotta say thank giving hope helping younger brother years younger mom young want good influence even though able see grow hope see get stable job positive force look,2022-04-24T04:04:13+00:00
okay works well,2022-04-24T04:04:02+00:00
definitely need also regular anxiety lol like came home like well,2022-04-24T04:03:05+00:00
weed isnt hallucinogenic,2022-04-24T04:03:03+00:00
bruh live canada go behind buildings stuff still tell want rude smells everyone deep know habit,2022-04-24T04:02:44+00:00
wow trip,2022-04-24T04:02:41+00:00
poor doggo looks like existential crisis first pic,2022-04-24T04:02:41+00:00
lol think,2022-04-24T04:02:37+00:00
hey thanks response nothing truly verify anything could counterfeit anyway trying say boof wrong assumption size said,2022-04-24T04:02:35+00:00
grow,2022-04-24T04:02:32+00:00
better job hiding shit dog dangerous terrifying dog,2022-04-24T04:02:20+00:00
yea see frosty ass buds pic aand life smoke nice tastey hit high dont floor figured would medicore weed decent taste ripped shit killed taste like christmas high af right im literaly proud little ass,2022-04-24T04:02:13+00:00
