body,created
thx one bit paranoia smoked fuckton weed wtf worried possibly possible poison without knowing public lmao bad lol wtf,2022-04-21T08:14:58+00:00
yeah literally fine,2022-04-21T07:59:36+00:00
idk,2022-04-21T07:14:27+00:00
marijuana isnt buddy thats everyone different brain chemistry reacts different substances also could strain smoking maybe need relaxing indica opposed stimulating sativa maybe better ingest small amount instead smoking trial error end might enjoyable thing,2022-04-21T07:02:31+00:00
yay next time take bigger hits roll joints point glad never drove,2022-04-21T06:11:05+00:00
catching smoke marijuana completely legal could probably give hard time smoking public dumb spot really care,2022-04-21T06:09:19+00:00
ohh understand thanks chill,2022-04-21T06:07:14+00:00
probably worried anxious state first time dont worry fine eat something go bed feel normal tomorrow,2022-04-21T05:40:12+00:00
anxiety edginess,2022-04-21T05:34:29+00:00
still feeling hours,2022-04-21T05:12:43+00:00
alright sure appreciate advice thank much goodsirvaps,2022-04-21T05:09:57+00:00
suggestion work increase time takes edibles repeat reaches comfortable high,2022-04-21T05:06:22+00:00
alright try next time thank however next day took delta gummy would translate around thc anything either think tacos night also suggestion seem work either,2022-04-21T05:02:52+00:00
brain dead federal government would legalize weed already would problem,2022-04-21T04:59:29+00:00
hurts right people,2022-04-21T04:59:09+00:00
wait stable based democrat,2022-04-21T04:58:39+00:00
think eaten fatty meal see happens gotta baseline could even much quite processed right last time rush,2022-04-21T04:50:52+00:00
worried strokes actually laugh anxiety know high whatever think forget breathe jet li,2022-04-21T04:50:43+00:00
house ask tell nicely smoke inside answers great,2022-04-21T04:20:49+00:00
awesome two topics parties completely misread room opinion despite media narrative wide support amongst dems protecting gun rights especially amongst progressive wing democratic party good see dem break party line put people rights government authority wish would,2022-04-21T04:19:26+00:00
good thread,2022-04-21T04:00:29+00:00
pretty big door etc sort like apartment smelling weed mean smoke coming harmless smell,2022-04-21T03:54:46+00:00
update thank everyone advice everything went smooth sadly feel much besides lightheadedness felt cozy okay drive home thanks replies hope next time feel little,2022-04-21T03:44:47+00:00
tell get carbon filter scrub air exhaust outdoors,2022-04-21T03:42:45+00:00
recently dealing pain following dental surgery edibles specifically edibles thc cbg significantly helped manage pain mental health painful ordeal cbg fairly new cannabinoid market live place legal weed enjoy edibles highly recommend trying thc cbg,2022-04-21T03:40:32+00:00
offers different perspective get sober brain thus helps see situations different light capable normal ego ruled monkey brain reason educational wonderful tool help succeed life,2022-04-21T03:37:00+00:00
would neat proven,2022-04-21T03:35:43+00:00
yeah want risk experiencing bad trip edible gummy ate think pizza night remember exactly happened month ago,2022-04-21T03:34:13+00:00
lots dems fed zero progress everything shot across wh bow cannabis reform officially became big midterm conversation,2022-04-21T03:27:23+00:00
well double dose right bat sure eat last edible,2022-04-21T03:15:45+00:00
difference smell smoke understand smoke making floors smell,2022-04-21T03:09:37+00:00
helps anxiety helps nicer person,2022-04-21T03:03:59+00:00
ok good point check canada,2022-04-21T03:02:36+00:00
thought first line said meth happy,2022-04-21T03:01:45+00:00
happened kept gagging time threw never smoke smoking anymore sticking edibles,2022-04-21T02:59:13+00:00
democrat,2022-04-21T02:58:44+00:00
pretty much kinds smoke carry carcinogens protect child first tenants wanna smoke tell cool either vape smoke outside common courtesy,2022-04-21T02:57:21+00:00
air purifier think,2022-04-21T02:56:18+00:00
real question tenants basement like big basement secondhand bad would kind enough tell go lengths try cover smell odoban lysol nag champa douchey gushie smokes weed embraces smell,2022-04-21T02:55:28+00:00
since also smoke perhaps chat nicely express concerns offer solutions another solution might air cleaner purifier although unless actually smoke air think problem nevertheless air purifier good everyone place matter,2022-04-21T02:54:21+00:00
ooohohoh hope busy month,2022-04-21T02:52:23+00:00
work customer service keeps violent thoughts,2022-04-21T02:37:16+00:00
sure still linger around went lamotrigine days almost still luck sure forever thing,2022-04-21T02:35:33+00:00
thanks,2022-04-21T02:33:28+00:00
stay high livwell happy,2022-04-21T02:24:32+00:00
happy blaze lol,2022-04-21T02:23:11+00:00
easier smoking vaping slow transition high hit tend get panic attacks get high edibles great feel high coming go,2022-04-21T02:13:24+00:00
seen happen pretty sight,2022-04-21T02:05:42+00:00
got retirement,2022-04-21T02:03:23+00:00
pain relief ability cut back opiates,2022-04-21T01:55:53+00:00
hella edibles never herd kind,2022-04-21T01:35:57+00:00
time years ago teen came inside smoking fire blunt left genius idea put large gravity bong well know sometimes things fit good well blunt made perfect suction bowl air got gb smoke thick yellow everyone room passed took warning young guy said waste hit felt satan flew lungs worst taste followed immediately puking headache bad slept hours slept straight threw party threw night still commission next night absolutely horrible experience really smoke bowls,2022-04-21T01:29:22+00:00
specifically targets minorities liberals,2022-04-21T01:20:34+00:00
good long eat like lol,2022-04-21T01:17:11+00:00
praying got work tmw night,2022-04-21T01:07:03+00:00
def someone experienced w first time bro,2022-04-21T01:06:42+00:00
iv written representatives oregon something similar even cited laws passed states showing went lack attempt try something like state immensely disheartening sober cause job insurance pay keep family afloat hard enough,2022-04-21T01:03:48+00:00
work without efforts,2022-04-21T01:02:36+00:00
never tried edibles scared lol,2022-04-21T01:01:43+00:00
pack one hitter would randomly make dizzy feel like shit,2022-04-21T00:54:34+00:00
yeah must low tolerance thing fill every weekend every often would get nauseous went straight pukers probably much,2022-04-21T00:53:44+00:00
yeah stopped smoking year went back first couple weeks get nauseous every days,2022-04-21T00:51:23+00:00
shit take enough hours turn days lol,2022-04-21T00:50:28+00:00
sure law works wife aunt medical card massachusetts allowed get fid denied ccw medical card,2022-04-21T00:49:29+00:00
local weed guy lives everyday like good job,2022-04-21T00:33:56+00:00
banned owning gun use opioids alcoholic infringement second amendment plain simple specifically targets cannabis users,2022-04-21T00:30:56+00:00
netflix big pun camp woodward,2022-04-21T00:05:55+00:00
call nsa ask robert woodward really langley girl wrote recruit ice gl hf gogo,2022-04-21T00:04:49+00:00
wish free family still trapt tho,2022-04-21T00:03:38+00:00
post removed please submit text posts link posts instead thank bot action performed automatically please contact moderators subreddit message compose r marijuana questions concerns,2022-04-21T00:01:01+00:00
yeah stop smoking weed years daily use randomly started giving panic attacks attacks bad would pass happened since quit weed,2022-04-20T23:29:47+00:00
yikes cause paranoia know,2022-04-20T23:21:31+00:00
always know simply stick,2022-04-20T23:14:51+00:00
problem started long ago long partner making decisions put genie back bottle owns man woman hood feel quite honestly take back life christ sake sorry,2022-04-20T23:09:43+00:00
sucks bro make,2022-04-20T23:08:04+00:00
stroking,2022-04-20T23:04:56+00:00
happy cake day,2022-04-20T22:58:43+00:00
also birthday,2022-04-20T22:55:15+00:00
certainly help anxiety experience,2022-04-20T22:52:02+00:00
try taking dry bong hit help,2022-04-20T22:42:03+00:00
first cake baked,2022-04-20T22:36:37+00:00
say heard either recommendations google around sure rules,2022-04-20T22:32:40+00:00
take one two hits wait min sometimes less promise matter many hits take still tomorrow,2022-04-20T22:31:45+00:00
worry regardless feel last forever,2022-04-20T22:31:26+00:00
means high level exterior structures hold substance known thc,2022-04-20T22:29:45+00:00
thanks well anxiety sober thought ask cuz gonna smoke dank stuff later ya know sorry also health anxiety worry waking one day myselfn,2022-04-20T22:28:31+00:00
neither causes prevents strokes paranoia definite side effect lol breathe eat something sleep repeat,2022-04-20T22:26:12+00:00
went dispensary deals reminded waiting line gta iv come midnight haha happiest days everyone,2022-04-20T22:24:30+00:00
listen anything bass listen reposted wrong neighborhood youtube thumbnail really cursed picture shaggy song pretty good,2022-04-20T22:15:00+00:00
accommodate research codependency doctor lmft anything mind however year relationship married bad relationships kind relationship neither healthy sustainable heart goes,2022-04-20T22:04:38+00:00
try hhc,2022-04-20T21:53:14+00:00
thunderball moon sky com truise glawio coldcut signs rp boo choice,2022-04-20T21:26:42+00:00
also anxiety makes manually breath probably thinking much plus always thought really mild asthma kid never diagnosed recently thought makes sense keep thinking breathing anxious,2022-04-20T21:18:34+00:00
think good think cuz bad allergies crazy rn plus think cold cough started slowly gradually right smoking friends meaning could gotten even stop smoking say months back normal fine,2022-04-20T21:15:31+00:00
link case summary trents appeal leave fact already probation previous violent felonies used aggravating factors increase sentence say trent one messaged officer asking wamted buy cannabis seems trent walked soon offered cannabis sale stranger probation one wonder someone supposedly music business basketball scout going college well owning operating business would bother selling small quantities cannabis first place unless narrative trent bunch bs,2022-04-20T21:14:14+00:00
well starters probably smart start smoking early life even though weed necessarily bad smoke cause serious damage lungs especially young age definitely need get checked doctor probably cancer something body needs checked,2022-04-20T21:13:00+00:00
head injury main thing worried subdural hematoma aka brain bleed things thin blood blood thinning drugs cause concern make potential brain bleed worse cannabis thin blood safe consume head injury traumatic brain injury actually one compounds help heal brain traumatic brain injury smoke away sir,2022-04-20T21:10:17+00:00
hard knowing parents starting scientific studies cannabis positive especially kicking addiction joints week hardly junkie cannabis hardly addictive maybe show stop needed maybe smoke around even think functional joints week find story suspect,2022-04-20T21:00:20+00:00
always light toke get anymore,2022-04-20T20:51:59+00:00
cake day nice,2022-04-20T20:51:35+00:00
dude high go away teach high school weed kills people lol weed causing,2022-04-20T20:49:43+00:00
wish san francisco celebrate pot like sc,2022-04-20T20:49:36+00:00
sounds like cunt change behaviours accomodate taking hallmarks abusive behaviour starts well genuinely hope ok relationship meant compromise partnership absolutely taking piss,2022-04-20T20:48:22+00:00
thx assurance,2022-04-20T20:43:33+00:00
like everyone saying salt hits bong cypress hill,2022-04-20T20:40:53+00:00
yes normal ok pass sometimes smoking things cause cold symptoms,2022-04-20T20:39:18+00:00
brand reputable work,2022-04-20T20:37:38+00:00
overreacting asking quit vape carts months developed wheeze lungs went harsher joints cough let smoke cool mouth recycling herb old roaches resin coughing stopped wheezing week switched,2022-04-20T20:33:28+00:00
sound like healthy relationship girl guys looking girl get high treat right,2022-04-20T20:33:04+00:00
well considering cannabis neuro protective properties think fine go easy,2022-04-20T20:27:24+00:00
match lmk,2022-04-20T20:25:15+00:00
im small ass town live bigger city high school dorm,2022-04-20T20:21:01+00:00
adult worried make seem like college,2022-04-20T20:20:14+00:00
yeah give advice please,2022-04-20T20:05:45+00:00
personal opinion need put phones fuck yeah counts bro light shit smoke shit pass shit,2022-04-20T20:03:19+00:00
hey man proud kicking things weed amazing,2022-04-20T20:02:43+00:00
sadly probation partake year happy everybody else,2022-04-20T19:57:11+00:00
number one rule smoking others person rolled gets spark first greenery noone initialed share gift requirement upvote hope wonderful,2022-04-20T19:56:50+00:00
assuming people blunt hog jk knows yeah weird new habit started accommodate still get buzz let bother bad feeling used love smoking either pre smoke seeing matter hit started smoking joints kinda pass without completely smoking mind fully smoke blunt joints pass like pass together smoking sucks really enjoy close odd reason one day got paid bought first bag decided wanna share weed anymore contributed wish balls light front pass guess pussy lord smoke one face,2022-04-20T19:55:29+00:00
thats awesome good win gift smoke dispensaries live favorite spot early though today one favorite days,2022-04-20T19:46:06+00:00
try hitting standing,2022-04-20T19:42:47+00:00
must cancer developed fast lmao,2022-04-20T19:41:36+00:00
voting communication essential relationship said hey shit day need whole bleezy sure plan accordingly thanks letting know enjoy roll another hope least said thank bogart silence selfish rude think using stash generosity,2022-04-20T19:30:01+00:00
thanks,2022-04-20T19:23:22+00:00
mean one chicago montrose beach,2022-04-20T19:22:27+00:00
okay case think dependant upon user individuals tolerance level,2022-04-20T19:17:03+00:00
na typically vape convenience got flower hand always dabble,2022-04-20T19:13:52+00:00
cough cough get,2022-04-20T19:13:42+00:00
freedom happiness,2022-04-20T19:03:36+00:00
idk feel like since typically vape smoking flower whole nother ballgame,2022-04-20T18:59:17+00:00
first customer line dispos drawing first one went got free prerolls,2022-04-20T18:54:27+00:00
see point cocaine directly caused mi verses cannabis possible contributing factor preexisting conditions primary cause case studies seen state possible contributing factor preexisting conditions seen anything states primary factor direct intake looking,2022-04-20T18:50:02+00:00
like lethal dosage usually amount mg ratio,2022-04-20T18:48:41+00:00
sure weed point understand use sure fake weed laced something marijuana advocate sound,2022-04-20T18:48:21+00:00
love went dispensary visited bit snacked free food really smoke anyone days occasionally may run old buddy wants smoke quick joint maybe hit buddy,2022-04-20T18:46:18+00:00
burning one reddit buddies online,2022-04-20T18:43:55+00:00
nah need practice ft bong hookah jk,2022-04-20T18:39:21+00:00
happy smoking since still cough lung like people say smaller hits till get used buy filter use filter bong keep bad junk helps cough less,2022-04-20T18:38:36+00:00
think people forget inhaling things lungs capacity good could try edibles aware edibles cause intestinal issues make ya poop w upset stomach overall quit weed older young,2022-04-20T18:38:13+00:00
reefer madness documentary,2022-04-20T18:37:46+00:00
uh everyone experiences things differently never experienced hell smoke weed pen work day keep sanity every day smoked weed find unlikely still experiencing side effects anything else change environment stress much caffeine much sugar cause side effects could possibly ate something bad also female maybe pmsing really bad cycle take deep breath okay hope feel better,2022-04-20T18:37:11+00:00
haha mean cocaine would way drug ingestion leading vasospastic myocardial infarction mechanism vasospastic mi marijuana well think probably cocaine homers like wasnt direct,2022-04-20T18:36:49+00:00
cannabis primary factor causing death take hit eat edible die directly ingesting like others cocaine heroin prescription medications guessing also nothing listed via cdc dea regarding unless missing something possible contributing factor preexisting condition conditions yes published reports,2022-04-20T18:31:56+00:00
coughing normal,2022-04-20T18:19:10+00:00
standard cold virus always around us overthink,2022-04-20T18:17:11+00:00
nothing bad sensitive,2022-04-20T18:13:56+00:00
fr bro need stop thinking bad stuff,2022-04-20T18:12:43+00:00
worry getting pussy,2022-04-20T18:11:58+00:00
strengthen lungs run outside something,2022-04-20T18:08:35+00:00
good lord getting hand next someone gonna ask weed turned white grey smoked oh cough eat edibles gasp,2022-04-20T18:04:23+00:00
crackhead apparently condone kids smoking though,2022-04-20T18:04:00+00:00
smoked one weed eyes started tingling dying jk happy everyone,2022-04-20T18:03:12+00:00
inhaling irritant gonna hurt try pulling smoke mouth first taking deep breath help cool smoke mix normal air find makes smoking less harsh hold smoke either take deep breath exhale also never cough smoke still lungs shit hurts,2022-04-20T18:02:05+00:00
cleaner awesome far music goes like gangster rap check artist wuntayk timmy,2022-04-20T17:59:28+00:00
bro inhaling smoke vapor gonna cough started,2022-04-20T17:58:20+00:00
glaring error bottom article says drunk driving reduced idaho leglaized recreational marijuana well got pulled weed idaho legal right,2022-04-20T17:50:06+00:00
sounds like lot people forgotten common cold,2022-04-20T17:46:01+00:00
rude needs smoke done understand smoke together point inconsiderate bit girl rolled one expects get half,2022-04-20T17:46:01+00:00
yup started smoking whole time yup major crackhead dumb comments,2022-04-20T17:45:10+00:00
yea love running phoenix tears,2022-04-20T17:44:47+00:00
guy,2022-04-20T17:42:52+00:00
need new boyfriend picked smoked weed ignored next time pick bum deserve better enjoy rest day,2022-04-20T17:40:51+00:00
maybe held jefferson city mo months back late going monthly court date see lab returned results tests marijuana found bottom purse always held boyfriends cigarettes actually waiting tests returned tobacco finally court date year dropped charges left state immediately wanted narc boyfriend thief kept paying lawyer finally ended working restaurant jefferson city quit right last court date couple cooks played joke trapping freezer minutes scared fell hit head let walked front cashed left looking another job dropped court case got refund check irs gone baby gone left boyfriend prison left everything moved california,2022-04-20T17:39:56+00:00
wanna pass ig right mean needed makes feel ran sure reasons,2022-04-20T17:36:04+00:00
see feel weeks,2022-04-20T17:35:14+00:00
idky started recently first blunt rolled awhile bc started shit started rolling joints make obv helped bit apparently blunts years together,2022-04-20T17:35:02+00:00
sounds like sick bro get well soon,2022-04-20T17:34:48+00:00
wow tire tracks face look mirror,2022-04-20T17:34:29+00:00
try taking smaller tokes hold long,2022-04-20T17:33:36+00:00
right get cbd gummies something cbd like many people calm withdraw syndrome unless allergies,2022-04-20T17:29:43+00:00
smoking almost everyday year,2022-04-20T17:28:08+00:00
good euphoria simply faded typical bake talking harry hendersons baked,2022-04-20T17:25:29+00:00
everyone hates hitler celebrating fuckhead dead almost years light joint forget man,2022-04-20T17:19:17+00:00
crocs honor prohibition grower may need hire anytime south rules,2022-04-20T17:17:51+00:00
think probably allergies cancer usually show symptoms long time calm pass,2022-04-20T17:17:47+00:00
noticed seems like short coughing fit euphoria follows shortly,2022-04-20T17:16:55+00:00
probably need wait point friends adults effect first time thinking might make worse try focus things,2022-04-20T17:08:16+00:00
right firstahfuk kid grown probably crack head started getting high early kid till get legal please thank later,2022-04-20T16:46:59+00:00
damn already quitting supposed start early buddy say stop older enjoy benefits,2022-04-20T16:43:29+00:00
work fdny ems nyc may know member suing drug tested risking suspension firing even though medical marijuana card uses sleep purposes due chronic intestinal condition dispatcher lot us popping positive marijuana nycnsincenits legalization still face suspension possible termination using even medical reasons covid lot us bad ptsd time self medicating want destroy minds prescriptions affect brains sharpness clarity performance honestly wanna able sleep without nightmares day without minds recreating terrible things absorbed years us quiting trauma worth job without ability use marijuana medicate fdny currently ramped drug testing ems division know get federal funding wait federal legalization taking forever members committing suicide members turning mind altering prescriptions completely ruin ability job turning numb pain creating lot us feel desperate sure question asking guess like know chances could ever join rest new york able take care less invasively using marijuana,2022-04-20T16:39:34+00:00
ok ok update still kinda scared shortness breath,2022-04-20T16:32:26+00:00
ok update,2022-04-20T16:31:49+00:00
sometimes get sore throat smoking coughing normal along feeling fatigued could high,2022-04-20T16:30:53+00:00
yes going okay might feel like shit next theres fixed duration withdrawals mine usually lasts week,2022-04-20T16:30:43+00:00
tested negative,2022-04-20T16:28:30+00:00
interested joining conversation please visit link r iama,2022-04-20T16:28:02+00:00
way back late early high school kids use meet school smoke wanna say grateful dead made song one knew abt hs meet idr details using blew,2022-04-20T16:26:57+00:00
probably rona,2022-04-20T16:26:50+00:00
withdrawal probably worse brain undeveloped properly dispose thc educated guess im doctor definitely withdrawal,2022-04-20T16:26:35+00:00
happy jack box special today apparently shake,2022-04-20T16:24:38+00:00
cannabis,2022-04-20T16:22:39+00:00
anywhere legalized weed made money crime rate gone,2022-04-20T16:19:08+00:00
math total constituent parts cannabis plant phytocannabinoids maybe biochemistry onto something lies perpetuated plant years ding ding,2022-04-20T16:04:14+00:00
trichomes cannot withstand compressed trash compactor lol lipid balls get smushed phytocannabinoids effected entire trichome houses brick weed compresses trichome,2022-04-20T15:58:02+00:00
dr bob melamede actively working countries world order help cannabis cause countries patience people,2022-04-20T15:52:04+00:00
logic one able anything today stuck hilters birthday giving hilters birthday voice even say name today stole mf ing day goodness peace,2022-04-20T15:52:01+00:00
endocannabinoid tone determines cannabis effects research form dr ethan russo great etc tone determined persons anatomy types lipids consume diet regular lipids effect endocannabinoid system functions notably essential fatty acids,2022-04-20T15:48:10+00:00
hate hitler understand decide celebrate mother fuckers birthday,2022-04-20T15:44:08+00:00
ok thank,2022-04-20T15:36:24+00:00
also key search terms phylum marijuana taxonomical data marijuana plant clade marijuana find zero botanical info plant name cannot even use botany classifications politicians made words call plants make laws based around cannabis plant herbaceous flowering angiosperm plant species cannabaceae family plants four chemotypes exist cannabis sativa cannabis indica cannabis ruderalis cannabis afghanica,2022-04-20T15:36:01+00:00
sorry ruin hilter celebration day pretty cool feel day dedicated would like toke,2022-04-20T15:23:22+00:00
yeah actually high typically wears hours even novice users saying quite likely first time user end bit shook yeah another way look whole thing unlike alkaloid drugs cannabinoids fatty acids completely take receptors like tickled completely blocked soft drug ultimately good thing much worry,2022-04-20T15:12:55+00:00
around pot block couple times paranoia sometimes much weed healing feeling something adverse like try get calm possible explore exactly reacting usually couple minutes master feeling least get point ride cbd also take edge fits receptors better thc making paranoid override intense high lastly super cool theres strong stuff dispensaries mean best wary dosing next time,2022-04-20T14:43:39+00:00
uh weird thing conclude people would alive use marijuana doctors sign death certificates pretty regularly cases put marijuana primary contributing factor,2022-04-20T14:41:53+00:00
nail polish remover dish soap clean wall remover first u wash clean dish soap u use sponge,2022-04-20T14:38:43+00:00
happy cake day fellow fan,2022-04-20T14:31:55+00:00
happy day sitting florida dispensary happy happy joy joy got love,2022-04-20T14:31:05+00:00
plan trying bring anything back us need town thanks,2022-04-20T14:24:07+00:00
nope got soooo easily absolutely problems whatsoever also look like age say nicotine,2022-04-20T14:20:38+00:00
went exact thing buddy started cbd thc bud slowly worked way back vaping cannabis smoking makes way anxious,2022-04-20T14:19:52+00:00
yea put cart bat onto carry threw mfs shit worked,2022-04-20T14:18:23+00:00
get caught made safely sadly legal yet cannabis something regular bring easy process overthinking gave carry onto basket gave tsa people got back like min easy,2022-04-20T14:17:39+00:00
uphill battle worth enough people sign jordan worried reelected would probably change mind anything work jordan since would throw mother bus thought good,2022-04-20T14:06:14+00:00
believe everyone saying correct canada legal throughout country like us supposed bring customs buy canada use canada,2022-04-20T13:51:48+00:00
