body,created
poison happy fun bong acetone fix real acetone nail polish remover stuff perfume horrible real acetone great organic solvent rinses away clean water,2022-04-24T19:16:45+00:00
difficult dumping,2022-04-24T19:16:45+00:00
know downvoting even worse post history shows posted first came posted afterward,2022-04-24T19:16:36+00:00
dude skatepark right kids wearing jncos,2022-04-24T19:16:20+00:00
play shake roulette today lol sometimes super fire fallen buds sometimes straight leaves tbh always vapes great volcano mighty going flow today ever add kief concentrates kief,2022-04-24T19:16:18+00:00
itd def worth money get little kitchen scale see getting bought one years ago use daily tracking food works like charm recommend one like want,2022-04-24T19:15:54+00:00
fried haha,2022-04-24T19:15:53+00:00
friend smoking macrobiotic soup started life earth,2022-04-24T19:15:52+00:00
make lazy lethargic eating heavy meal people go negative side effects weed smile mild least worst smoke allergy said ive smoked years heavily also worked hour weeks baked hit gym baked gone hiking baked think really depends person maybe even though done heavy stoners one seemed issue would suggest lot people smoke cope people lazy fault based personal experience observations others weed make lazy,2022-04-24T19:15:37+00:00
remembers triple soul plenty hidden pockets hustling gear,2022-04-24T19:15:10+00:00
always put little chunks hash bowl loose weed love good time bomb,2022-04-24T19:15:07+00:00
get back another years might know something,2022-04-24T19:15:02+00:00
smoke day two know everyone different started years ago time stopped multiple reasons mainly jobs shortest break day longest two years full two years smoked couple times house also lot smaller timeperiods probably afraid able quit actual quiting process like said know everyone different,2022-04-24T19:14:44+00:00
snake grass joint weed little hash rolled long skinny thread,2022-04-24T19:14:17+00:00
mfs weird thinking gs fit inch bag,2022-04-24T19:14:14+00:00
thought ten year mark tells anything,2022-04-24T19:14:14+00:00
best luck friend,2022-04-24T19:14:12+00:00
kinda gross long swallow use screen,2022-04-24T19:13:52+00:00
first constitutes bad friend second swish around sludge solid,2022-04-24T19:13:49+00:00
would rather eat entire dominos chicken bacon ranch thin crust pizza puke cup chug cold throat would take one hit guy respectfully,2022-04-24T19:13:35+00:00
accounts must three days old must positive comment post karma allowed post comment r trees please ask moderators approve comment post exceptions rule learn karma reddit works visit bot action performed automatically please contact moderators subreddit message compose r trees questions concerns,2022-04-24T19:13:09+00:00
quick easy fix like,2022-04-24T19:12:51+00:00
u smokeymcherb says maybe root rot agree best watering advice seen says water drainage let dry easy pick dry roots need exposure air well water,2022-04-24T19:12:51+00:00
enough water got water la river,2022-04-24T19:12:24+00:00
dragonfly nymph steals hit outsmokes,2022-04-24T19:12:19+00:00
know used say things first time saw doubted started working industry people much smarter real experience showed otherwise fact try push prices first try prove think smoke better weed says lot good one,2022-04-24T19:11:52+00:00
bro used swamp water fill bong smh,2022-04-24T19:11:46+00:00
spending first minutes high looking map road binoculars ladder,2022-04-24T19:11:45+00:00
brother weed friend heathen must brought light,2022-04-24T19:11:36+00:00
comparing apples oranges guy smoke lazy whole generalization weed angry separate different generalization booze decade plus functional alcoholic rarely raise voice get angry people life violent booze valid true matter kind addict responsibility actions sits shoulders noone nothing else,2022-04-24T19:11:28+00:00
would liked gunter,2022-04-24T19:11:19+00:00
broke weed already im looking saddnes cant decide doin today,2022-04-24T19:10:41+00:00
change water clean downstem,2022-04-24T19:10:40+00:00
tbf tree acting like mj,2022-04-24T19:10:29+00:00
,2022-04-24T19:10:08+00:00
man gross deepest sympathies,2022-04-24T19:09:43+00:00
cannot believe us citizens know lol new information,2022-04-24T19:09:43+00:00
whelp sold wish luck trying make one haha,2022-04-24T19:09:17+00:00
keep water jar cleaning bong puts back,2022-04-24T19:09:11+00:00
smoked reefer cigarettes never interesting offer occurred,2022-04-24T19:09:04+00:00
accounts must three days old must positive comment post karma allowed post comment r trees please ask moderators approve comment post exceptions rule learn karma reddit works visit bot action performed automatically please contact moderators subreddit message compose r trees questions concerns,2022-04-24T19:08:55+00:00
feel way sometimes good acknowledge honestly space frequency try smoke less,2022-04-24T19:08:39+00:00
honestly dont know understanding less water less chance splash mouth volume smoke build bigger hit,2022-04-24T19:07:37+00:00
relate probably clean pipe every months lol,2022-04-24T19:07:23+00:00
nice would like one regular finn maybe ice king,2022-04-24T19:07:10+00:00
really thought paints plate back tbh,2022-04-24T19:07:04+00:00
sure man whatever lol,2022-04-24T19:07:01+00:00
take turd toilette use bong,2022-04-24T19:06:33+00:00
mean bong horrible water got go change water thought normal thing,2022-04-24T19:06:32+00:00
warm water makes hit softer cold water cools smoke hot water softens try,2022-04-24T19:06:04+00:00
wash beard shampoo conditioner treat bead oil mine always smells like sandalwood matter much smoke,2022-04-24T19:06:02+00:00
pull ash stem last hit get dirty fast lord dude needs change water lol,2022-04-24T19:05:46+00:00
dumb idea works h crack lungs absorb thc quickly point inhaling smoke containing almost nothing gets high,2022-04-24T19:05:45+00:00
extremely dramatic replies paragraph describing upset literally care man simply making joke name ironic obviously trouble lmao,2022-04-24T19:05:41+00:00
know different places one yellow filter,2022-04-24T19:05:32+00:00
might find whole new species tardigrade surprised,2022-04-24T19:05:22+00:00
puffs passes thanks,2022-04-24T19:05:15+00:00
former new mexican residing another state people tell english fantastic skin pale south border used give people history lessons tedious usually unappreciated,2022-04-24T19:05:11+00:00
dont step puddles,2022-04-24T19:05:02+00:00
threw looked better,2022-04-24T19:05:00+00:00
extremely facetious dramatic mild disagreement going around anxious upset people thinking weed makes lazy anything good job falling ridiculous username way people like respond exact way rather argue merits position lets know take seriously,2022-04-24T19:04:43+00:00
perfect celebrations haha,2022-04-24T19:04:41+00:00
believe man calls majestic king,2022-04-24T19:04:32+00:00
try look first,2022-04-24T19:04:10+00:00
exactly seen right lol wonder average smoker would say seeing tropicana cookies getting wash haha,2022-04-24T19:04:10+00:00
forbidden choccy milk,2022-04-24T19:04:06+00:00
could understand dry happens best us understand would smoke though,2022-04-24T19:04:01+00:00
nice think ever watched one,2022-04-24T19:03:59+00:00
actually grams total lol def mentioned caption yeah definitely dispo quality,2022-04-24T19:03:44+00:00
saw comments piece water disregard lmao,2022-04-24T19:03:43+00:00
pods bong device,2022-04-24T19:03:41+00:00
man smoking hexxus ferngully foul,2022-04-24T19:03:34+00:00
clean mine every sesh man always think putting body smoke already bad thing bro another level wow,2022-04-24T19:03:29+00:00
wot,2022-04-24T19:03:24+00:00
brother said lol imma make giant ball grams xd buddy gonna shaken lmao,2022-04-24T19:03:22+00:00
bro smoking coffee,2022-04-24T19:03:15+00:00
cut smoke,2022-04-24T19:03:10+00:00
mean bong look horrible rip fresh water sludge,2022-04-24T19:03:04+00:00
cash app bucks xd,2022-04-24T19:03:00+00:00
mentioned extra smoked blunt earlier lol really really strong stuff,2022-04-24T19:02:54+00:00
know isopropyl absolutely resin stuck glass nice try,2022-04-24T19:02:52+00:00
well case hope new bud falls ur lap soon brother,2022-04-24T19:02:43+00:00
hell yeah sometimes shake underrated fuck played sometimes utter disappointment really stems seeds disappointment like sugar leaves disappointment still smokeable still gets baked leafy taste know mean bad think people like vape taste normally vape chronic hate,2022-04-24T19:02:38+00:00
might want double check facts friend washington dc state federal city embarrassed,2022-04-24T19:02:34+00:00
gotta swirling around bit way neck bong cloudy main chamber crystal clear explains black gross,2022-04-24T19:02:28+00:00
cess pool,2022-04-24T19:02:26+00:00
bad,2022-04-24T19:02:25+00:00
damn bag,2022-04-24T19:02:16+00:00
fuck,2022-04-24T19:02:15+00:00
wish could feel way put favorite strain dry herb vape literally tasted like feet temps,2022-04-24T19:02:08+00:00
change water brother broke bing right cleaned day,2022-04-24T19:01:55+00:00
honestly tell serious lol get foot metal fence polls stand drive poles inches tree trunk wrap rope around tree poles keep falling,2022-04-24T19:01:53+00:00
meh spoiled thou,2022-04-24T19:01:05+00:00
afraid see results bong water,2022-04-24T19:01:00+00:00
someone convinced porn came lol like ancient artifacts porn lol,2022-04-24T19:00:59+00:00
anybody know l,2022-04-24T19:00:54+00:00
kief end made hit right first smoked good though,2022-04-24T19:00:50+00:00
bad never seen bong water dirty totally lazy reason dumping shit,2022-04-24T19:00:47+00:00
meant plans grow outdoors would need somewhere germinate seedlings big one programmable believe,2022-04-24T19:00:35+00:00
idolizing marijuana man saying lazy problem weed probably poor executive functioning brought illness using weed,2022-04-24T19:00:21+00:00
bruh change fucking water,2022-04-24T19:00:04+00:00
rude awakening goes toke dragonfly nymph grabs lip,2022-04-24T19:00:01+00:00
fact one minute still probably exaggeration long takes makes even worse,2022-04-24T18:59:55+00:00
click click click,2022-04-24T18:59:43+00:00
obviously cleaned yucky stuff rinsed yet,2022-04-24T18:59:36+00:00
pay eighth minimum thats local pricing live place relatively low prices actually likely around dollar mark usually spend though yet find purple weed turns bong water purple post combustion sorry shit much dye spread even anthocyanins plant would genetically modified shit would probably look like broccoli,2022-04-24T18:59:32+00:00
bong water week look bad fuck,2022-04-24T18:59:32+00:00
pay smoke sounds like infection waiting happen,2022-04-24T18:59:25+00:00
idk free bong rip worth,2022-04-24T18:59:20+00:00
say crying room bro literally digging fragile hole deeper lmao,2022-04-24T18:59:07+00:00
water fucking gross water level even high enough fucking grossss,2022-04-24T18:59:06+00:00
better clean give research facility god knows many new species might cultivated would shame would go drain get new one,2022-04-24T18:59:00+00:00
probably closer consistency maple syrup water point,2022-04-24T18:58:41+00:00
like weed makes lazy narrative weed also everyone seem think mild disagreement means crying corner shit,2022-04-24T18:58:28+00:00
cool nothing able handle substances everything consent,2022-04-24T18:58:19+00:00
buddy mine fire tropicana cross thing genetic modification possibly mutation good ol fire buds looked like,2022-04-24T18:58:16+00:00
water fucking brown,2022-04-24T18:57:24+00:00
something think acceptable,2022-04-24T18:57:10+00:00
bro love mine real got half oz shake absolute steal crappy stems anything either pretty good,2022-04-24T18:57:07+00:00
home town lc used work call center customers asked always go new mexico wait visit family stop legal shop,2022-04-24T18:57:04+00:00
water better smoother smoke,2022-04-24T18:57:03+00:00
friend dirty stoner,2022-04-24T18:56:25+00:00
bro fuckin change water change every sesh sugg sake hard,2022-04-24T18:56:20+00:00
currently looking options,2022-04-24T18:56:12+00:00
pretty exspensive white owls,2022-04-24T18:55:46+00:00
man dropped truth whole reddit stoners hate click find,2022-04-24T18:55:37+00:00
small shop connected liqour store lol,2022-04-24T18:55:36+00:00
fucking looooooooove smell fresh moist bud mmm mmm,2022-04-24T18:55:27+00:00
thanks man also nice see someone recognize honestly never get discouraged anyway usually ones smoke real shit try spread false info never seen yes people tamper bud happen completely naturally,2022-04-24T18:55:17+00:00
happily let enjoy hangover eat mushrooms keep mentioned gram btw grams,2022-04-24T18:55:12+00:00
even anthocyanins would need much plant would genetically modified probably wouldnt even look like weed anymore,2022-04-24T18:55:11+00:00
bro puts whole eight da blunt every time,2022-04-24T18:55:04+00:00
good add alternative strategy something like get shit together grown boy cleaning refilling bong takes like minutes step bro get bit lazy sometimes friends help keep eye game like tell friend bit less shitty way puts side opposite like know shit dirty favour clean bong lol,2022-04-24T18:55:04+00:00
real,2022-04-24T18:54:59+00:00
right smoke weed mean inherently lazy act like experiencing toking torpor haha,2022-04-24T18:54:46+00:00
holy shit nearly threw im eating breakfast dog,2022-04-24T18:54:46+00:00
friend drank something similar dare promptly threw friends dared whole thing seemed pretty stupid part spectator really ironically one get wet karma bitch,2022-04-24T18:54:29+00:00
ay scooped half ounce tax dank ass shit delicious candy love dispensary whole menu discounts stack,2022-04-24T18:54:26+00:00
another reason switch concentrates,2022-04-24T18:53:49+00:00
believe lol friend smoking dirt incredibly lazy cleaning times never seen water look anything like apparently weeks,2022-04-24T18:53:46+00:00
seriously mistake norwegian flag confederate flag even look similar honestly embarrassing dumb people country,2022-04-24T18:53:43+00:00
porter fanboy always glad create chance new fan,2022-04-24T18:53:35+00:00
natural selection buddy sorry,2022-04-24T18:53:16+00:00
bragging dyed weed,2022-04-24T18:53:10+00:00
never clean dry pipes wet pipes get cleaned day use little shake rinse nothing fancy needs,2022-04-24T18:53:06+00:00
popcorn nah gave bunch shake bag want nuggets,2022-04-24T18:53:03+00:00
yummi bowl buy,2022-04-24T18:52:52+00:00
going trying polkadot bar first time week previous bars disappointment tho already tried,2022-04-24T18:52:43+00:00
yep used pack e pills,2022-04-24T18:52:26+00:00
everyone minds much people,2022-04-24T18:52:01+00:00
man smoking pond water omg,2022-04-24T18:51:51+00:00
done already try hot water boiling run tap hot hits incredibly smooth forces change water bongs retain heat long tricked friends cleaning bongs regularly showing method,2022-04-24T18:51:46+00:00
friend gonna die young making decisions like,2022-04-24T18:51:42+00:00
interesting,2022-04-24T18:51:14+00:00
shabby randingo,2022-04-24T18:51:06+00:00
weed grows like couple feet high needs lot light also reeks gets ripe people tents carbon filters,2022-04-24T18:51:04+00:00
reminds wold hybrids usually half wolf half german shepherd husky piercing gaze actually howl,2022-04-24T18:50:56+00:00
try bong also might best weed,2022-04-24T18:50:48+00:00
dog ate qtips used clean dab rig hes outerspace ever since,2022-04-24T18:50:19+00:00
honestly know people leave long bong cleaning fun wanted start cleaning service,2022-04-24T18:50:16+00:00
movie swing vote kevin costner set texico,2022-04-24T18:50:15+00:00
lol say wedding news happen said wedding people drugged intoxicated without consent would make news try keep,2022-04-24T18:50:12+00:00
lmao ppl hate admit smoking weed make lazy,2022-04-24T18:50:08+00:00
vape instead smoke use bongs filter cool need make lungs suffer alternative,2022-04-24T18:49:56+00:00
bong ok change fucking water though jesus christ let get somewhat greenish brown proud black subconsciously trying kill,2022-04-24T18:49:46+00:00
mud,2022-04-24T18:49:32+00:00
love cooking herbs grow like crazy growing weed would really good seedlings height restrictions light also aerogarden light cycle far know factory setting hours light,2022-04-24T18:49:29+00:00
like understand stem glass bit dirty holy fuck takes literally second dump water fill back,2022-04-24T18:49:23+00:00
trick teach schools smoking anything pipe joint whatever always hold loosely mouth want breath plenty fresh air enough smoke enough much comfortably enjoy need cough,2022-04-24T18:49:07+00:00
even water looks like mud put mouth much less pull wtf,2022-04-24T18:49:03+00:00
empty floor,2022-04-24T18:48:56+00:00
many family weddings news magazines apparently broadcasted news cant happen,2022-04-24T18:48:56+00:00
guy trolling way two weeks use leave water months never gets brown,2022-04-24T18:48:54+00:00
shit molds like probably growing brand new organism,2022-04-24T18:48:50+00:00
depression lazy think tastes bad,2022-04-24T18:48:47+00:00
accounts must three days old must positive comment post karma allowed post comment r trees please ask moderators approve comment post exceptions rule learn karma reddit works visit bot action performed automatically please contact moderators subreddit message compose r trees questions concerns,2022-04-24T18:48:38+00:00
haha know texico right border hilarious reminds kanorado right border kansas colorado much going though lol,2022-04-24T18:48:34+00:00
even preface saying absolutely embarrassed state pieces something else entirely,2022-04-24T18:48:18+00:00
dont ppl change water every sesh dont get,2022-04-24T18:48:18+00:00
could rinse piss would still,2022-04-24T18:48:17+00:00
finally actual explanation state hur hur name walter hartwell wh,2022-04-24T18:48:16+00:00
kids able kids,2022-04-24T18:48:16+00:00
bad bro trust,2022-04-24T18:47:48+00:00
strain op im assuming trop cross idk,2022-04-24T18:47:48+00:00
call bullshit way inside bong clean water dirty,2022-04-24T18:47:27+00:00
worse seen lived good apartment building chicago little guy would come every morning thing little cover made table asked kept table told rain water got smile wave boys,2022-04-24T18:47:25+00:00
cleaned mine weeks say looked better still,2022-04-24T18:47:24+00:00
without started rotating strains smoke strain every days trick days even better need lot weed lol,2022-04-24T18:47:22+00:00
holy shit talk fragilestoner lol come man know exactly saying decided going obtuse,2022-04-24T18:47:12+00:00
look anthocyanins dye surprisingly,2022-04-24T18:47:12+00:00
like smell tbh taste love weed tolerate lol,2022-04-24T18:46:47+00:00
fun fact mexico years,2022-04-24T18:46:36+00:00
put ur ass,2022-04-24T18:46:22+00:00
fyi havent bought yet trying find worth buying slot version herbs works like magic basil grew huge even tiny dark apartment,2022-04-24T18:46:17+00:00
would look getting earth anchors could slowly ratchet back labor intensive option would carefully dig tree adding cohesive soil kind looks like soil loose judging background looks like pretty dry area reminds lot colorado lot designer neighborhoods junk soil thrown front house grow grass soil typically go much deeper like couple feet also short squat trees bushes typically survive better windier areas also recommend trimming top taller trees fall victim high gusts much easier,2022-04-24T18:46:12+00:00
chew gum mouthwash first works like hotbox good times,2022-04-24T18:45:59+00:00
one states crashlanded aliens,2022-04-24T18:45:41+00:00
really understand people never change water like hard wants smoke something tastes like mold standing water,2022-04-24T18:45:41+00:00
probably packs weed ontop ash,2022-04-24T18:45:32+00:00
want buy microscope experiments bong water,2022-04-24T18:45:16+00:00
broad generalization fellow chronic user,2022-04-24T18:45:15+00:00
nice see someone knows talking op probably got straight fire probably tropicana cross guess water purple,2022-04-24T18:45:07+00:00
yea acts like joint hits bowl lights everything called time bomb,2022-04-24T18:45:05+00:00
honestly looks like threw dirt took pic hope isnt real,2022-04-24T18:45:01+00:00
rather sober takes minutes clean bongs multiple daily every day,2022-04-24T18:44:59+00:00
naah dragon ball,2022-04-24T18:44:45+00:00
lord help us downstem isnt even water,2022-04-24T18:44:35+00:00
bro taste must immaculate seriously though please change water give good isopropyl rinse,2022-04-24T18:44:30+00:00
changed water every day bong using years,2022-04-24T18:44:18+00:00
love name,2022-04-24T18:44:15+00:00
like get little mouth accident,2022-04-24T18:44:14+00:00
need new friend,2022-04-24T18:44:10+00:00
used skate shoes big pocket tongue,2022-04-24T18:44:05+00:00
decade plus functioning alcoholic work hours week violent booze love weed much next guy stop cringe idolization marijuana drug negative effects like substance,2022-04-24T18:44:01+00:00
canon macro godox lighting,2022-04-24T18:43:57+00:00
bro give ya bong water buh ha ha ha ha ha,2022-04-24T18:43:30+00:00
awesome hopefully tax isnt crazy im il still convenient go store awesome legally grow without medical card il u need medical card grow almost weed sellers around big business cool see positive things new mexico,2022-04-24T18:43:30+00:00
accounts must three days old must positive comment post karma allowed post comment r trees please ask moderators approve comment post exceptions rule learn karma reddit works visit bot action performed automatically please contact moderators subreddit message compose r trees questions concerns,2022-04-24T18:43:27+00:00
everyone tripping anthocyanins bud cause bud purple guy probably taking snaps chunks got water turning water purple keep smoking stuff op probably straight fire,2022-04-24T18:43:10+00:00
u take iphone,2022-04-24T18:42:29+00:00
bad,2022-04-24T18:41:52+00:00
except tell okay gonna smoke joint make rest errands breeze next thing know spent hours playing rocket league scrolling tiktok,2022-04-24T18:41:48+00:00
weeks kidding water biohazard,2022-04-24T18:41:48+00:00
least change damn water like get washing bong time gotta change water,2022-04-24T18:41:47+00:00
accounts must three days old must positive comment post karma allowed post comment r trees please ask moderators approve comment post exceptions rule learn karma reddit works visit bot action performed automatically please contact moderators subreddit message compose r trees questions concerns,2022-04-24T18:41:37+00:00
decent smell bud hate smelling like sesh smelling situation taboo,2022-04-24T18:41:36+00:00
prices nm,2022-04-24T18:41:13+00:00
friend us government bong flint michigan,2022-04-24T18:41:10+00:00
w man wish could get france,2022-04-24T18:41:07+00:00
time,2022-04-24T18:41:07+00:00
borderline germaphobe sole reason stick carts prerolls edibles haha,2022-04-24T18:41:05+00:00
never understand hard people change bong water wish friends lungs luck,2022-04-24T18:40:57+00:00
need find lighter app tbh,2022-04-24T18:40:53+00:00
rest got ripped hard share source fix dream amount,2022-04-24T18:40:49+00:00
thank,2022-04-24T18:40:49+00:00
three phenos pbb grown friend mine one best parts circle growers able trade samples,2022-04-24T18:40:46+00:00
looks phenomenal lovely piece,2022-04-24T18:40:23+00:00
boof,2022-04-24T18:39:40+00:00
sewer water interesting choice filling bong,2022-04-24T18:39:36+00:00
internal chamber collects resin much like hollow glass pipe except bowl cap comes easy access cleaning scoop run pipe cleaners airholes,2022-04-24T18:39:34+00:00
camping lost beanie morning searched bit found put head went take leak naturally continued searching like minutes done lol,2022-04-24T18:39:18+00:00
get scared thinking trying think organ disappearing lol,2022-04-24T18:39:14+00:00
often forget new mexico whenever hear name first thing think oh yeah state fuck talking region mexico,2022-04-24T18:39:10+00:00
buds looks great personally think flavored wraps ruin bud hey chief smoking j right meow,2022-04-24T18:38:49+00:00
accounts must three days old must positive comment post karma allowed post comment r trees please ask moderators approve comment post exceptions rule learn karma reddit works visit bot action performed automatically please contact moderators subreddit message compose r trees questions concerns,2022-04-24T18:38:39+00:00
disgusting hard dump end night refill tomorrow use least clean company,2022-04-24T18:38:27+00:00
ive effexor several years mostly use high cbd low thc maybe need break get cbd,2022-04-24T18:38:25+00:00
eat anything particular friend house,2022-04-24T18:38:16+00:00
bro looks like need change water change get pneumonia,2022-04-24T18:37:47+00:00
would say thought counts weed brownies weed definitely stoner fail lol,2022-04-24T18:37:36+00:00
never use even know rn gross dirty would eventually clean,2022-04-24T18:36:44+00:00
use dish soap help pieces occasionally long rinse really good water completely fill times dish soap dilute smell taste,2022-04-24T18:36:23+00:00
sympathies,2022-04-24T18:35:56+00:00
would stayed illegal buddy people like fall,2022-04-24T18:35:41+00:00
even especially put salt bong swish around real good,2022-04-24T18:35:35+00:00
people like stoner stereotypes come,2022-04-24T18:35:18+00:00
rare small amounts helpful reducing stress therefor helping symptoms bigger amounts often fuck mood days making less centered regular months fucks memory even usually effects cease days weeks though,2022-04-24T18:35:13+00:00
could also root rot tbh pull one pot inspect roots careful though brown slimy need enzymes asap,2022-04-24T18:35:07+00:00
tremendously even,2022-04-24T18:35:01+00:00
stopped smoking pieces like friend embarrassed smoke piece cleaned dead cockroach inside keep water fresh pieces clean ever since,2022-04-24T18:34:42+00:00
gagged looking fucking gross pour refill water day least,2022-04-24T18:34:20+00:00
bong water looks like coffee ya done fucked,2022-04-24T18:34:16+00:00
aw poor guy sound particularly awful dog eat,2022-04-24T18:33:35+00:00
