body,created
much say know exactly feel alone,2022-04-05T05:02:09+00:00
news looks like freed space people show believe love mom around hope find really cool person add life,2022-04-05T04:59:04+00:00
yes feel like ultimatum fact see living like rest life stopped months really focused health things going really well got shitfaced drowned,2022-04-05T04:41:51+00:00
best thing ever mil husband remove children disfunction went something like go go see relationship go therapy together whatever two need want children contact unless see husband healthy relationship two adults figure offering children part happening tried done energy reserved children people show believe five years ago children see allow send card month took three therapy sessions handful months texting husband came conclusion done going lie sad best know god working focus think mil sends husband text every none business,2022-04-05T04:30:50+00:00
agree ultimatum,2022-04-05T04:29:36+00:00
agree ultimatum,2022-04-05T04:26:41+00:00
past weeks q gone binges lasted days time day brings pack home musician go tour first time years since pandemic started usual ends coming home late late hour barely find bathroom urinates bathroom floor learning detachment longer clean mess resent simply take picture wait awake let know entire album phone let know showing evidence tell deal son wakes recent binge apologized promised go meeting soon back tour fact putting month shows little takes seriously convenience preparing tour holding breath told afraid losing actions say otherwise realize choosing son every time drinks much love cannot wait leaves night attend first alanon meeting let know attend first meeting day leaves knows lot people nervous attend meetings normal wednesday could come soon enough ready,2022-04-05T04:21:32+00:00
dig heels especially baby involved sell breathalyzers pharmacies need show sober visiting refuses blows hot answer,2022-04-05T04:17:05+00:00
yes way thinking issued ultimatums several times never followed finally realized person needed ultimatum instead saying ex spouse one arrest done looked mirror said one day doormat unheard many either dump stop complaining embrace life family member unrepentant addict fact enabler good partner hard going lie resulted improvement quality life incredibly good far less sympathetic alcoholics used hate know easy people around get sucked disease alcoholic seek treatment like living near chernobyl,2022-04-05T04:13:34+00:00
told husband married keeps also told live gets keeps sponsor therapist left live parents moved back month later days sobriety still married cohabitating,2022-04-05T04:10:35+00:00
healthy proud focusing recovery going gift future self thank feel free dm anytime need support best,2022-04-05T03:39:41+00:00
sober alcoholic mother alcoholic never let kids around alone never old enough manage hold ground one advice way gets sober work steps owe amends discuss thawing relationship point trust,2022-04-05T03:39:07+00:00
come harsh read message protective motherly happy confirmed feeling said last message gives strength keep pushing grateful best,2022-04-05T03:37:27+00:00
well hope consider going meetings actually working program mil life many years sure sponsor support group invaluable said many people go contact family members best family course husband would board well sound like soon maybe work program sees benefits maybe go well least family able handle situation healthiest best way,2022-04-05T03:23:46+00:00
well guess come harsh certainly understand cycle victimization happy independent minded headed career doubt mom remains right next cheering people knows consequences financial dependency proud truly also mom keep breaking cycle,2022-04-05T03:18:58+00:00
guess depends want avoided giving ultimatums end knew intention power follow ended things worked end chose,2022-04-05T03:18:48+00:00
reacting distance boundary tried boundary respect stay firm hood luck hope husband continues support point view key,2022-04-05T03:18:18+00:00
see liver spots google images think look like ovalish bruises freckles varying shades reddish purple inches size based others responses thinking likely encourage see doctor bruising much apparent cause appreciate taking time share kind words experience helps lot sorry going partner painful see someone love suffer hope take care well send best,2022-04-05T03:18:04+00:00
personally find comment meaningful thank,2022-04-05T03:11:43+00:00
know hard maybe looking wrong way maybe asking care much someone treats poorly done healing leaving heal severe emotional wounds gone meetings many find help therapy focusing codependency deserve joyous happy free sometimes takes getting help,2022-04-05T03:06:37+00:00
alcoholic mean much problems r alcoholicsanonymous better go meetings work program best work,2022-04-05T02:55:29+00:00
good job sticking boundaries getting stuck unhealthy cycle really difficult break yeah slowly killing part excruciating watch start whatever help realize short enabling nothing much miss ex fights drug use disappearing completely showing high wasted etc special kind hell glad longer dealing,2022-04-05T02:49:00+00:00
way see illness progresses late stage addiction takes everything kind way cancer disease takes time nothing anybody make easy thing accept lessen blow make little understandable unfortunately foresee ex going path talk anymore want dragged shit anymore want enabling worsening mental health suffer anxiety hates badly think would rather choose death recovery came close death quite times would say times know knows many dont well hurt people immensely come terms fact illness taken everything good life including physical mental health finances relationship well non drug using friends part change soon sure survive attend alanon electronic meetings find others shoes best thing take care going bad path fair take suffer emotionally create distance look situation objectively without guilt totally understand feeling guilty sometimes still put earth save anyone neither fact trying futile attempt chose sanity end hope take care,2022-04-05T02:44:55+00:00
would struggle commit going every week would like drop absolutely fine expectation every week even coming back expectation anything one things like remind folks situation interested wary anything meeting share anything sit listen friend says first five meetings went sit box kleenex cry even able say anything worked fine,2022-04-05T02:43:38+00:00
going bet vows sickness health understanding would emotionally abuse maybe unspoken agreement would takes stay sober horrible things happen people every day use excuse hurt spouses hopefully go get back working maybe therapist understands codependency alcoholism,2022-04-05T02:43:21+00:00
took long time realize boundaries needed ultimatums sticking boundaries hard see people care slowly killing addiction,2022-04-05T02:37:08+00:00
post held review part measures moderator approve post soon happened within hours please feel free message moderators bot action performed automatically please contact moderators subreddit message compose r alanon questions concerns,2022-04-05T02:35:14+00:00
small part regrets giving ultimatum left ex lying staying clean umpteenth time shit put although tried damn best get help many times relationship remind burden bear saying wanted change earlier keep around took stress friends try convince seek help never works think ultimatum could make addict take break rare get choose sobriety long term boundaries better protect,2022-04-05T02:34:47+00:00
think perhaps much fall love husband alcoholic version love husband ends earth man married yes knew addict ended sober relapsing years ago say though like version back forth gets better falls gets better falls destroys things literally violent sense gets better know cycle want man love disease monster thats taken hostage,2022-04-05T02:32:40+00:00
first time poster q yrs waiting lease july finally make split gone high functioning functioning day fine drunk stoned blob venting disappointed let go long hard time financially stable try establish boundaries get let sometimes,2022-04-05T02:18:12+00:00
ones tried worked addicts want change force get help get better much anything really,2022-04-05T02:17:14+00:00
worked first wife told either quit done told problem left found much better husband twins years divorced actually got sober give credit hanging enabling years importantly grateful left drug hurt,2022-04-05T02:10:52+00:00
know know al anon teach love take care matter,2022-04-05T01:39:19+00:00
one thing learned idea detaching love means loving someone enough distance causing others harm still supporting want get better really taking care first without anger desire fix recover might different actual meaning helped lot hate look first foremost,2022-04-05T01:24:13+00:00
similar want want fall love sure possible something want,2022-04-05T01:21:53+00:00
welcome recovery attend meetings meetings learned cause alcoholism control cure also learned allowed set boundaries also make empty threats ready back mean say say mean say mean also covering lying hiding sign disease alcoholism famous aa saying one many thousand enough link detachment leaflet link local virtual meetings almost check link attend via email zoom phone meetings local meetings virtual country state province also google al anon city state please see posts comments info links good luck,2022-04-05T01:19:48+00:00
hey appreciate taking time read post reply please think thought things time victim abuse dependent emotionally financially tied children naively believes need father much hates always worried believe terrified see spiral alone much would easy label terrible mother loving person despite spent far long resenting blaming end day weak person terrible mother understand coming though wish invalidate experiences thank reply,2022-04-05T01:18:35+00:00
post held review part measures moderator approve post soon happened within hours please feel free message moderators bot action performed automatically please contact moderators subreddit message compose r alanon questions concerns,2022-04-05T01:04:09+00:00
depends mean worked issued mine years together married chose porn instead correction disease chose things divorce papers sitting judge living beach fl sob sometimes angry snap done done future long story short go ahead give prepared walk rarely goes way want,2022-04-05T00:57:13+00:00
ok going put bookmark adult child alcoholic take years experience earth chew mother allowed father crap necks long point sound like touch ptsd doubting intelligent educated capable woman sorry disagree good mother weak person allowed kids traumatized know love someone exact thing say sorry get soon take sibling heck take mom three together figure way make paths let dad stay favorite company sounds harsh know,2022-04-05T00:49:51+00:00
thanks clarification,2022-04-05T00:43:15+00:00
bars right driving home drunk think wanted ultimatum would reason quit disease keeps winning disease brain q controlled break telling stop intervention backfired,2022-04-05T00:34:57+00:00
husband years recovery honestly first agreed needed help know going stay go gave grace know wanted take time get help alanon counseling personally much hurt pain resentful towards thankfully rehab excellent spousal support really encouraged focus allow husband focus relapse months nearly end us luckily built good support network support put boundaries force used crave certainty desperate know terrified regretting decision stay years time honestly take one day time make decisions based know reserve right change mind situation changes marriage currently better ever regrets taken lot support get comfortable tomorrow may relapse might walk away happy still continue attending alanon support matter happens,2022-04-05T00:11:51+00:00
ultimatum boundary longer willing remain marriage free information chose years sober still married,2022-04-05T00:05:01+00:00
backfired,2022-04-05T00:00:44+00:00
describing essentially full time caretaker role time person caring cure right palm hand years exhausted rightfully caring purse empty rightfully feeling completely understandable zero people judge one working relationship eventually feels pointless wish best,2022-04-04T23:59:49+00:00
post held review part measures moderator approve post soon happened within hours please feel free message moderators bot action performed automatically please contact moderators subreddit message compose r alanon questions concerns,2022-04-04T23:51:19+00:00
rarely works either,2022-04-04T23:18:22+00:00
think describing sometimes called liver spots really like large freckles liver totally healthy couple cirrhosis liver got bad abdomen ballooned course weeks looked like months pregnant eyes skin turned yellow visibly yellow lot pain symposiums look super obvious weird thing related liver disease almost invisible really obvious gets bad know even mom likely realise sorry going much except find ways take care short term good distraction long term really done,2022-04-04T23:14:35+00:00
sorry going totally relate gaslighting manipulation like totally different person known last years fight flight teary eyed cuddled cat wanting wish away toxicity know first thought could help would get better realization even wanted needs good coping skills different mindset give much love feel losing battle hurts hugs tonight,2022-04-04T23:00:35+00:00
q knows problem refuses consider marijuana past cocaine use might cause rehab yet really hope figures gets sober worked really hard adjust lifestyle narcolepsy worked really hard improve ptsd know live constant chaos worry trying living separately months sure filling divorce end wish things different maybe diagnoses could make wishing best op,2022-04-04T22:58:37+00:00
super sure find groups near live suburb hour away large city seems groups,2022-04-04T22:48:42+00:00
honestly say feel exactly position right partner received bad news work sent bender tonight much usually drinks gets aggressive gaslighting manipulative drinks moment fight flight moment tears know way pick properly leave tbh even fall continue ultimately means divorce absolute best friend finding well alone,2022-04-04T22:41:19+00:00
ends whenever decide ends many people go contact alcoholics addicts lives get old enough owe anything mother deal adult get merry go round time going meetings working program helps many people others combine therapy codependency issues many ways worked many us,2022-04-04T22:39:01+00:00
really good really tough question probably lot individual variability loved wife really proud hung married friends thought got best one remember walking around grocery store thinking got best one different still together glad still together note experience many others different experiences feelings changed lot really bad found repugnant angry turning bitterness hate took divorce considerations far going see lawyer ultimately decided better make work clear well enforced boundaries divorce final eject lever need call make stay go concluded could healthy willing able behave way prevent thriving staying least option willing able wilting plant environment duty try get better environment healthy first gratitude willing able give environment healthy perfect exactly like want definitely one healthy thing thrive easy know gratitude seed new relationship,2022-04-04T22:31:21+00:00
healthy boundaries help help learn futility keeping track give support group always help guide healthiest directions,2022-04-04T22:25:06+00:00
throwing everyone gets dui problem continue make poor choices around cause concern genuinely reflect choices make take action make responsible decisions feel confident acting healthy ways treat wake call actions consequences repeat mistake states program first offenders classes community service get charge expunged,2022-04-04T22:16:23+00:00
yeah judge alcoholic metrics throwing think blackout causing problems mother help guys whether thinks wants get help alone,2022-04-04T22:04:24+00:00
still living point cannot deal anymore fine crack break spectrum mask fuck whilst goes bender something major upset balance hit rock bottom yet think going leave,2022-04-04T21:47:09+00:00
trying finally got rehab really well days sober proud always planned move back go couples counselling everything could stay together hard know feel deep really get everything wanted try really love much sure kind love still left last week neighbor things changed talked amazing time could feel conversation situation slightly inappropriate married person care time found thinking person much night occurred feeling feelings husband anymore things kept day dreaming person wife thinking think little late sad feelings unexpected go divorce sell house kids hopeful excited person help way feel guess happy finally figured,2022-04-04T21:44:02+00:00
completely agree probably best thing still help work emotional damage occurred relationship deserve much better alcoholic hope find happiness deserve,2022-04-04T21:37:00+00:00
wow hits home almost identical story feel like try kids want offers current self best luck following learn well,2022-04-04T21:33:30+00:00
support go hey heard aca meetings really help people shitty situation many codependency issues maybe could find good therapist understands alcoholism codependency issues maybe encourage mother thing sees changing life unwilling definitely get therapy drug families emotional baggage,2022-04-04T21:23:30+00:00
partner similar got really bad summer escalated hospitalizations detox month rehab september time went rehab done knew trust relationship continued blame soon came home told wanted separate stayed living house separated last month amicable toddler coparent together like much coparent friend partner give need relationship trust reliability stability months sober proud,2022-04-04T21:00:33+00:00
problem know sad isolating feels right mean really know speak much future made really sad people understand painted deranged monster like man really love ill right tragic situation around said probably still better create distance mental even physical easy put addiction healthy anyone bad path time passed since breakup reflect put needs mine much let much shit slide feel like backbone walked away good feeling either work take care,2022-04-04T20:54:28+00:00
hello welcome grateful member alanon although questions valid alanon exists help support friends families heal recover disease many lenders found best way help support loved ones attending alanon meetings learn program ways helping often make situation worse alanon app meetings resources alanon website website additional information person meetings additional electronic meetings best luck,2022-04-04T20:54:01+00:00
hello welcome grateful member alcoholism disease affects around alanon program help support friends families alcoholics husband willing introduce meetings support could attend meetings family disease affecting please understand though husband open nothing like alcoholics want recovery disease point thing attend alanon meetings meetings alanon specifically aca adult children alcoholics however meeting help wishing best luck alanon app meetings resources alanon website,2022-04-04T20:37:44+00:00
sorry need glad,2022-04-04T20:22:05+00:00
thank lot learn,2022-04-04T20:21:26+00:00
alanon taught love without expectations conditions alanon also helped redefine friendship family include healthy boundaries limits cannot control people especially alcoholics people going behave way think hurts someone love relapses take personally alcoholism care love get mad diabetic friend whose blood sugar raced control get mad alcoholic whose disease races control alanon taught love people,2022-04-04T20:16:49+00:00
dealing alcoholic child made similar remarks spoken needing move really hard even know,2022-04-04T20:14:51+00:00
sorry going also leave partner last bender dating bc knew damn well last ever though seemed one much going behind scenes sucks pushed away hurt wanted hurt back point sense could never understand felt bc numb emotions relationship without trust much relationship relationships built trust communication something likely get addict using said make easier sucks needing always strong one,2022-04-04T20:04:23+00:00
engaged similar behavior like stopped immediately graduating imagine mid kids adds whole different aspect hopefully willing admit needs help hope attend al anon meetings helped lot alc spouse,2022-04-04T19:55:45+00:00
q cruel sure loved sure hell like completely honest reason stayed thought head one would want someone divorced twice alone rest life believe knew long would take papers drawn much would cost get bank accounts everything right detoxed stayed sober turned back man fell love times would remind purposefully holding onto things person worthy love still get reminded things said still hurt best get better became problem,2022-04-04T19:45:09+00:00
thanks friend hard anyone talk real life,2022-04-04T19:40:26+00:00
thank much kind words insight speak lot truth one really knows long us around care within ability cherish every moment support mom also looking mental health,2022-04-04T19:15:28+00:00
position go hits rock bottom left shock disbelief gotten better sober months get lot help therapy feeling trust bit resentment bothers everyday feel like fallen love want make sure better place seeing worst knowing history weigh sober normal functioning person want always guard fall wagon next black throwing coming tomorrow months years honestly handle type guard married live together getting stuff sorted exit stage left love want nothing best amount pressure trust worry much ok feel way talked stuff even understands two cents going live rest life always worrying something cannot control,2022-04-04T19:03:06+00:00
hey sometimes best get real healing come put work hope find meeting helps work affect like future,2022-04-04T18:58:29+00:00
helpful hear experience know mom physical last year mentioned found liver damage though know bad lot spots arms seemed fade almost entirely sober months googled could cause believe remember seeing liver damage one possibility really right needs doctor take look confirm going also sorry went hardship sounds scary difficult go glad still thank comment sending best,2022-04-04T18:58:25+00:00
thank much thoughts kind words helps right really doctor could speak medical side,2022-04-04T18:52:55+00:00
belongs r direct help department hope focus codependency therapy maybe might want go meetings build good support system things het worse,2022-04-04T18:37:47+00:00
post held review part measures moderator approve post soon happened within hours please feel free message moderators bot action performed automatically please contact moderators subreddit message compose r alanon questions concerns,2022-04-04T18:33:44+00:00
everyone different people somehow get others late time start taking action person realizes put much energy fixing person really loved person long time,2022-04-04T18:25:34+00:00
post held review part measures moderator approve post soon happened within hours please feel free message moderators bot action performed automatically please contact moderators subreddit message compose r alanon questions concerns,2022-04-04T17:57:11+00:00
fall back like husband got sober loved enough stay get well damn hell want beat tar time took awhile healing take one day time day spends sober give thanks higher power rage journal thoughts talk counselor,2022-04-04T17:53:20+00:00
like husband always liked last years escalation ending month rehab relapse psychiatric hospital stay also like thought lot leaving felt love towards diminished changed gave chance three young kids year sober one small slip one night imagined position year stability wipe tough years preceded proud work relationship far perfect much less fractious generally happier happy stayed also knowing things could change best luck husband,2022-04-04T17:50:04+00:00
thank well said,2022-04-04T17:34:30+00:00
second meetings much zoom still find meeting anywhere time may ask introduce talking needed leave camera may also look emdr trauma specific therapy regular cbt cutting,2022-04-04T17:25:31+00:00
second meetings much zoom still find meeting anywhere time may ask introduce talking needed leave camera may also look emdr trauma specific therapy regular cbt cutting,2022-04-04T17:25:16+00:00
post held review part measures moderator approve post soon happened within hours please feel free message moderators bot action performed automatically please contact moderators subreddit message compose r alanon questions concerns,2022-04-04T17:21:48+00:00
right time work recovery thank update,2022-04-04T17:04:57+00:00
post held review part measures moderator approve post soon happened within hours please feel free message moderators bot action performed automatically please contact moderators subreddit message compose r alanon questions concerns,2022-04-04T16:59:52+00:00
fear get worse cannot focus whether condition get worse get better change leave completely also try calculus whether actions meet kind technical definition alcoholism uncomfortable unhappy much drinks something needs change side things determining something make sure safe happy,2022-04-04T16:57:00+00:00
glad remain hopeful right suffer maddening disease sometimes find peace working steps codependency sorry hear family going similar situation,2022-04-04T16:51:48+00:00
right schedule believed time go meetings lately important make time want heal thank,2022-04-04T16:48:28+00:00
thank much kind words certainly planning think take year school order make sure get younger sibling house able provide us hate come leaving mom leaving school think better different environment times kicks house happier moments gets head saying incapable living alone would make mental state worse thank validating okay actions,2022-04-04T16:45:01+00:00
